PFId,AllNm,PrjCode,OPSCodeAgg,EmgAgg,AllYr,AllSrc,OrgNm,OrgTypeId,PrjTitle,AStrDt,AEndDt,PrjDur,PrgBdg,BgdDC,BdgSC,PrjSubDt,BenAgg,PrjGM,PrjStsNm,PrjStsId,PrjStsCode,PartCode,ApprDt
21,Standard Allocation 1 (March 2020),SOM-20/3485/SA1/Prot/NGO/15224,,,2020,2,Humanitarian Integrity for Women Action,1,"Enhancing access to lifesaving child protection services to Conflict Affected and Vulnerable children facing risks of abuse and exploitation in Kahda, Daynile and,Darkenley Districts in Banadir region and Afgoye Corridor.  ",4/18/2020 12:00:00 AM,4/17/2021 12:00:00 AM,12 Months,341756.9,258229,61170,3/15/2020 8:20:07 AM,2750##3450##8100##6800,"4- Likely to contribute to gender equality, including across age groups",Project Closure,294,PRJ_PRJ_CLS,57609.2685,5/5/2020 3:20:15 PM
21,Standard Allocation 1 (March 2020),SOM-20/3485/SA1/Shelter/NGO/15158,,,2020,2,African Volunteers for Relief and Development,1,"Provide life-saving NFI assistance to 33,900 IDPs and Host communities in Baidoa through distribution of Non-Food Items to newly displaced, evicted and crisis-affected persons.",5/1/2020 12:00:00 AM,12/31/2020 12:00:00 AM,8 Months,649896.6,607380,0,3/15/2020 1:25:10 AM,10170##13560##5085##5085,"4- Likely to contribute to gender equality, including across age groups",Project Closure,294,PRJ_PRJ_CLS,129340.0290,5/4/2020 4:20:41 PM
21,Standard Allocation 1 (March 2020),SOM-20/3485/SA1/Shelter/NGO/15180,,,2020,2,Women Pioneers for Peace and Life,1,"Provision of Shelter and NFI assistance to 2,697 IDP HHs (16,182 persons) in Kaxda and Daynile districts of Banadir region.",5/1/2020 12:00:00 AM,4/30/2021 12:00:00 AM,12 Months,850040.3,743040.2,51390,3/15/2020 6:01:56 PM,2186##3246##4315##6435,"3- Likely to contribute to gender equality, but without attention to age groups",Project Closure,294,PRJ_PRJ_CLS,132709.9305,4/30/2020 8:56:32 PM
21,Standard Allocation 1 (March 2020),SOM-20/3485/SA1/Shelter/NGO/16900,,,2020,2,Horn of Africa Peace Network,1,"Provision of life-saving emergency shelter kits and NFIs to vulnerable populations with a focus on newly displaced and protracted  IDPs, and affected IDP hosts in Dollow, Luuq, and Garbaharey Gedo Region.",8/5/2020 12:00:00 AM,3/4/2021 12:00:00 AM,7 Months,1299743,1214713,0,7/14/2020 11:57:51 AM,3794##8047##4772##7111,"4- Likely to contribute to gender equality, including across age groups",Project Closure,294,PRJ_PRJ_CLS,130142.3865,8/18/2020 6:10:44 PM
21,Standard Allocation 1 (March 2020),SOM-20/3485/SA1/Shelter/NGO/16918,,,2020,2,Women Pioneers for Peace and Life,1,"Addressing the emergency shelter and NFIs needs of 2,216 IDP Families (13,296 persons) in Afgoye and Marka districts of Lower Shabelle region.",8/1/2020 12:00:00 AM,1/31/2021 12:00:00 AM,6 Months,679994.6,622180,13329,7/15/2020 9:27:28 AM,1728##2925##3324##5319,"3- Likely to contribute to gender equality, but without attention to age groups",Project Closure,294,PRJ_PRJ_CLS,132709.9305,8/14/2020 1:54:00 PM
21,Standard Allocation 1 (March 2020),SOM-20/3485/SA1/Shelter-CCCM/NGO/15159,,,2020,2,African Volunteers for Relief and Development,1,"Integrated Protection, CCCM, Shelter and WASH support to vulnerable displaced people and Host Communities in Xudur district.",5/1/2020 12:00:00 AM,4/30/2021 12:00:00 AM,12 Months,799586.2,747276.8,0,3/15/2020 12:21:11 AM,8460##11280##4230##4230,"4- Likely to contribute to gender equality, including across age groups",Project Closure,294,PRJ_PRJ_CLS,129340.0290,4/30/2020 9:11:58 PM
21,Standard Allocation 1 (March 2020),SOM-20/3485/SA1/WASH/INGO/15185,,,2020,2,Agency for Technical Cooperation and Development,2,Providing life-saving and sustainable WASH services to underserved IDP communities in Bardera,4/15/2020 12:00:00 AM,4/14/2021 12:00:00 AM,12 Months,599490.3,518232.1,42039.25,3/16/2020 8:40:46 PM,3175##3467##4569##4593,"4- Likely to contribute to gender equality, including across age groups",Project Closure,294,PRJ_PRJ_CLS,24231.1965,5/21/2020 1:32:37 PM
21,Standard Allocation 1 (March 2020),SOM-20/3485/SA1/WASH/INGO/15280,,,2020,2,Norwegian Refugee Council,2,"Integrated Protection, CCCM, Shelter and WASH support to vulnerable displaced people in Xudur districts implemented by DRC, AVORD and NRC.",4/20/2020 12:00:00 AM,7/19/2021 12:00:00 AM,15 Months,549999.3,411446.8,102571.3,3/15/2020 5:25:09 AM,4625##4797##3769##3940,"3- Likely to contribute to gender equality, but without attention to age groups",Project Closure,294,PRJ_PRJ_CLS,2567.5440,5/18/2020 1:36:35 PM
21,Standard Allocation 1 (March 2020),SOM-20/3485/SA1/WASH/INGO/15396,,,2020,2,Norwegian Church Aid,2,"WASH response for drought affected communities in Eyl district Nugaal region, Somalia.",5/11/2020 12:00:00 AM,5/10/2021 12:00:00 AM,12 Months,479379.5,444018.2,4000,3/15/2020 12:36:16 PM,2995##3750##3750##4505,"3- Likely to contribute to gender equality, but without attention to age groups",Project Closure,294,PRJ_PRJ_CLS,2407.0725,5/6/2020 4:30:24 PM
21,Standard Allocation 1 (March 2020),SOM-20/3485/SA1/WASH/INGO/15411,,,2020,2,ALIGHT,2,Provide lifesaving WASH services to most vulnerable communities living in underserved and hard to reach areas in Afmadow district in Lower Jubba Region of Somalia,4/15/2020 12:00:00 AM,4/14/2021 12:00:00 AM,12 Months,699957.6,590027,64139,3/15/2020 7:08:49 PM,7980##11820##2120##3080,"4- Likely to contribute to gender equality, including across age groups",Project Closure,294,PRJ_PRJ_CLS,54239.3670,5/6/2020 2:46:22 PM
21,Standard Allocation 1 (March 2020),SOM-20/3485/SA1/WASH/INGO/15440,,,2020,2,Polish Humanitarian Action,2,Provide lifesaving WASH services to most vulnerable IDPs members in Kaxda and Deynile district of Banadir region of Somalia,5/1/2020 12:00:00 AM,6/30/2021 12:00:00 AM,14 Months,845755.1,668238.5,122186.8,3/15/2020 6:08:11 PM,6283##8936##9955##14210,"4- Likely to contribute to gender equality, including across age groups",Project Closure,294,PRJ_PRJ_CLS,133512.2880,5/6/2020 3:55:30 PM
21,Standard Allocation 1 (March 2020),SOM-20/3485/SA1/WASH/NGO/15251,,,2020,2,KAALO Aid and Development,1,"Provision of sustainable life-saving WASH assistance to the most vulnerable drought and AWD affected communities in Eyl , Nugaal region,  Puntland",5/1/2020 12:00:00 AM,4/30/2021 12:00:00 AM,12 Months,498250,465654.2,0,3/16/2020 5:29:30 PM,2426##4050##4862##4862,"4- Likely to contribute to gender equality, including across age groups",Project Closure,293,PRJ_UND_AUD,20058.9375,5/21/2020 1:17:11 PM
21,Standard Allocation 1 (March 2020),SOM-20/3485/SA1/WASH/NGO/15332,,,2020,2,Action for Relief and Development,1,Provision of emergency and sustained lifesaving WASH services to most vulnerable crisis communities living In under served areas in Bardhera district of Gedo Region,5/1/2020 12:00:00 AM,1/31/2021 12:00:00 AM,9 Months,400002.3,373833.9,0,3/15/2020 10:48:55 AM,2550##2700##5250##4500,"4- Likely to contribute to gender equality, including across age groups",Project Closure,294,PRJ_PRJ_CLS,56967.3825,4/29/2020 1:33:24 PM
23,2020 1st Reserve Allocation	,AFG-20/3481/RA1/H/UN/15062,,,2020,1,World Health Organization,3,Emergency Response to COVID-19 in Afghanistan,3/15/2020 12:00:00 AM,12/14/2020 12:00:00 AM,9 Months,1498155,1388485,11660,3/2/2020 1:51:11 PM,200000##160000##45000##45000,"4- Likely to contribute to gender equality, including across age groups",Project Closure,122,PRJ_PRJ_CLS,54907.0881,3/13/2020 4:35:41 AM
23,2020 2nd Reserve Allocation	,AFG-20/3481/RA2/CCS/UN/15748,,,2020,1,World Food Programme,3,United Nation Humanitarian Air Service (UNHAS): Domestic services towards COVID-19 response and international airbridge,5/1/2020 12:00:00 AM,8/1/2020 12:00:00 AM,3 Months 1 Days,3699124,3473356,0,4/11/2020 1:57:25 PM,1810##490##0##0,1- Unlikely to contribute to gender equality (no gender equality measure and no age consideration),Project Closure,122,PRJ_PRJ_CLS,54543.4650,5/6/2020 11:13:35 AM
23,2020 2nd Reserve Allocation	,AFG-20/3481/RA2/H/INGO/15739,,,2020,1,World Vision International,2,Support COVID 19 response in Shahrak-e-Sabz and Clinic Area/Shaidayee Informal Site in Herat,5/1/2020 12:00:00 AM,9/30/2020 12:00:00 AM,5 Months,300000,248088.8,32285,4/10/2020 6:18:25 PM,14532##14532##21798##21798,"3- Likely to contribute to gender equality, but without attention to age groups",Project Closure,122,PRJ_PRJ_CLS,128722.5774,5/22/2020 5:26:59 PM
23,2020 2nd Reserve Allocation	,AFG-20/3481/RA2/WASH/INGO/15741,,,2020,1,Agency for Technical Cooperation and Development,2,"Providing lifesaving support to minimize the risk of COVID-19 spreading in communities and schools in Nangarhar, Faryab, Balkh, Takhar and Kunduz",4/27/2020 12:00:00 AM,10/26/2020 12:00:00 AM,6 Months,690780.6,551637.3,93951.99,4/11/2020 5:16:10 PM,22485##21104##19707##17779,"3- Likely to contribute to gender equality, but without attention to age groups",Project Closure,250,PRJ_UND_AUD,125813.5926,5/13/2020 2:57:56 PM
23,2020 2nd Reserve Allocation	,AFG-20/3481/RA2/WASH/INGO/15743,,,2020,1,World Vision International,2,WASH Response to COVID-19 in the Western Region,5/1/2020 12:00:00 AM,10/31/2020 12:00:00 AM,6 Months,1000000,865927,68652.44,4/10/2020 11:02:33 AM,15682##16322##23522##24484,"3- Likely to contribute to gender equality, but without attention to age groups",Project Closure,122,PRJ_PRJ_CLS,128722.5774,5/13/2020 8:43:06 PM
23,2020 2nd Reserve Allocation	,AFG-20/3481/RA2/WASH/INGO/15744,,,2020,1,Danish Committee for Aid to Afghan Refugees,2,COVID-19 WASH response and pre-positioning in WASH Cluster prioritized districts,5/1/2020 12:00:00 AM,12/31/2020 12:00:00 AM,8 Months,1500000,1254112,147757.5,4/11/2020 6:30:20 PM,45560##45560##60056##55912,"3- Likely to contribute to gender equality, but without attention to age groups",Project Closure,122,PRJ_PRJ_CLS,134176.9239,5/13/2020 3:01:38 PM
23,2020 2nd Reserve Allocation	,AFG-20/3481/RA2/WASH/INGO/15750,,,2020,1,Action Contre la Faim,2,WASH response to COVID-19 for the most vulnerable malnourished children and their community at both nutrition center and household levels.,5/1/2020 12:00:00 AM,12/31/2020 12:00:00 AM,8 Months,700000,505279.8,148925.9,4/11/2020 1:23:51 PM,13380##13889##11364##11867,"3- Likely to contribute to gender equality, but without attention to age groups",Project Closure,122,PRJ_PRJ_CLS,123268.2309,5/13/2020 3:24:43 PM
23,2020 2nd Reserve Allocation	,AFG-20/3481/RA2/WASH/UN/15747,,,2020,1,United Nations Children's Fund,3,WASH response to COVID-19 Pandemic in Afghanistan,5/5/2020 12:00:00 AM,11/4/2020 12:00:00 AM,6 Months,1088951,899542.4,118169,4/12/2020 7:27:28 AM,16939##16939##22329##20793,"3- Likely to contribute to gender equality, but without attention to age groups",Project Closure,122,PRJ_PRJ_CLS,51998.1033,5/6/2020 11:11:39 AM
23,2020 3rd Reserve Allocation,AFG-20/3481/RA3/APC/INGO/16062,,,2020,1,Danish Refugee Council,2,"Integrated lifesaving protection response to COVID- 9 covering the most vulnerable people including women, children, elderly, disabled, and survivors of sexual violence",7/1/2020 12:00:00 AM,1/31/2021 12:00:00 AM,7 Months,336315.1,238072.6,76240.6,5/10/2020 2:38:54 PM,20735##23947##4970##5348,"4- Likely to contribute to gender equality, including across age groups",Project Closure,122,PRJ_PRJ_CLS,57088.8267,6/20/2020 2:47:28 PM
23,2020 3rd Reserve Allocation,AFG-20/3481/RA3/APC/INGO/16068,,,2020,1,The Terre des hommes Foundation,2,Child Protection/Emergency Response Project in Eastern Region  ,6/1/2020 12:00:00 AM,9/30/2020 12:00:00 AM,4 Months,249590.1,201381.2,31880.6,5/9/2020 5:50:06 AM,27000##26000##7950##7900,"3- Likely to contribute to gender equality, but without attention to age groups",Project Closure,122,PRJ_PRJ_CLS,131267.9391,6/16/2020 12:57:30 PM
23,2020 3rd Reserve Allocation,AFG-20/3481/RA3/APC/INGO/16073,,,2020,1,Save the Children Fund,2,"CPiE response focusing on increased awareness raising, PSS and specialized services to conflict-affected children and families in Nangarhar and Kunar provinces, Afghanistan",6/15/2020 12:00:00 AM,12/14/2020 12:00:00 AM,6 Months,256324.2,210745.6,28809.74,5/9/2020 5:07:30 PM,10356##10325##11575##11075,"4- Likely to contribute to gender equality, including across age groups",Project Closure,122,PRJ_PRJ_CLS,41453.0334,7/4/2020 8:18:27 PM
23,2020 3rd Reserve Allocation,AFG-20/3481/RA3/CCS/UN/16109,,,2020,1,International Organization for Migration,3,Population Mobility Data and Community Engagement for Informed COVID-19 Response,6/8/2020 12:00:00 AM,12/7/2020 12:00:00 AM,6 Months,500000,397530.5,69759.25,5/9/2020 11:29:43 PM,27776##1386##3900##1300,"3- Likely to contribute to gender equality, but without attention to age groups",Project Closure,122,PRJ_PRJ_CLS,23999.1246,6/18/2020 11:12:42 AM
23,2020 3rd Reserve Allocation,AFG-20/3481/RA3/CPiE/INGO/16083,,,2020,1,Children in Crisis,2,Protecting Afghan children during COVID-19 pandemic,6/6/2020 12:00:00 AM,10/5/2020 12:00:00 AM,4 Months,447599,363778,54538.8,5/9/2020 1:46:51 PM,2000##2000##20700##20700,"4- Likely to contribute to gender equality, including across age groups",Project Closure,253,PRJ_UND_REF,149085.4710,6/11/2020 1:31:09 PM
23,2020 3rd Reserve Allocation,AFG-20/3481/RA3/CPiE/NGO/16075,,,2020,1,Social and Humanitarian Assistance Organization,1,Protection of Vulnerable and at-risk children against COVID-19 through child protection interventions,6/16/2020 12:00:00 AM,9/15/2020 12:00:00 AM,3 Months,480083.9,428003.3,20673.33,5/8/2020 6:12:03 AM,17500##17500##2524##2526,"4- Likely to contribute to gender equality, including across age groups",Project Closure,250,PRJ_UND_AUD,122177.3616,6/20/2020 2:50:49 PM
23,2020 3rd Reserve Allocation,AFG-20/3481/RA3/CPiE-GBV-APC/INGO/16076,,,2020,1,International Rescue Commitee,2,"Emergency Protection Programming to Meet the Unique Needs of Women, Girls, Men and Boys during COVID-19 in Afghanistan",6/18/2020 12:00:00 AM,12/17/2020 12:00:00 AM,6 Months,830180.1,736313.6,39555.58,5/9/2020 5:47:44 PM,5111##10620##8186##13483,"4- Likely to contribute to gender equality, including across age groups",Project Closure,122,PRJ_PRJ_CLS,141085.7628,6/24/2020 4:44:38 PM
23,2020 3rd Reserve Allocation,AFG-20/3481/RA3/FSAC/INGO/16065,,,2020,1,Oxfam Novib,2,Food Security support to IDPs in Nangarhar as part of COVID-19 Response in Afghanistan,6/1/2020 12:00:00 AM,10/31/2020 12:00:00 AM,5 Months,689400,609261.5,35037.57,5/9/2020 5:49:41 PM,8473##10522##9689##10716,"3- Likely to contribute to gender equality, but without attention to age groups",Project Closure,122,PRJ_PRJ_CLS,130540.6929,6/16/2020 12:55:04 PM
23,2020 3rd Reserve Allocation,AFG-20/3481/RA3/FSAC/INGO/16072,,,2020,1,ZOA Refugee Care,2,Food assistance to the protracted IDPs affected by COVID-19 in Nangarhar,6/1/2020 12:00:00 AM,9/30/2020 12:00:00 AM,4 Months,300600.3,261560.8,19374,5/9/2020 4:48:06 AM,3100##3200##5200##5200,"3- Likely to contribute to gender equality, but without attention to age groups",Project Closure,122,PRJ_PRJ_CLS,132722.4315,6/16/2020 12:59:52 PM
23,2020 3rd Reserve Allocation,AFG-20/3481/RA3/FSAC/INGO/16077,,,2020,1,Agency for Technical Cooperation and Development,2,Provision of emergency food assistance through vouchers to most vulnerable protracted IDPs in Mazar-e-Sharif,5/21/2020 12:00:00 AM,11/20/2020 12:00:00 AM,6 Months,693000.9,567350.9,80313.51,5/9/2020 10:46:12 AM,10780##10395##8855##8470,"4- Likely to contribute to gender equality, including across age groups",Project Closure,122,PRJ_PRJ_CLS,125813.5926,6/11/2020 1:29:51 PM
23,2020 3rd Reserve Allocation,AFG-20/3481/RA3/FSAC/INGO/16122,,,2020,1,Danish Refugee Council,2,Emergency food assistance to meet the immediate needs of COVID-19 affected IDPs in Kandahar.,6/1/2020 12:00:00 AM,11/30/2020 12:00:00 AM,6 Months,837700,671976.2,110921,5/9/2020 5:17:27 PM,8291##8963##14204##15036,"4- Likely to contribute to gender equality, including across age groups",Project Closure,122,PRJ_PRJ_CLS,57088.8267,6/11/2020 1:32:34 PM
23,2020 3rd Reserve Allocation,AFG-20/3481/RA3/FSAC/UN/16086,,,2020,1,World Food Programme,3,Food assistance to ensure the resilience of farmers with fragile livelihood  status and to support vulnerable IDPs and recent returnees affected by COVID-19,6/1/2020 12:00:00 AM,11/30/2020 12:00:00 AM,6 Months,1424439,1200826,136675.5,5/7/2020 1:05:54 PM,27339##25624##36563##35942,"3- Likely to contribute to gender equality, but without attention to age groups",Project Closure,122,PRJ_PRJ_CLS,54543.4650,5/31/2020 8:26:55 AM
23,2020 3rd Reserve Allocation,AFG-20/3481/RA3/GBV/INGO/16070,,,2020,1,Oxfam Novib,2,Multisector Protection support to GBV survivors in the context of COVID-19 in Herat and Daikundi,6/15/2020 12:00:00 AM,12/14/2020 12:00:00 AM,6 Months,236263.2,172866.8,47939.91,5/9/2020 12:34:36 PM,10400##16084##3470##4606,"4- Likely to contribute to gender equality, including across age groups",Project Closure,122,PRJ_PRJ_CLS,130540.6929,6/20/2020 2:46:03 PM
23,2020 3rd Reserve Allocation,AFG-20/3481/RA3/GBV/NGO/16084,,,2020,1,Afghan Amputee Bicyclists for Rehabilitation And Recreation,1,"Responding COVID-19 Pandemic and GBV through greater public awareness and assisting women and girls at risks in Kabul, Nangarhar, Farah, Paktia and Logar Provinces of Afghanistan.",6/16/2020 12:00:00 AM,10/15/2020 12:00:00 AM,4 Months,251203.9,192070,42700,5/9/2020 6:23:22 PM,2156##5392##2152##1080,"4- Likely to contribute to gender equality, including across age groups",Project Closure,250,PRJ_UND_AUD,149449.0941,6/20/2020 2:43:15 PM
23,2020 3rd Reserve Allocation,AFG-20/3481/RA3/GBV/NGO/16105,,,2020,1,Coordination of Rehabilitation and Development Services for Afghanistan,1,"Provision of Protection Services for displaced and non-displaced at risk of COVID 19 Afghan populations in Herat, Farah and Nimrooz provinces of Afghanistan",6/10/2020 12:00:00 AM,12/9/2020 12:00:00 AM,6 Months,270000.1,230086.5,22250,5/9/2020 4:27:34 PM,16200##19050##19944##20806,"4- Likely to contribute to gender equality, including across age groups",Project Closure,250,PRJ_UND_AUD,142176.6321,6/20/2020 2:41:25 PM
23,2020 3rd Reserve Allocation,AFG-20/3481/RA3/GBV-CPiE/INGO/16102,,,2020,1,Islamic Relief Worldwide,2,GBV and Child Protection Emergency Response during COVID-19 Pandemic in Afghanistan,6/15/2020 12:00:00 AM,12/14/2020 12:00:00 AM,6 Months,484591.8,412207.5,40682,5/9/2020 12:04:17 PM,12530##15560##19750##21160,"4- Likely to contribute to gender equality, including across age groups",Project Closure,122,PRJ_PRJ_CLS,129086.2005,6/11/2020 1:39:26 PM
23,2020 3rd Reserve Allocation,AFG-20/3481/RA3/H/INGO/16056,,,2020,1,JOHANNITER,2,"Emergency Life Saving interventions to prevent COVID-19 infection among  high risk population in Kunduz, Kabul and Khost provinces.",6/1/2020 12:00:00 AM,11/30/2020 12:00:00 AM,6 Months,529951.3,488768.6,6513,5/9/2020 11:18:02 AM,42820##40158##54902##53009,"3- Likely to contribute to gender equality, but without attention to age groups",Project Closure,122,PRJ_PRJ_CLS,129449.8236,6/16/2020 12:53:26 PM
23,2020 3rd Reserve Allocation,AFG-20/3481/RA3/H/INGO/16063,,,2020,1,Healthnet International and Transcultural Psychosocial Organization,2,Provision of essential MHPSS and emergency health services in response to the COVID-19 in selected priority districts,6/20/2020 12:00:00 AM,12/19/2020 12:00:00 AM,6 Months,389806,337193.7,27111,5/9/2020 6:12:00 AM,26743##25664##10965##10531,"3- Likely to contribute to gender equality, but without attention to age groups",Project Closure,122,PRJ_PRJ_CLS,124722.7233,6/11/2020 1:34:38 PM
23,2020 3rd Reserve Allocation,AFG-20/3481/RA3/H/INGO/16074,,,2020,1,Handicap International,2,"Increasing community resilience against Covid-19 and reducing its effects among the most vulnerable Afghan communities in Kandahar, Nimroz, and Herat Provinces",6/21/2020 12:00:00 AM,12/20/2020 12:00:00 AM,6 Months,259000,203372.9,38683.14,5/8/2020 7:09:50 AM,57235##57161##38000##38000,"3- Likely to contribute to gender equality, but without attention to age groups",Project Closure,122,PRJ_PRJ_CLS,134904.1701,6/24/2020 4:46:38 PM
23,2020 3rd Reserve Allocation,AFG-20/3481/RA3/H/INGO/16085,,,2020,1,CARE International,2,CARE COVID-19 Response through Mobile Health Team in Urban and Rural Areas of Balkh and Kabul provinces.,7/1/2020 12:00:00 AM,12/31/2020 12:00:00 AM,6 Months,375000,280199.7,70267.59,5/9/2020 10:43:58 AM,20136##24998##9002##8864,"4- Likely to contribute to gender equality, including across age groups",Project Closure,122,PRJ_PRJ_CLS,133086.0546,6/20/2020 2:48:57 PM
23,2020 3rd Reserve Allocation,AFG-20/3481/RA3/H/INGO/16098,,,2020,1,Islamic Relief Worldwide,2,"COVID-19 Emergency Response through Health Support for the People at risk in Kabul, Herat, Kandahar, Balkh and Nangarhar provinces in Afghanistan",6/10/2020 12:00:00 AM,12/9/2020 12:00:00 AM,6 Months,326827.2,273730,31716,5/9/2020 12:01:39 PM,18000##21000##10200##10800,"3- Likely to contribute to gender equality, but without attention to age groups",Project Closure,122,PRJ_PRJ_CLS,129086.2005,6/11/2020 1:37:24 PM
23,2020 3rd Reserve Allocation,AFG-20/3481/RA3/H/UN/16067,,,2020,1,International Organization for Migration,3,"COVID-19 Response - Support to Surveillance, Risk Communication and Points of Entry",6/15/2020 12:00:00 AM,12/14/2020 12:00:00 AM,6 Months,649950.1,508450.8,98979.3,5/8/2020 10:06:06 AM,40000##10000##15000##5000,"3- Likely to contribute to gender equality, but without attention to age groups",Project Closure,122,PRJ_PRJ_CLS,23999.1246,6/18/2020 11:12:09 AM
23,2020 3rd Reserve Allocation,AFG-20/3481/RA3/H-N/NGO/16057,,,2020,1,Agency for Assistance  for Development of Afghanistan,1,Provision of lifesaving health and nutrition services in COVID-19 high risk districts of Herat province,6/1/2020 12:00:00 AM,11/30/2020 12:00:00 AM,6 Months,671618.5,576972.9,50707.93,5/9/2020 7:10:15 PM,79886##86288##30183##30668,"3- Likely to contribute to gender equality, but without attention to age groups",Project Closure,122,PRJ_PRJ_CLS,123995.4771,6/11/2020 1:27:54 PM
23,2020 3rd Reserve Allocation,AFG-20/3481/RA3/H-N/UN/16082,,,2020,1,World Health Organization,3,To reduce further transmission of COVID-19 and reduce mortality and morbidity caused by  severe acute  malnutrition (SAM) in targeted high risk districts in context of  COVID-19 in Afghanistan,6/10/2020 12:00:00 AM,1/9/2021 12:00:00 AM,7 Months,1072061,1001926,0,5/9/2020 4:03:11 PM,15044##10044##2250##2162,"3- Likely to contribute to gender equality, but without attention to age groups",Project Closure,122,PRJ_PRJ_CLS,54907.0881,6/4/2020 10:36:15 PM
23,2020 3rd Reserve Allocation,AFG-20/3481/RA3/N/INGO/16064,,,2020,1,Save the Children Fund,2,"Emergency nutrition services in COVID-19 high risk districts of Balkh, Kunduz and Faryab provinces",6/1/2020 12:00:00 AM,1/31/2021 12:00:00 AM,8 Months,399577.8,306758.4,66678.79,5/9/2020 3:56:50 PM,6480##9720##9342##10458,"3- Likely to contribute to gender equality, but without attention to age groups",Project Closure,122,PRJ_PRJ_CLS,41453.0334,6/16/2020 12:56:21 PM
23,2020 3rd Reserve Allocation,AFG-20/3481/RA3/N/INGO/16097,,,2020,1,World Vision International,2,Emergency Lifesaving Nutrition support under CoVID-19 response in Herat and Badghis priority districts,6/1/2020 12:00:00 AM,11/30/2020 12:00:00 AM,6 Months,600000,515401.5,45346.14,5/8/2020 4:22:03 PM,8232##8568##12348##12852,"3- Likely to contribute to gender equality, but without attention to age groups",Project Closure,122,PRJ_PRJ_CLS,128722.5774,6/16/2020 12:58:42 PM
23,2020 3rd Reserve Allocation,AFG-20/3481/RA3/N/UN/16118,,,2020,1,World Food Programme,3,Treatment and prevention of moderate acute malnutrition the provinces most affected by COVID-19 in Afghanistan.,7/1/2020 12:00:00 AM,3/31/2021 12:00:00 AM,9 Months,1028619,797884.9,167954.2,5/8/2020 4:15:06 PM,0##6812##14813##14232,"3- Likely to contribute to gender equality, but without attention to age groups",Project Closure,122,PRJ_PRJ_CLS,54543.4650,6/3/2020 10:28:40 PM
23,2020 3rd Reserve Allocation,AFG-20/3481/RA3/N/UN/16123,,,2020,1,United Nations Children's Fund,3,Delivery of lifesaving nutrition services to COVID-19 priority areas,5/25/2020 12:00:00 AM,11/24/2020 12:00:00 AM,6 Months,1139003,925629,138860,5/9/2020 6:59:36 AM,0##0##9385##11471,"3- Likely to contribute to gender equality, but without attention to age groups",Project Closure,122,PRJ_PRJ_CLS,51998.1033,5/28/2020 4:53:41 AM
23,2020 4th Reserve Allocation,AFG-20/3481/RA4/CCS/UN/16532,,,2020,1,United Nations Office for Project Services,3,Covid 19 - Intensive Care Unit (ICU) Facility  ,10/1/2020 12:00:00 AM,2/28/2022 12:00:00 AM,17 Months,4995976,4174112,495024.7,6/17/2020 6:10:13 PM,30000##10000##0##0,"4- Likely to contribute to gender equality, including across age groups",Reporting,308,PRJ_UND_FINAL_RPT,53452.5957,10/2/2020 7:47:56 AM
23,2020 5th Reserve Allocation,AFG-20/3481/RA5/APC/INGO/17222,,,2020,1,World Vision International,2,"Improved mental health and psycho social well being of caregivers and children in Ghor province in response to conflict, disaster and COVID-19.",10/20/2020 12:00:00 AM,6/19/2021 12:00:00 AM,8 Months,299996.5,244869.8,35500.74,9/16/2020 2:24:35 PM,2146##2139##1522##1526,"3- Likely to contribute to gender equality, but without attention to age groups",Project Closure,122,PRJ_PRJ_CLS,128722.5774,11/3/2020 3:51:43 PM
23,2020 5th Reserve Allocation,AFG-20/3481/RA5/APC/INGO/17255,,,2020,1,War Child Canada,2,Psychosocial Assistance &amp; Support Services (PASS),10/15/2020 12:00:00 AM,4/14/2021 12:00:00 AM,6 Months,246594.3,157962,72500,9/16/2020 6:24:41 PM,1885##1892##1274##1285,"4- Likely to contribute to gender equality, including across age groups",Project Closure,122,PRJ_PRJ_CLS,53816.2188,10/30/2020 3:24:40 PM
