PFId,AllNm,PrjCode,OPSCodeAgg,EmgAgg,AllYr,AllSrc,OrgNm,OrgTypeId,PrjTitle,AStrDt,AEndDt,PrjDur,PrgBdg,BgdDC,BdgSC,PrjSubDt,BenAgg,PrjGM,PrjStsNm,PrjStsId,PrjStsCode,PartCode,ApprDt
53,2020 2nd Round Standard Allocation,ETH-20/DDA-3379/SA2/NFI/ES/NGO/17504,,,2020,2,Action for Social Development and Environmental Protection Organization,1,Providing Emergency Shelter and Non-Food Items Kit for Returnees and Host Communities in Mao Komo  Special Wereda and Sirba Abay Wereda of Kamashi Zone Benishngulgumuz Region.,12/15/2020 12:00:00 AM,6/14/2021 12:00:00 AM,6 Months,118750.3,110981.6,0,10/29/2020 9:42:43 AM,1160##827##424##229,"4- Likely to contribute to gender equality, including across age groups",Project Closure,2737,PRJ_PRJ_CLS,5006546.1868,12/1/2020 3:53:05 PM
53,2020 2nd Round Standard Allocation,ETH-20/DDA-3379/SA2/NFI/ES-P-H-N-WASH-E/UN/17689,,,2020,2,International Organization for Migration,3,Integrated support and COVID-19 risk mitigation for displaced populations in Moyale Woreda in Ethiopia,1/15/2021 12:00:00 AM,10/14/2021 12:00:00 AM,9 Months,500000,460397.3,6892.47,12/2/2020 5:29:53 PM,11432##11498##15867##15844,"4- Likely to contribute to gender equality, including across age groups",Project Closure,2737,PRJ_PRJ_CLS,6482105.3008,1/14/2021 3:57:19 PM
53,2020 2nd Round Standard Allocation,ETH-20/DDA-3379/SA2/NFI/ES-WASH-N-H/INGO/17584,,,2020,2,Save the Children Fund,2,Provision of Integrated Multi-Sector response for prioritized high risk IDP sites in Erer woreda of Somali region.,1/15/2021 12:00:00 AM,7/14/2021 12:00:00 AM,6 Months,689107.7,531538,112487.9,12/8/2020 11:28:27 AM,2770##2662##3124##3001,"4- Likely to contribute to gender equality, including across age groups",Project Closure,2737,PRJ_PRJ_CLS,7452867.8758,1/7/2021 3:40:21 PM
53,2020 2nd Round Standard Allocation,ETH-20/DDA-3379/SA2/NFI/ES-WASH-P/INGO/17569,,,2020,2,GOAL,2,Emergency Multi-sectoral Integrated responses to displaced/returnees’ households in Yaso and Guba woredas of Benishangul Gumuz Region,1/1/2021 12:00:00 AM,12/31/2021 12:00:00 AM,12 Months,461885.3,431668.6,0,10/9/2020 2:35:26 PM,90821##112023##25986##30913,"4- Likely to contribute to gender equality, including across age groups",Project Closure,2737,PRJ_PRJ_CLS,6414799.0956,12/21/2020 4:09:16 PM
53,2020 2nd Round Standard Allocation,ETH-20/DDA-3379/SA2/N-H-P-E-NFI/ES-WASH/INGO/17549,,,2020,2,Save the Children Fund,2,Integrated Multi-Sectoral Life-Saving Response to Crisis Affected Children and their Families in Dubti woreda of Afar Region,12/25/2020 12:00:00 AM,6/24/2021 12:00:00 AM,6 Months,500000,427770.7,39519,11/6/2020 6:57:57 PM,3597##2944##7986##6912,"4- Likely to contribute to gender equality, including across age groups",Project Closure,2737,PRJ_PRJ_CLS,7452867.8758,12/28/2020 6:14:31 PM
53,2020 2nd Round Standard Allocation,ETH-20/DDA-3379/SA2/N-H-WASH-P-NFI/ES/INGO/17432,,,2020,2,Action Against Hunger,2,Integrated multi-sector emergency response for displacement affected population (IDPs) in Oromia (Borena zone) and Somali (Shabelle zone) regional states of Ethiopia,1/18/2021 12:00:00 AM,10/17/2021 12:00:00 AM,9 Months,1100001,1028038,0,12/9/2020 6:00:40 PM,49973##43188##32173##33858,"4- Likely to contribute to gender equality, including across age groups",Project Closure,2737,PRJ_PRJ_CLS,3919292.1028,1/14/2021 3:56:12 PM
53,2020 2nd Round Standard Allocation,ETH-20/DDA-3379/SA2/P/INGO/17487,,,2020,2,World Vision Ethiopia,2,"Child Protection and GBV Prevention and Response Project in Conflict Affected Woredas of East &amp; West Wallaga Zones, Oromia Region",12/1/2020 12:00:00 AM,10/31/2021 12:00:00 AM,11 Months,300000,270036.1,10337.78,11/5/2020 12:30:27 PM,7960##12820##13100##17060,"4- Likely to contribute to gender equality, including across age groups",Project Closure,2737,PRJ_PRJ_CLS,1664534.2286,12/28/2020 6:11:37 PM
53,2020 2nd Round Standard Allocation,ETH-20/DDA-3379/SA2/P/INGO/17573,,,2020,2,GOAL,2,Community based integrated child protection and gender-based violence assistance for the Crisis-affected communities in East Hararghe through quality and timely response services and benefits from risk reduction and prevention measures,1/1/2021 12:00:00 AM,9/30/2021 12:00:00 AM,9 Months,199037.2,186016,0,11/4/2020 5:24:15 PM,22295##22960##19222##19747,"4- Likely to contribute to gender equality, including across age groups",Project Closure,2737,PRJ_PRJ_CLS,6414799.0956,12/21/2020 4:11:04 PM
53,2020 2nd Round Standard Allocation,ETH-20/DDA-3379/SA2/P/UN/17506,,,2020,2,United Nations High Commissioner for Refugees,3,Legal Assistance and Community Based Protection in East and West Wollega,2/1/2021 12:00:00 AM,1/31/2022 12:00:00 AM,12 Months,300000,281690.1,0,11/3/2020 12:10:57 PM,8000##7500##0##0,"3- Likely to contribute to gender equality, but without attention to age groups",Project Closure,2737,PRJ_PRJ_CLS,6808281.5260,2/18/2021 3:08:04 PM
53,2020 2nd Round Standard Allocation,ETH-20/DDA-3379/SA2/P-E-H-WASH-NFI/ES/INGO/17499,,,2020,2,Plan International,2,"Addressing the Emergency need of the Most Affected IDP Returnees in Dangur and Mandura Woredas of Metekel Zone,  Benishangul Gumuz Region through Provision of Integrated Protection, Health, WaSH,  Education Services as well as provision of Essential NFIs.",1/1/2021 12:00:00 AM,3/31/2022 12:00:00 AM,15 Months,800000.1,747663.6,0,10/9/2020 6:48:06 PM,31407##58472##13361##13670,"4- Likely to contribute to gender equality, including across age groups",Project Closure,2737,PRJ_PRJ_CLS,880158.0680,1/5/2021 4:06:08 PM
53,2020 2nd Round Standard Allocation,ETH-20/DDA-3379/SA2/P-H-WASH-NFI/ES-N/INGO/17433,,,2020,2,World Vision Ethiopia,2,Multi-Sectoral Response in Mederesa IDP site of Bunno Bedele Zone of Oromia region –Dedesa woreda,1/5/2021 12:00:00 AM,10/4/2021 12:00:00 AM,9 Months,600000.1,545589.6,15158.12,12/21/2020 9:22:20 AM,3570##9325##8300##8295,"4- Likely to contribute to gender equality, including across age groups",Project Closure,2737,PRJ_PRJ_CLS,1664534.2286,1/20/2021 4:57:50 PM
53,2020 2nd Round Standard Allocation,ETH-20/DDA-3379/SA2/P-NFI/ES-H-N-WASH/UN/17575,,,2020,2,International Organization for Migration,3,Multisectoral support and COVID-19 risk mitigation for displaced populations in Saden and Qoloji IDP sites in Ethiopia,1/25/2021 12:00:00 AM,10/24/2021 12:00:00 AM,9 Months,1800001,1635322,46921.26,12/7/2020 5:52:04 PM,22889##22831##32837##33002,"4- Likely to contribute to gender equality, including across age groups",Project Closure,2737,PRJ_PRJ_CLS,6482105.3008,2/22/2021 2:27:12 PM
53,2020 2nd Round Standard Allocation,ETH-20/DDA-3379/SA2/WASH/INGO/17480,,,2020,2,Care Ethiopia,2,"Emergency WASH response for IDPs, IDP returnees and Hosting communities in Afar and Oromia regions and COVID-19 mitigation WASH response in Addis Ababa Treatment and Isolation centers",12/15/2020 12:00:00 AM,8/14/2021 12:00:00 AM,8 Months,550006.7,485542.2,28482.76,11/14/2020 10:42:26 AM,28488##30158##17534##18412,"4- Likely to contribute to gender equality, including across age groups",Project Closure,2737,PRJ_PRJ_CLS,7256126.6606,12/15/2020 3:01:44 PM
53,2020 2nd Round Standard Allocation,ETH-20/DDA-3379/SA2/WASH/INGO/17486,,,2020,2,World Vision Ethiopia,2,COVID-19 WASH Response Project for Etege Mintiwab Health Center and Injibara Hospital in Amhara Region,12/1/2020 12:00:00 AM,5/31/2021 12:00:00 AM,6 Months,200000,173475.8,13440.07,10/20/2020 3:16:01 PM,18000##15750##6750##4500,"4- Likely to contribute to gender equality, including across age groups",Project Closure,2737,PRJ_PRJ_CLS,1664534.2286,12/11/2020 4:06:57 PM
53,2020 2nd Round Standard Allocation,ETH-20/DDA-3379/SA2/WASH-H-P/INGO/17490,,,2020,2,Norwegian Church Aid,2,"Saving lives of Conflict affected IDPs and Disaster affected host communities through integrated response on WASH, Health and Protection intervention covering 7 IDP sites in Moyale Woreda of Dawa Zone, Somali Regional State",2/1/2021 12:00:00 AM,7/31/2021 12:00:00 AM,6 Months,502852.4,469955.6,0,11/30/2020 1:27:52 PM,10200##11400##18000##20400,"4- Likely to contribute to gender equality, including across age groups",Project Closure,2737,PRJ_PRJ_CLS,6575298.5080,12/23/2020 4:42:22 PM
53,2020 2nd Round Standard Allocation,ETH-20/DDA-3379/SA2/WASH-NFI/ES/INGO/17452,,,2020,2,Cooperazione Internazionale - COOPI,2,"Integrated emergency WASH and NFIs assistance to IDPs, returnees and vulnerable communities in Bale Zone (Dawe Serar and Seweyna) and Afder Zone (Dolobay).",12/28/2020 12:00:00 AM,1/31/2022 12:00:00 AM,"13 Months, 4 Days",650269,562668.2,45059.86,11/2/2020 10:46:12 AM,14468##14839##4081##3709,"4- Likely to contribute to gender equality, including across age groups",Project Closure,2737,PRJ_PRJ_CLS,6370791.1922,12/17/2020 3:49:16 PM
53,2020 2nd Round Standard Allocation,ETH-20/DDA-3379/SA2/WASH-NFI/ES-H/INGO/17542,,,2020,2,Cooperazione Internazionale - COOPI,2,"Integrated WASH, Health and ESNFIs emergency response for displaced persons at the Beareta Camp, Zone 3 (Gabi), Afar Region, Ethiopia",1/1/2021 12:00:00 AM,11/30/2021 12:00:00 AM,11 Months,550002.4,496580.2,17440.78,11/20/2020 6:58:56 AM,7687##7764##7840##7764,"4- Likely to contribute to gender equality, including across age groups",Project Closure,2737,PRJ_PRJ_CLS,6370791.1922,12/21/2020 4:07:22 PM
53,2020 2nd Round Standard Allocation,ETH-20/DDA-3379/SA2/WASH-NFI/ES-H-N-E-P/INGO/17467,,,2020,2,Cooperazione Internazionale - COOPI,2,"Provision of Effective and Sustainable, Health, Nutrition, Protection, Education, ESNFIs and WASH services for conflict and disaster affected population in Liben and Gumi Eldalo Woredas, Guji Zone, Oromia",1/1/2021 12:00:00 AM,10/31/2021 12:00:00 AM,10 Months,598876.1,541618.3,18078.97,10/9/2020 1:59:51 PM,3849##17009##12166##10937,"4- Likely to contribute to gender equality, including across age groups",Project Closure,2737,PRJ_PRJ_CLS,6370791.1922,1/11/2021 5:16:10 PM
53,2020 2nd Round Standard Allocation,ETH-20/DDA-3379/SA2/WASH-NFI/ES-P-H-N/INGO/17581,,,2020,2,Deutsche Welthungerhilfe e.V. (German Agro Action),2,Integrated multi-sectoral and emergency response for improved living conditions of IDPs in Somali Region,2/1/2021 12:00:00 AM,8/31/2021 12:00:00 AM,7 Months,699916.7,632573.3,21554.46,12/7/2020 2:50:28 PM,3687##8695##5954##7563,"3- Likely to contribute to gender equality, but without attention to age groups",Project Closure,2737,PRJ_PRJ_CLS,6399266.8944,1/20/2021 4:59:43 PM
53,2020 2nd Round Standard Allocation,ETH-20/DDA-3379/SA2/WASH-N-H-P-NFI/ES/INGO/17572,,,2020,2,Care Ethiopia,2,Integrated multi sectoral response project in West Hararghe and Borena zones of Oromia Region,1/1/2021 12:00:00 AM,8/31/2021 12:00:00 AM,8 Months,1074112,942935,60908.36,10/11/2020 2:10:01 PM,19373##27362##11989##16601,"4- Likely to contribute to gender equality, including across age groups",Project Closure,2737,PRJ_PRJ_CLS,7256126.6606,1/12/2021 5:56:33 PM
53,2020 2nd Round Standard Allocation,ETH-20/DDA-3379/SA2/WASH-P-NFI/ES-N/INGO/17442,,,2020,2,World Vision Ethiopia,2,"Life Saving Multisector Emergency Response for IDPs,Returnees and Host Communities living in Gimbi Woreda, West Wellega zone in Oromia Region",1/1/2021 12:00:00 AM,9/30/2021 12:00:00 AM,9 Months,476316.7,445155.8,0,11/13/2020 1:00:38 PM,4624##4616##8637##8743,"4- Likely to contribute to gender equality, including across age groups",Project Closure,2737,PRJ_PRJ_CLS,1664534.2286,1/18/2021 5:31:03 PM
59,2020 First Reserve Allocation (COVID-19),MM-20/DDA-3415/RA1/COVID-19/INGO/15754,,,2020,1,MERCY Malaysia,2,Ensuring continuation of access to healthcare for the Sittwe IDP camps during COVID-19,5/15/2020 12:00:00 AM,2/28/2021 12:00:00 AM,"9 Months, 14 Days",225140.9,207212.6,3199.5,4/24/2020 3:51:14 PM,3500##7000##3150##3150,"4- Likely to contribute to gender equality, including across age groups",Project Closure,2755,PRJ_PRJ_CLS,4189649.4366,5/22/2020 9:01:50 PM
59,2020 First Reserve Allocation (COVID-19),MM-20/DDA-3415/RA1/COVID-19/INGO/15764,,,2020,1,DanChurchAid,2,Reducing the impact of COVID-19 in East Bago Region and Kayin States,6/1/2020 12:00:00 AM,12/31/2020 12:00:00 AM,7 Months,270232.6,250274.7,2279.08,4/24/2020 12:53:00 PM,10289##10731##9305##9344,"3- Likely to contribute to gender equality, but without attention to age groups",Project Closure,2755,PRJ_PRJ_CLS,1527008.5236,6/5/2020 1:38:27 PM
59,2020 First Reserve Allocation (COVID-19),MM-20/DDA-3415/RA1/COVID-19/INGO/15799,,,2020,1,Community Partners International,2,"Myanmar COVID-19 Emergency Response (M-COVER) - Phase 2 Project in Kachin, Northern Shan, and Kayin States",5/22/2020 12:00:00 AM,11/21/2020 12:00:00 AM,6 Months,294750.3,257899.9,17567.65,4/24/2020 3:47:20 PM,28262##31327##19647##19958,"3- Likely to contribute to gender equality, but without attention to age groups",Project Closure,2755,PRJ_PRJ_CLS,3621833.2419,5/27/2020 3:54:06 PM
59,2020 First Reserve Allocation (COVID-19),MM-20/DDA-3415/RA1/COVID-19/INGO/15919,,,2020,1,Relief International,2,Provision of essential COVID-19 response and prevention measures in Ethnic Controlled Areas of Southern Shan,5/21/2020 12:00:00 AM,12/31/2020 12:00:00 AM,"7 Months, 11 Days",254438.2,213716.6,24076.07,4/24/2020 1:04:50 PM,10695##10729##18363##18430,"3- Likely to contribute to gender equality, but without attention to age groups",Project Closure,2755,PRJ_PRJ_CLS,8273434.8369,5/29/2020 10:00:09 PM
59,2020 First Reserve Allocation (COVID-19),MM-20/DDA-3415/RA1/COVID-19/INGO/15982,,,2020,1,Health Poverty Action,2,Support on prevention against the transmission of Covid-19 in NGCA and GCA in Kachin state,5/19/2020 12:00:00 AM,1/31/2021 12:00:00 AM,"8 Months, 13 Days",295285.3,263053.4,12914.14,4/24/2020 1:57:11 PM,29250##15750##1320##880,"3- Likely to contribute to gender equality, but without attention to age groups",Project Closure,2755,PRJ_PRJ_CLS,4362881.4960,5/27/2020 4:06:48 PM
59,2020 First Reserve Allocation (COVID-19),MM-20/DDA-3415/RA1/COVID-19/NGO/15772,,,2020,1,Metta Development Foundation,1,Intervention on COVID-19 in Kachin and northern Shan,6/1/2020 12:00:00 AM,12/31/2020 12:00:00 AM,7 Months,361364.8,314001.3,23722.81,4/24/2020 2:54:14 PM,8633##9698##8667##8907,"3- Likely to contribute to gender equality, but without attention to age groups",Project Closure,2755,PRJ_PRJ_CLS,1729112.5929,5/29/2020 9:58:41 PM
59,2020 First Reserve Allocation (COVID-19),MM-20/DDA-3415/RA1/COVID-19/NGO/15827,,,2020,1,Karuna Mission Social Solidarity,1,COVID-19 Humanitarian Response Program for IDPs in Paletwa Township in Chin State,6/1/2020 12:00:00 AM,1/31/2021 12:00:00 AM,8 Months,306603.1,265367,21178,4/24/2020 2:37:50 PM,2801##3238##234##225,"4- Likely to contribute to gender equality, including across age groups",Project Closure,2755,PRJ_PRJ_CLS,1379440.4730,5/28/2020 5:39:56 PM
59,2020 First Reserve Allocation (COVID-19),MM-20/DDA-3415/RA1/COVID-19/NGO/15956,,,2020,1,Centre for Social Integrity,1,COVID-19 Prevention and Emergency Response in Northern Rakhine State,5/25/2020 12:00:00 AM,8/24/2020 12:00:00 AM,3 Months,183769.1,160174.1,11572.73,4/24/2020 1:00:23 PM,9448##10313##10936##12065,"4- Likely to contribute to gender equality, including across age groups",Project Closure,2755,PRJ_PRJ_CLS,6005378.0592,5/27/2020 4:04:49 PM
59,2020 First Reserve Allocation (COVID-19),MM-20/DDA-3415/RA1/COVID-19/UN/15766,,,2020,1,World Food Programme,3,Cross Cutting Proposal for procurement of PPE and WASH items for COVID response,5/22/2020 12:00:00 AM,11/21/2020 12:00:00 AM,6 Months,990000.6,929578,0,4/24/2020 3:26:47 PM,54468##82975##28476##35786,2- Unlikely to contribute to gender equality (no gender equality measure but includes age consideration),Project Closure,2755,PRJ_PRJ_CLS,8539698.9282,6/3/2020 5:19:55 PM
59,2020 First Reserve Allocation (COVID-19),MM-20/DDA-3415/RA1/COVID-19/UN/15936,,,2020,1,United Nations Children's Fund,3,"Provision of critical water, sanitation and hygiene (WASH) supplies and improving Infection Prevention and Control (IPC) in Rakhine State",5/26/2020 12:00:00 AM,2/25/2021 12:00:00 AM,9 Months,599735,535452,25048,4/24/2020 11:32:07 AM,52000##62000##26000##31000,"4- Likely to contribute to gender equality, including across age groups",Project Closure,2760,PRJ_UND_REF,8462706.9018,5/28/2020 5:36:47 PM
59,2020 First Standard Allocation,MM-20/DDA-3415/SA1/CCCM-SNFI-WASH/NGO/16803,,,2020,2,Nyein (Shalom) Foundation,1,"Provide Shelter construction, Camp Coordination and Camp Management and WASH facility in Kahcin state",9/1/2020 12:00:00 AM,10/31/2021 12:00:00 AM,14 Months,379428.2,325203.1,29402.75,7/19/2020 3:54:12 AM,2540##2817##2245##2179,"4- Likely to contribute to gender equality, including across age groups",Project Closure,2757,PRJ_PRJ_CLS,1636080.5610,9/2/2020 7:27:29 PM
59,2020 First Standard Allocation,MM-20/DDA-3415/SA1/E-FS/INGO/16807,,,2020,2,Finn Church Aid (Myanmar),2,Integrated Education and Food Security and Livelihoods Support for Conflict-Affected People in Kachin State,9/1/2020 12:00:00 AM,10/31/2021 12:00:00 AM,14 Months,531545.7,469618.4,27153.23,7/20/2020 11:43:24 AM,1970##1970##8346##8349,"4- Likely to contribute to gender equality, including across age groups",Project Closure,2757,PRJ_PRJ_CLS,5293201.8150,9/3/2020 6:33:04 PM
59,2020 First Standard Allocation,MM-20/DDA-3415/SA1/E-H-P/NGO/16972,,,2020,2,Family World,1,"Resilience empowerment for children and conflict affected people in Paletwa Township and emergency response in Hakha Township, in Chin State  ",9/1/2020 12:00:00 AM,10/31/2021 12:00:00 AM,14 Months,247231.6,222624.6,8432.94,7/20/2020 3:41:58 AM,1827##1973##2581##2864,"4- Likely to contribute to gender equality, including across age groups",Project Closure,2757,PRJ_PRJ_CLS,3079681.0560,9/3/2020 6:34:54 PM
59,2020 First Standard Allocation,MM-20/DDA-3415/SA1/FS/NGO/16801,,,2020,2,Centre for Social Integrity,1,"Improving food security, resilience and livelihood opportunities of vulnerable households in Northern Rakhine State",9/1/2020 12:00:00 AM,10/31/2021 12:00:00 AM,14 Months,296028.5,225780.5,50881.6,7/20/2020 2:46:43 PM,1259##1374##1457##1607,"4- Likely to contribute to gender equality, including across age groups",Project Closure,2757,PRJ_PRJ_CLS,6005378.0592,8/24/2020 11:24:55 AM
59,2020 First Standard Allocation,MM-20/DDA-3415/SA1/H-P/INGO/16767,,,2020,2,International Rescue Committee,2,Ensuring Inclusive GBV and Health Services for IDPs and Conflict-Affected Communities in Kachin and Northern Shan,9/1/2020 12:00:00 AM,2/28/2022 12:00:00 AM,18 Months,410508,320665,62987.33,7/20/2020 4:47:59 PM,6220##43854##8372##26269,"4- Likely to contribute to gender equality, including across age groups",Project Closure,2756,PRJ_UND_AUD,8058498.7632,9/14/2020 1:19:39 PM
59,2020 First Standard Allocation,MM-20/DDA-3415/SA1/H-P/UN/16987,,,2020,2,United Nations Population Fund,3,Provision of integrated SRHR and Primary Health Care services to displaced people from IDP camps and remote villages in Kachin State through mobile clinics,9/1/2020 12:00:00 AM,8/31/2021 12:00:00 AM,12 Months,198396.1,174016.9,11400,7/20/2020 1:28:02 PM,5361##5683##4570##4401,"4- Likely to contribute to gender equality, including across age groups",Project Closure,2759,PRJ_UND_REF,8398546.8798,8/19/2020 7:14:21 PM
59,2020 First Standard Allocation,MM-20/DDA-3415/SA1/H-P-E/INGO/16940,,,2020,2,Community Partners International,2,EHAI (Emergency Humanitarian Assistance for IDPs and Conflict-affected Communities) in Northern Shan State,9/1/2020 12:00:00 AM,11/30/2021 12:00:00 AM,15 Months,275419.1,221474.1,35926.95,7/20/2020 6:41:36 AM,7549##8743##4865##5863,"4- Likely to contribute to gender equality, including across age groups",Project Closure,2757,PRJ_PRJ_CLS,3621833.2419,9/8/2020 10:52:50 PM
59,2020 First Standard Allocation,MM-20/DDA-3415/SA1/H-P-WASH/INGO/16799,,,2020,2,International Rescue Committee,2,Meeting the multi-sectoral needs of displaced and conflict-affected communities in central and northern Rakhine,9/1/2020 12:00:00 AM,2/28/2022 12:00:00 AM,18 Months,700000,474001.6,180204,7/20/2020 5:03:02 PM,12151##27645##11703##26652,"4- Likely to contribute to gender equality, including across age groups",Project Closure,2756,PRJ_UND_AUD,8058498.7632,9/14/2020 1:17:58 PM
59,2020 First Standard Allocation,MM-20/DDA-3415/SA1/P/INGO/16828,,,2020,2,Finnish Refugee Council,2,Enhancing GBV protection in NGCAs in Kachin State,9/1/2020 12:00:00 AM,11/30/2021 12:00:00 AM,15 Months,127021.8,104272.4,14439.6,7/20/2020 5:32:31 AM,310##625##33##513,"4- Likely to contribute to gender equality, including across age groups",Project Closure,2757,PRJ_PRJ_CLS,6159362.1120,8/28/2020 10:44:50 AM
59,2020 First Standard Allocation,MM-20/DDA-3415/SA1/P-H-COVID-19/INGO/16806,,,2020,2,Federation of Handicap International,2,Improving child development and services to children and persons with disabilities affected by displacement in Central Rakhine,9/1/2020 12:00:00 AM,8/31/2021 12:00:00 AM,12 Months,160289.7,122278.1,27525.35,7/20/2020 2:24:55 PM,214##757##327##388,"4- Likely to contribute to gender equality, including across age groups",Project Closure,2757,PRJ_PRJ_CLS,5164881.7710,9/8/2020 10:51:16 PM
59,2020 First Standard Allocation,MM-20/DDA-3415/SA1/SNFI/INGO/16932,,,2020,2,Christian Aid,2,Inclusive reconstruction of temporary shelters for IDPs in Rakhine,9/1/2020 12:00:00 AM,5/31/2021 12:00:00 AM,9 Months,340576.2,317717.6,577.91,7/20/2020 2:14:25 PM,267##323##372##358,"4- Likely to contribute to gender equality, including across age groups",Project Closure,2757,PRJ_PRJ_CLS,8706514.9854,8/31/2020 1:25:26 PM
59,2020 First Standard Allocation,MM-20/DDA-3415/SA1/SNFI-E-WASH-P/INGO/17058,,,2020,2,Lutheran World federation,2,"Enhancing Dignified and Improved Living Condition of IDPs in Rakhine State, Myanmar through Shelter, WASH, Education and Protection",9/1/2020 12:00:00 AM,11/30/2021 12:00:00 AM,15 Months,1200000,1093680,27815.33,7/20/2020 3:37:24 PM,13263##15196##15721##15337,"4- Likely to contribute to gender equality, including across age groups",Project Closure,2757,PRJ_PRJ_CLS,8921451.0591,9/3/2020 6:30:52 PM
59,2020 First Standard Allocation,MM-20/DDA-3415/SA1/SNFI-FS/NGO/16921,,,2020,2,Metta Development Foundation,1,Meeting Critical Humanitarian Needs of Displaced People in Kachin and Northern Shan State.,9/10/2020 12:00:00 AM,3/9/2022 12:00:00 AM,18 Months,1200000,1047708,73787.71,7/20/2020 9:45:27 AM,4228##4507##3798##3943,"4- Likely to contribute to gender equality, including across age groups",Project Closure,2756,PRJ_UND_AUD,1729112.5929,9/17/2020 7:55:54 PM
59,2020 First Standard Allocation,MM-20/DDA-3415/SA1/WASH-SNFI-P-FS/INGO/16842,,,2020,2,Consortium of Dutch NGO's (The Netherlands),2,"Addressing critical gaps in WASH, Shelter, Food Security and Protection assistance for displaced communities in Central Rakhine state.",9/1/2020 12:00:00 AM,11/30/2021 12:00:00 AM,15 Months,1200000,1013944,107551.5,7/20/2020 8:03:49 AM,22576##26605##16195##16891,"4- Likely to contribute to gender equality, including across age groups",Project Closure,2757,PRJ_PRJ_CLS,1639288.5621,8/31/2020 11:45:39 AM
59,2020 Second Standard Allocation,MM-20/DDA-3415/SA2/CSCS/UN/17883,,,2020,2,World Food Programme,3,Expansion of COVID-19 testing capacity for humanitarian organizations and relevant stakeholders and provision of cold chain infrastructure to prepare for vaccine deployment plan in the Rakhine region,1/1/2021 12:00:00 AM,9/30/2021 12:00:00 AM,9 Months,326635.5,306700,0,11/23/2020 3:31:48 PM,12100##12100##2418##2418,"3- Likely to contribute to gender equality, but without attention to age groups",Project Closure,2757,PRJ_PRJ_CLS,8539698.9282,1/12/2021 8:44:20 PM
59,2020 Second Standard Allocation,MM-20/DDA-3415/SA2/E/INGO/17832,,,2020,2,Lutheran World federation,2,"Inclusive Education for Out of School IDP Children in Sittwe, Central Rakhine",1/1/2021 12:00:00 AM,3/31/2022 12:00:00 AM,15 Months,210000.3,191154.7,5107.34,11/23/2020 12:25:42 PM,122##65##3794##3086,"4- Likely to contribute to gender equality, including across age groups",Project Closure,2757,PRJ_PRJ_CLS,8921451.0591,1/7/2021 7:59:12 PM
59,2020 Second Standard Allocation,MM-20/DDA-3415/SA2/E-FS-H-N-P-WASH/INGO/17854,,,2020,2,Community Partners International,2,"Multi-Sectorial Humanitarian Response for IDP Camps in Hlaing Bwe and Hpapun Townships, Kayin State",1/1/2021 12:00:00 AM,12/31/2021 12:00:00 AM,12 Months,196857.7,183979.2,0,11/23/2020 11:58:04 AM,1986##2146##1456##1390,"4- Likely to contribute to gender equality, including across age groups",Project Closure,2757,PRJ_PRJ_CLS,3621833.2419,1/7/2021 8:11:25 PM
59,2020 Second Standard Allocation,MM-20/DDA-3415/SA2/E-P/NGO/17770,,,2020,2,Centre for Social Integrity,1,Protection and Education Response for Affected Host and IDP communities in Rakhine State,1/1/2021 12:00:00 AM,12/31/2021 12:00:00 AM,12 Months,306115,209834.1,76254.72,11/23/2020 1:19:46 PM,2146##1380##1460##1400,"4- Likely to contribute to gender equality, including across age groups",Project Closure,2757,PRJ_PRJ_CLS,6005378.0592,1/7/2021 8:02:23 PM
59,2020 Second Standard Allocation,MM-20/DDA-3415/SA2/E-WASH/INGO/17828,,,2020,2,People in Need,2,Supporting quality education and WASH in schools for conflict-affected children in Kachin State,12/31/2020 12:00:00 AM,2/28/2022 12:00:00 AM,"14 Months, 1 Days",336892.3,271923.7,42928.92,11/23/2020 2:41:11 PM,304##950##1459##1417,"4- Likely to contribute to gender equality, including across age groups",Project Closure,2757,PRJ_PRJ_CLS,8700098.9832,1/7/2021 7:54:57 PM
59,2020 Second Standard Allocation,MM-20/DDA-3415/SA2/E-WASH-FS-H-N-P/INGO/17803,,,2020,2,The Border Consortium,2,Locally-led Relief with Karen Communities,1/1/2021 12:00:00 AM,12/31/2021 12:00:00 AM,12 Months,255922.2,235079.6,4100,11/23/2020 10:58:57 AM,7242##6246##4308##4307,"4- Likely to contribute to gender equality, including across age groups",Project Closure,2757,PRJ_PRJ_CLS,5877058.0152,1/7/2021 8:04:27 PM
