PFId,AllNm,PrjCode,OPSCodeAgg,EmgAgg,AllYr,AllSrc,OrgNm,OrgTypeId,PrjTitle,AStrDt,AEndDt,PrjDur,PrgBdg,BgdDC,BdgSC,PrjSubDt,BenAgg,PrjGM,PrjStsNm,PrjStsId,PrjStsCode,PartCode,ApprDt
19,2nd Round Standard Allocation,SSD-18/HSS10/SA2/P/INGO/10072,,,2018,2,IsraAID,2,"WGFS/ GBV integrated Emergency Response Plan for Yei (Jigomoni, Hai Mission) and Lainya (Lainya Center, and Logwili)",9/3/2018 12:00:00 AM,4/2/2019 12:00:00 AM,7 Months,179997.5,126555,41667,7/29/2018 12:58:35 PM,378##3397##1843##6768,2b- The principal purpose of the project is to advance gender equality,Project Closure,266,PRJ_PRJ_CLS,31608.2214,9/13/2018 12:18:47 PM
19,2nd Round Standard Allocation,SSD-18/HSS10/SA2/P/INGO/9792,,,2018,2,Danish Refugee Council,2,"Integrated lifesaving protection response to the most vulnerable people in need, including women, children, elderly, disabled, and survivors of sexual violence in conflict through time sensitive integrated protection assessments and protection mobile response",9/20/2018 12:00:00 AM,3/19/2019 12:00:00 AM,6 Months,250000,184980.3,48664.48,7/29/2018 8:47:53 AM,2632##5264##2632##2632,2a- The project is designed to contribute significantly to gender equality,Project Closure,266,PRJ_PRJ_CLS,4621.0850,9/27/2018 12:13:16 PM
19,2nd Round Standard Allocation,SSD-18/HSS10/SA2/P/INGO/9840,,,2018,2,Alight,2,"Scaling up GBV Response and Prevention through  Women and Girls Friendly Spaces (WGFS)  in Aweil Centre County, Northern Bahr Ghazal State &amp; Kapoeta South and Kapoeta East Counties in Eastern Equatorial State in South Sudan.",9/1/2018 12:00:00 AM,2/28/2019 12:00:00 AM,6 Months,209999.3,176812,19449,7/28/2018 7:29:20 PM,120##2548##120##1666,2b- The principal purpose of the project is to advance gender equality,Project Closure,266,PRJ_PRJ_CLS,6839.2058,10/12/2018 6:39:20 AM
19,2nd Round Standard Allocation,SSD-18/HSS10/SA2/P/INGO/9896,,,2018,2,Nonviolent Peaceforce,2,Rapid integrated protection interventions to emergency locations in South Sudan,9/1/2018 12:00:00 AM,2/28/2019 12:00:00 AM,6 Months,249991.6,211569,22068,7/29/2018 3:01:15 PM,1680##2380##930##930,2a- The project is designed to contribute significantly to gender equality,Project Closure,266,PRJ_PRJ_CLS,18299.4966,9/10/2018 1:54:58 PM
19,2nd Round Standard Allocation,SSD-18/HSS10/SA2/P/INGO/9897,,,2018,2,Nonviolent Peaceforce,2,"Creating civilian space for strengthened community-based protection in Western Bahr El Ghazal, South Sudan",9/1/2018 12:00:00 AM,2/28/2019 12:00:00 AM,6 Months,299204.1,279630,0,7/29/2018 3:16:49 PM,2775##3145##660##770,2a- The project is designed to contribute significantly to gender equality,Project Closure,266,PRJ_PRJ_CLS,18299.4966,9/10/2018 2:05:18 PM
19,2nd Round Standard Allocation,SSD-18/HSS10/SA2/P/INGO/9900,,,2018,2,CARE International,2,"Providing Life-Saving GBV Prevention, Response and Risk Mitigation through well-staffed and Equipped Women and Girls Safe Spaces (WGSS) offering quality case management and Psycho-social support and strengthening Community Protection Networks in Magwi and Koch Counties.",9/3/2018 12:00:00 AM,3/2/2019 12:00:00 AM,6 Months,200000,148212,38703.91,7/29/2018 5:58:04 PM,1241##4139##1861##3103,2b- The principal purpose of the project is to advance gender equality,Project Closure,266,PRJ_PRJ_CLS,7208.8926,9/25/2018 12:51:39 PM
19,2nd Round Standard Allocation,SSD-18/HSS10/SA2/P/INGO/9939,,,2018,2,Save the Children,2,Life-saving integrated Child Protection interventions for vulnerable children and their caregivers in Jonglei State (Nyirol County),9/1/2018 12:00:00 AM,2/28/2019 12:00:00 AM,6 Months,200004,186919.6,0,7/29/2018 8:48:37 PM,1830##2008##3058##2972,2a- The project is designed to contribute significantly to gender equality,Project Closure,266,PRJ_PRJ_CLS,9611.8568,9/20/2018 8:33:15 AM
19,2nd Round Standard Allocation,SSD-18/HSS10/SA2/P/INGO/9946,,,2018,2,Danish De-mining Group,2,"Emergency response survey, clearance and risk education for conflict affected populations in Fashoda and Maban Counties",9/1/2018 12:00:00 AM,5/31/2019 12:00:00 AM,9 Months,850000,676158,118234.5,7/28/2018 9:56:46 AM,2400##3200##4800##5600,2a- The project is designed to contribute significantly to gender equality,Project Closure,266,PRJ_PRJ_CLS,4805.9284,9/27/2018 1:14:48 PM
19,2nd Round Standard Allocation,SSD-18/HSS10/SA2/P/INGO/9987,,,2018,2,INTERSOS,2,"Provision of life-saving protection assistance and services to vulnerable, conflict-affected children in Ayod, Jonglei State",9/1/2018 12:00:00 AM,2/28/2019 12:00:00 AM,6 Months,200000,170388.9,16527,7/29/2018 10:21:07 AM,550##750##1500##1500,2a- The project is designed to contribute significantly to gender equality,Project Closure,266,PRJ_PRJ_CLS,7578.5794,9/17/2018 7:11:32 AM
19,2nd Round Standard Allocation,SSD-18/HSS10/SA2/P/INGO/9997,,,2018,2,INTERSOS,2,"Providing life-saving GP, GBV and CP prevention and response activities through a national mobile intervention in conflict-affected hard-to reach locations in South Sudan",9/20/2018 12:00:00 AM,3/19/2019 12:00:00 AM,6 Months,250000,196709,36935.86,7/29/2018 3:37:44 PM,1250##1750##1250##1750,2a- The project is designed to contribute significantly to gender equality,Project Closure,266,PRJ_PRJ_CLS,7578.5794,9/17/2018 7:37:06 AM
19,2nd Round Standard Allocation,SSD-18/HSS10/SA2/P/NGO/10005,,,2018,2,Grassroots Relief and Development Agency,1,"Enhancing case management support for Survivors through Women and Girls friendly Space in Kapoeta North Chumakori, Najie and Lomeyen Payams Within  6 Months Period.",9/1/2018 12:00:00 AM,2/28/2019 12:00:00 AM,6 Months,120231,119040.6,0,7/29/2018 11:01:57 AM,507##1264##504##1225,2b- The principal purpose of the project is to advance gender equality,Project Closure,266,PRJ_PRJ_CLS,45101.7896,10/2/2018 8:50:50 AM
19,2nd Round Standard Allocation,SSD-18/HSS10/SA2/P/NGO/10020,,,2018,2,Community Action Organization,1,Increasing access to GBV services for Conflict affected population in Ayod County of Jonglei State,9/1/2018 12:00:00 AM,2/28/2019 12:00:00 AM,6 Months,100002.7,88390,8700,7/29/2018 10:54:30 AM,0##1300##400##2300,2b- The principal purpose of the project is to advance gender equality,Project Closure,266,PRJ_PRJ_CLS,39741.3310,9/10/2018 8:00:39 AM
19,2nd Round Standard Allocation,SSD-18/HSS10/SA2/P/NGO/10043,,,2018,2,Community Action Organization,1,"Strengthening of Community Based Child Protection  Network to improve, case management systems, provision of PSS, prevention and Response messages to the conflict affected children in Uror County on Jonglei State",9/1/2018 12:00:00 AM,2/28/2019 12:00:00 AM,6 Months,175000.9,122330,46752.96,7/28/2018 11:23:45 PM,800##800##2200##2200,2a- The project is designed to contribute significantly to gender equality,Project Closure,266,PRJ_PRJ_CLS,39741.3310,9/10/2018 9:03:45 AM
19,2nd Round Standard Allocation,SSD-18/HSS10/SA2/P/NGO/10073,,,2018,2,Save Lives Initiative South Sudan,1,"Enhancing protection response through Mines/ERW Risk Education to at-risk communities in Akobo East and West, Jonglei.",9/1/2018 12:00:00 AM,2/28/2019 12:00:00 AM,6 Months,49927.2,46880,0,7/29/2018 4:57:04 PM,5060##5540##6560##6040,2a- The project is designed to contribute significantly to gender equality,Project Closure,266,PRJ_PRJ_CLS,45841.1632,9/17/2018 7:35:10 AM
19,2nd Round Standard Allocation,SSD-18/HSS10/SA2/P/NGO/9769,,,2018,2,Mobile Humanitarian Agency,1,"Enhance protection monitoring, protection assessment and to promote community- based protection mechanism in the hard-to-reach areas in Mayendit, and Leer. counties.",9/1/2018 12:00:00 AM,2/28/2019 12:00:00 AM,6 Months,150000,119918.3,20268.6,7/28/2018 3:41:57 PM,3008##4780##2116##2520,2a- The project is designed to contribute significantly to gender equality,Project Closure,266,PRJ_PRJ_CLS,41035.2348,9/26/2018 2:46:03 PM
19,2nd Round Standard Allocation,SSD-18/HSS10/SA2/P/NGO/9770,,,2018,2,Hope Restoration South Sudan,1,ENHANCE GBV PREVENTION AND RESPONSE SERVICES FOR CONFLICT AFFECTED WOMEN AND GIRLS THROUGH WOMEN AND GIRLS FRIENDLY SPACES IN LEER TPA,9/1/2018 12:00:00 AM,2/28/2019 12:00:00 AM,6 Months,130000.7,121496,0,7/24/2018 11:43:09 AM,0##3200##0##1200,2a- The project is designed to contribute significantly to gender equality,Project Closure,266,PRJ_PRJ_CLS,39001.9574,9/10/2018 8:31:28 AM
19,2nd Round Standard Allocation,SSD-18/HSS10/SA2/P/NGO/9772,,,2018,2,Nile Hope,1,"Strengthening community mechanisms to respond to PSS needs through GBV risk mitigation, prevention and timely access to life-saving  services for GBV survivors in conflict affected communities in Leer County (especially in the islands of Tochriak, Meer,  Kok and the payams of Thonyor and Pilieny) of  Unity State.",9/1/2018 12:00:00 AM,2/28/2019 12:00:00 AM,6 Months,130000,108167.4,13328,7/28/2018 2:00:02 PM,800##2300##700##1200,2a- The project is designed to contribute significantly to gender equality,Project Closure,266,PRJ_PRJ_CLS,15157.1588,9/11/2018 5:30:30 PM
19,2nd Round Standard Allocation,SSD-18/HSS10/SA2/P/NGO/9777,,,2018,2,Hold the Child Organisation,1,"Emergency child protection and child centered resilience building in conflict affected State of  Western Bahr el Ghazal, Raja County",9/1/2018 12:00:00 AM,2/28/2019 12:00:00 AM,6 Months,100000,82297.94,11160,7/28/2018 12:56:39 PM,130##180##2100##2100,2a- The project is designed to contribute significantly to gender equality,Project Closure,266,PRJ_PRJ_CLS,18854.0268,9/10/2018 12:25:50 PM
19,2nd Round Standard Allocation,SSD-18/HSS10/SA2/P/NGO/9804,,,2018,2,Mundri Active Youth Association,1,GBV EMERGENCY RESPONSE PROJECT FOR MUNDRI WEST (Mundri and Kotobi Payam) and MUNDRI EAST (Lakama'di and Kedi'ba Payams),9/1/2018 12:00:00 AM,2/28/2019 12:00:00 AM,6 Months,125000,103742.5,13080,7/29/2018 9:39:24 AM,459##1651##400##1176,2b- The principal purpose of the project is to advance gender equality,Project Closure,266,PRJ_PRJ_CLS,26987.1364,9/12/2018 8:37:42 AM
19,2nd Round Standard Allocation,SSD-18/HSS10/SA2/P/NGO/9834,,,2018,2,Community Health and Development Organization,1,"Strengthening integrated GBV prevention and comprehensive case mangement to conflict affected communities of Jaak and Koch Payams of Koch County, Unity State",9/1/2018 12:00:00 AM,2/28/2019 12:00:00 AM,6 Months,124999.8,110590.3,6232,7/27/2018 10:42:47 AM,1200##2200##800##1900,2a- The project is designed to contribute significantly to gender equality,Project Closure,266,PRJ_PRJ_CLS,31977.9082,9/12/2018 9:37:32 AM
19,2nd Round Standard Allocation,SSD-18/HSS10/SA2/P/NGO/9842,,,2018,2,TITI Foundation,1,"To enhance reduction of exposure to Gender Based Violence (GBV) among vulnerable populations in Yei and Lainya counties, Central Equatoria state.",9/1/2018 12:00:00 AM,2/28/2019 12:00:00 AM,6 Months,94000,50720,37130.47,7/28/2018 8:04:37 PM,50##2750##10##200,2a- The project is designed to contribute significantly to gender equality,Project Closure,266,PRJ_PRJ_CLS,39926.1744,9/10/2018 11:44:03 AM
19,2nd Round Standard Allocation,SSD-18/HSS10/SA2/P/NGO/9849,,,2018,2,Universal Intervention and Development Organization,1,"Scaling up the provision of critical Child Protection services in Emergencies to 11 900 conflict affected children boys and girls, men and women in Southern Unity by 28 February 2019",9/1/2018 12:00:00 AM,2/28/2019 12:00:00 AM,6 Months,275000,232979.3,24030,7/28/2018 12:31:24 PM,1800##2500##3800##3800,2a- The project is designed to contribute significantly to gender equality,Project Closure,266,PRJ_PRJ_CLS,56746.9238,9/11/2018 10:13:39 AM
19,2nd Round Standard Allocation,SSD-18/HSS10/SA2/P/NGO/9861,,,2018,2,Mobile Theatre Team,1,"Provision of Mine Risk Education (MRE) to affected communities and internally displaced persons (IDPs), school children, women and men in Canal/Pigi and Twic East Counties in Jonglei State",9/1/2018 12:00:00 AM,2/28/2019 12:00:00 AM,6 Months,50009.66,37408,9330,7/29/2018 1:18:30 PM,1074##2293##3368##3343,2a- The project is designed to contribute significantly to gender equality,Project Closure,266,PRJ_PRJ_CLS,46026.0066,9/12/2018 3:55:14 PM
19,2nd Round Standard Allocation,SSD-18/HSS10/SA2/P/NGO/9919,,,2018,2,Health Link South Sudan,1,GBV Response and Prevention service to women and Girls through structured Activities in WGFS in iwire Payam and Nimule Payam,9/1/2018 12:00:00 AM,2/28/2019 12:00:00 AM,6 Months,125000,97772.46,19050,7/28/2018 1:33:26 PM,700##1480##420##900,2a- The project is designed to contribute significantly to gender equality,Project Closure,266,PRJ_PRJ_CLS,23290.2684,9/12/2018 11:07:33 AM
19,2nd Round Standard Allocation,SSD-18/HSS10/SA2/P/NGO/9979,,,2018,2,Community Initiative for Development Organization,1,"Emergency Response to Protection needs of IDPS and Host community at risk of GBV in Urban Yei, Tore and Otogo Payams of Yei County,Central Equatoria State.",9/1/2018 12:00:00 AM,2/28/2019 12:00:00 AM,6 Months,125000,108542.4,8280.01,7/28/2018 2:24:48 PM,500##2200##500##1000,2a- The project is designed to contribute significantly to gender equality,Project Closure,266,PRJ_PRJ_CLS,35859.6196,9/11/2018 6:02:58 AM
19,2nd Round Standard Allocation,SSD-18/HSS10/SA2/P/NGO/9982,,,2018,2,Community in Need Aid,1,Access to lifesaving child protection services for conflict affected children and caregivers in Duk,9/1/2018 12:00:00 AM,2/28/2019 12:00:00 AM,6 Months,150000,98306.92,41880,7/29/2018 4:47:08 PM,430##420##2466##2684,2a- The project is designed to contribute significantly to gender equality,Project Closure,266,PRJ_PRJ_CLS,25878.0760,9/13/2018 7:34:09 AM
19,2nd Round Standard Allocation,SSD-18/HSS10/SA2/P/NGO/9983,,,2018,2,South Sudan Law Society,1,"PROTECTING HOUSING, LAND AND PROPERTY RIGHTS IN TRANSITION (PHLAPRIT)",9/1/2018 12:00:00 AM,5/31/2019 12:00:00 AM,9 Months,249999.1,221944,11700,7/29/2018 6:10:16 PM,2100##3900##900##1400,2a- The project is designed to contribute significantly to gender equality,Project Closure,266,PRJ_PRJ_CLS,45286.6330,9/24/2018 6:31:36 AM
19,2nd Round Standard Allocation,SSD-18/HSS10/SA2/P/UN/9812,,,2018,2,United Nations Children's Fund,3,"Provision of critical frontline child protection services to extremely vulnerable children and women living in hard to reach areas through integrated rapid response mechanism (IRRM) missions to provide critical protection services, including family tracing and reunification, psychosocial support and strengthening of community based networks with a focus on Western Equatoria and other priority conflict affected areas.",9/1/2018 12:00:00 AM,4/30/2019 12:00:00 AM,8 Months,199469.7,186420.3,0,7/29/2018 5:17:51 PM,5640##6360##9870##11130,2a- The project is designed to contribute significantly to gender equality,Project Closure,266,PRJ_PRJ_CLS,924.2170,8/30/2018 8:47:54 PM
19,2nd Round Standard Allocation,SSD-18/HSS10/SA2/WASH/INGO/9841,,,2018,2,Polish Humanitarian Action,2,"Provision of timely, equitable and integrated WASH’NUT services to address the needs of the target population with high number of SAM/MAM cases in the conflict affected Jebel Boma, Pibor County, Jonglei State.",9/1/2018 12:00:00 AM,3/31/2019 12:00:00 AM,7 Months,365364.3,296804,44657.96,7/29/2018 11:54:34 AM,3400##3800##6400##6400,2a- The project is designed to contribute significantly to gender equality,Project Closure,266,PRJ_PRJ_CLS,10351.2304,9/26/2018 8:27:13 AM
19,2nd Round Standard Allocation,SSD-18/HSS10/SA2/WASH/INGO/9989,,,2018,2,Solidarités International,2,Strengthening Cholera Preparedness and Response in Juba County and cholera prone areas in South Sudan,9/1/2018 12:00:00 AM,3/31/2019 12:00:00 AM,7 Months,300000,221583.6,58790.28,7/29/2018 8:03:07 PM,8667##10407##8885##11041,2a- The project is designed to contribute significantly to gender equality,Project Closure,266,PRJ_PRJ_CLS,7024.0492,9/11/2018 1:43:59 PM
19,2nd Round Standard Allocation,SSD-18/HSS10/SA2/WASH/NGO/10014,,,2018,2,Humanitarian Aid for Change and Transformation,1,Emergency WASH Support to IDPs and vulnerable host communities in Lopa Lafon County.,9/1/2018 12:00:00 AM,2/28/2019 12:00:00 AM,6 Months,240000.5,202849.5,21450,7/28/2018 4:50:12 PM,9120##6080##480##320,2a- The project is designed to contribute significantly to gender equality,Project Closure,266,PRJ_PRJ_CLS,37523.2102,9/12/2018 10:25:23 AM
19,2nd Round Standard Allocation,SSD-18/HSS10/SA2/WASH/NGO/10039,,,2018,2,Stop Poverty Communal Initiative,1,"Emergency WASH Provision Among Most Vulnerable Displaced and Host Populations of Pibor County, former Jonglei State",9/1/2018 12:00:00 AM,2/28/2019 12:00:00 AM,6 Months,148077.3,129420,8970,7/29/2018 12:10:07 PM,2000##2000##4000##4000,2a- The project is designed to contribute significantly to gender equality,Project Closure,266,PRJ_PRJ_CLS,41959.4518,9/11/2018 10:40:23 AM
19,2nd Round Standard Allocation,SSD-18/HSS10/SA2/WASH/NGO/10081,,,2018,2,Humane Aid for Community Organization,1,"Emergency WASH support to IDPs and Vulnerable host communities in Rubkona and Panyijiar Counties with high malnutrition, GBV and cholera prone.",9/1/2018 12:00:00 AM,2/28/2019 12:00:00 AM,6 Months,170407.1,141069,18190,7/29/2018 8:52:17 PM,2100##3500##3100##2600,2a- The project is designed to contribute significantly to gender equality,Project Closure,266,PRJ_PRJ_CLS,32902.1252,9/11/2018 4:00:34 PM
19,2nd Round Standard Allocation,SSD-18/HSS10/SA2/WASH/NGO/10099,,,2018,2,Community Aid for Relief and Developemnt,1,"Emergency Provision of WASH Support Interventions Among Most Vulnerable and Conflict Affected people (Men, Women, Girls and Boys) in former Magwi County",9/1/2018 12:00:00 AM,2/28/2019 12:00:00 AM,6 Months,218622.4,178940,25380,7/29/2018 5:15:59 PM,4000##4000##8000##8000,2a- The project is designed to contribute significantly to gender equality,Project Closure,266,PRJ_PRJ_CLS,33271.8120,9/10/2018 11:09:23 AM
19,2nd Round Standard Allocation,SSD-18/HSS10/SA2/WASH/NGO/9786,,,2018,2,Support for Peace and Education Development Programme,1,Integrated Emergency WASH Response in Fangak and Canal Pigi of Jongolei State.,9/1/2018 12:00:00 AM,2/28/2019 12:00:00 AM,6 Months,351984,280203,48754.02,7/28/2018 10:04:39 AM,5120##8150##6237##7493,2a- The project is designed to contribute significantly to gender equality,Project Closure,266,PRJ_PRJ_CLS,18669.1834,9/12/2018 8:11:27 AM
19,2nd Round Standard Allocation,SSD-18/HSS10/SA2/WASH/NGO/9791,,,2018,2,Nile Hope,1,"Emergency water, sanitation and hygiene promotion services for undeserved and vulnerable population affected by conflict, disease outbreak and acute malnutrition in Leer, Fangak,Uror and  Canal/Pigi",8/16/2018 12:00:00 AM,2/28/2019 12:00:00 AM,6 Months 13 Days,400000,367681.8,6150,7/28/2018 9:48:05 PM,4342##7157##5065##7153,2a- The project is designed to contribute significantly to gender equality,Project Closure,266,PRJ_PRJ_CLS,15157.1588,9/11/2018 5:38:15 PM
19,2nd Round Standard Allocation,SSD-18/HSS10/SA2/WASH/NGO/9797,,,2018,2,Christian Mission for Development,1,Emergency WASH Support to IDPs and Vulnerable Host Communities in Jonglei and Eastern Equatoria States.,9/1/2018 12:00:00 AM,4/30/2019 12:00:00 AM,8 Months,438789.3,362026,48057.5,7/29/2018 3:37:58 AM,8144##10648##5638##6890,2a- The project is designed to contribute significantly to gender equality,Project Closure,266,PRJ_PRJ_CLS,19223.7136,9/11/2018 12:10:36 PM
19,2nd Round Standard Allocation,SSD-18/HSS10/SA2/WASH/NGO/9801,,,2018,2,Universal Intervention and Development Organization,1,"Addressing acute Water, Sanitation and Hygiene needs of conflict affected communities through an integrated intervention in Nutrition and GBV streamlining in Leer County and Payams of Mayendit North County in Unity State.",9/1/2018 12:00:00 AM,2/28/2019 12:00:00 AM,6 Months,271546.3,182505,71276.6,7/28/2018 9:13:02 AM,2250##4150##4350##5250,2a- The project is designed to contribute significantly to gender equality,Project Closure,266,PRJ_PRJ_CLS,56746.9238,9/11/2018 9:56:23 AM
19,2nd Round Standard Allocation,SSD-18/HSS10/SA2/WASH/NGO/9845,,,2018,2,LiveWell South Sudan,1,"Scaling-up integrated essential emergency WASH interventions to addressed GBV and malnutrition issues as well as prevent cholera outbreaks in Pibor and Magwi counties  in Jonglei and Equatoria States, South Sudan",9/1/2018 12:00:00 AM,2/28/2019 12:00:00 AM,6 Months,205859.4,155696,36696,7/29/2018 2:26:17 PM,3163##5876##6779##7682,2a- The project is designed to contribute significantly to gender equality,Project Closure,266,PRJ_PRJ_CLS,36229.3064,9/12/2018 8:53:44 PM
19,2nd Round Standard Allocation,SSD-18/HSS10/SA2/WASH/NGO/9885,,,2018,2,Care for Children and Old Age in South Sudan,1,Integrated emergency WASH services for vulnerable conflict and disease prone-affected communities in Tonj East County (Warrap),9/1/2018 12:00:00 AM,2/28/2019 12:00:00 AM,6 Months,300000.2,256942,23432,7/28/2018 7:47:57 AM,4630##5120##4870##5380,2a- The project is designed to contribute significantly to gender equality,Project Closure,266,PRJ_PRJ_CLS,28281.0402,9/11/2018 5:30:45 AM
19,2nd Round Standard Allocation,SSD-18/HSS10/SA2/WASH/NGO/9907,,,2018,2,Nile Sustainable Development Organization,1,"Improving health standards among 17,400 displaced and host community members who are at risk of getting cholera in Northern Bari, Munuki Town Block and Rejaf Payam of Juba County.",9/1/2018 12:00:00 AM,1/31/2019 12:00:00 AM,5 Months,200405.7,152245,35050,7/29/2018 4:48:23 PM,1740##2610##6438##6612,2a- The project is designed to contribute significantly to gender equality,Project Closure,266,PRJ_PRJ_CLS,43438.1990,9/13/2018 4:29:41 PM
19,2nd Round Standard Allocation,SSD-18/HSS10/SA2/WASH/NGO/9945,,,2018,2,Impact Health Organization,1,"Emergency prevention and control of WASH related disease outbreak among vulnerable amongst IDP, Returnees and Host population in Torit County, Eastern Equatorial state",9/1/2018 12:00:00 AM,2/28/2019 12:00:00 AM,6 Months,270000,222309,30500,7/27/2018 9:34:11 AM,1500##7000##3000##3500,2a- The project is designed to contribute significantly to gender equality,Project Closure,266,PRJ_PRJ_CLS,33086.9686,9/11/2018 12:49:55 PM
21,Reserve,SOM-18/3485/RA1/Ed-Prot/INGO/9224,,,2018,1,Himilo Relief and Development Association,1,Provision of integrated emergency education and  child protection response to floods affected population  in Bardhere and Luuq districts of Gedo Regions.  ,7/6/2018 12:00:00 AM,1/5/2019 12:00:00 AM,6 Months,199988.8,186905.4,0,6/6/2018 8:20:17 AM,70##50##3200##2029,"4- Not applicable - Only used for very small number of projects, such as 'support services'",Project Closure,292,PRJ_PRJ_CLS,137042.6610,7/12/2018 12:36:35 PM
21,Reserve,SOM-18/3485/RA1/Ed-Prot/NGO/9216,,,2018,1,Humanitarian Integrity for Women Action,1,"Enhancing access to Integrated Child Protection and Education Interventions for flood affected populations in Beletweyne district, Hiraan Region.",6/1/2018 12:00:00 AM,12/31/2018 12:00:00 AM,7 Months,249592.1,212863.6,20400,5/18/2018 12:45:56 PM,1525##2327##4884##4980,2a- The project is designed to contribute significantly to gender equality,Project Closure,292,PRJ_PRJ_CLS,57609.2685,7/2/2018 3:58:35 PM
21,Reserve,SOM-18/3485/RA1/Ed-Prot/NGO/9221,,,2018,1,Aid Vision,1,"Improving Access to lifesaving and Sustaining Education and Child Protection Services to Flood Affected Children(Boys and Girls) in Jowhar District, Middle Shabelle Region, Hirshabelle State of Somalia.",7/2/2018 12:00:00 AM,1/1/2019 12:00:00 AM,6 Months,348866,326043,0,5/22/2018 7:48:27 PM,1083##1285##1800##1400,2b- The principal purpose of the project is to advance gender equality,Project Closure,295,PRJ_UND_AUD,128698.1430,7/2/2018 7:46:55 PM
21,Reserve,SOM-18/3485/RA1/H-Ed-Nut-WASH/INGO/9502,,,2018,1,Adventist Development and Relief Agency,2,Cyclone Response Interventions and Support in Somaliland (CRISIS),7/13/2018 12:00:00 AM,2/28/2019 12:00:00 AM,"7 Months, 16 Days",1452796,1300453,57300,6/28/2018 11:07:05 AM,27750##30393##35679##38322,2a- The project is designed to contribute significantly to gender equality,Project Closure,292,PRJ_PRJ_CLS,19737.9945,7/17/2018 8:27:35 PM
21,Reserve,SOM-18/3485/RA1/Prot/NGO/9214,,,2018,1,Socio-Economic Development and Human Rights Organization,1,Integrated Emergency support Project for flood affected children in Luuq and Bardera Districts of Gedo Region CSZ.,7/3/2018 12:00:00 AM,1/2/2019 12:00:00 AM,6 Months,205258.1,178290,13540,5/11/2018 5:59:49 PM,424##676##3584##3256,2a- The project is designed to contribute significantly to gender equality,Project Closure,292,PRJ_PRJ_CLS,131586.6300,7/9/2018 2:49:14 PM
21,Reserve 2018 Cyclone Sagar Response,SOM-18/3485/RA2018/FSC/NGO/9579,,,2018,1,Taakulo Somaliland Community,1,"Integrated Emergency Response to Food Security and Livelihood for the Sagar Cyclone Affected Communities in Lughaya district, Awdal Region",7/30/2018 12:00:00 AM,4/30/2019 12:00:00 AM,"9 Months, 1 Days",418728.4,382455,8880,7/3/2018 4:37:09 PM,933##1276##1227##1472,2a- The project is designed to contribute significantly to gender equality,Project Closure,292,PRJ_PRJ_CLS,134956.5315,7/27/2018 1:01:45 PM
21,Reserve 2018 Cyclone Sagar Response,SOM-18/3485/RA2018/FSC/NGO/9580,,,2018,1,Agricultural Development Organisation,1,Emergency assistance for protecting and restoration of productive Livelihood assets  of pastoral and agro-pastoral communities in Cyclone Sagar affected villages in Baki District.,7/30/2018 12:00:00 AM,1/29/2019 12:00:00 AM,6 Months,420001.6,392524.8,0,7/3/2018 7:37:10 PM,2231##2636##2535##2738,2a- The project is designed to contribute significantly to gender equality,Project Closure,292,PRJ_PRJ_CLS,35464.2015,7/27/2018 4:04:18 PM
