PFId,AllNm,PrjCode,OPSCodeAgg,EmgAgg,AllYr,AllSrc,OrgNm,OrgTypeId,PrjTitle,AStrDt,AEndDt,PrjDur,PrgBdg,BgdDC,BdgSC,PrjSubDt,BenAgg,PrjGM,PrjStsNm,PrjStsId,PrjStsCode,PartCode,ApprDt
67,1st Reserve Allocation for Gaza (2018),OPT-18/DDA-3482/RA1/PROT/NGO/9203,,,2018,1,Palestinian Center for Human Rights,1,"Monitoring , verification and documentation of possible IHL,IHRL violations, And provision of legal aid to victims in the Gaza Strip",5/16/2018 12:00:00 AM,11/16/2018 12:00:00 AM,"6 Months, 1 Days",198654.1,181158,4500,4/30/2018 6:08:33 PM,750##350##30##35,2a- The project is designed to contribute significantly to gender equality,Project Closure,2795,PRJ_PRJ_CLS,3160628.6540,5/16/2018 4:26:29 PM
67,West Bank demolition emergency response,OPT-18/DDA-3482/RA1/SNFI/INGO/7709,,,2018,1,Agency for Technical Cooperation and Development,2,Prepositioning for emergency response to natural and man-made disasters in the West Bank,2/1/2018 12:00:00 AM,7/15/2018 12:00:00 AM,"5 Months, 15 Days",234899.2,200405,19126.96,1/24/2018 11:08:24 AM,317##314##359##364,2a- The project is designed to contribute significantly to gender equality,Project Closure,2795,PRJ_PRJ_CLS,10123112.9795,2/8/2018 3:26:37 PM
67,Emergency Response / Gap Filling for Health and Food Security in West Bank,OPT-18/DDA-3482/RA2/FSL-HNC/UN/7749,,,2018,1,United Nations Relief and Works Agency for Palestinian Refugees in Near East,3,Multi-sectoral Emergency Response to Vulnerable Communities,2/16/2018 12:00:00 AM,10/31/2018 12:00:00 AM,"8 Months, 16 Days",899972.7,899972.7,0,1/29/2018 8:22:51 AM,37072##35618##34221##32879,2a- The project is designed to contribute significantly to gender equality,Project Closure,2795,PRJ_PRJ_CLS,11682742.5640,2/27/2018 2:35:45 PM
67,2nd  Reserve Allocation (2018),OPT-18/DDA-3482/RA2/HNC/INGO/9451,,,2018,1,Medical Aid for Palestinians,2,Provision of life saving drugs and disposables to respond to the emergency medical needs in Gaza.,7/3/2018 12:00:00 AM,1/2/2019 12:00:00 AM,6 Months,979653.6,915564.1,0,6/11/2018 11:38:02 AM,64100##13700##17000##10200,2a- The project is designed to contribute significantly to gender equality,Project Closure,2795,PRJ_PRJ_CLS,11422114.8085,7/9/2018 6:10:08 PM
67,2nd  Reserve Allocation (2018),OPT-18/DDA-3482/RA2/HNC/INGO/9457,,,2018,1,Handicap International,2,Addressing urgent injury care and multi-disciplinary rehabilitation needs of the casualties of border clashes (“March of Return”) in the Gaza strip,7/4/2018 12:00:00 AM,5/3/2019 12:00:00 AM,10 Months,500000,467289.7,0,6/18/2018 12:51:04 PM,4782##201##978##39,1- The project is designed to contribute in some limited way to gender equality,Project Closure,2795,PRJ_PRJ_CLS,11819261.8645,7/9/2018 6:17:32 PM
67,2nd  Reserve Allocation (2018),OPT-18/DDA-3482/RA2/HNC/NGO/9489,,,2018,1,Al Awda Health and Community Association,1,To alleviate the suffering of patients waiting on the waiting list for surgical operations in the Ministry of Health and alleviate the burden of the MoH through conducting surgical operations with high quality in Al Awda Hospital in the northern Gaza Strip - OPT,7/3/2018 12:00:00 AM,4/2/2019 12:00:00 AM,9 Months,300000.2,280374,0,6/13/2018 12:02:52 PM,200##300##150##155,2a- The project is designed to contribute significantly to gender equality,Project Closure,2795,PRJ_PRJ_CLS,1836805.1340,7/3/2018 7:50:02 PM
67,2nd  Reserve Allocation (2018),OPT-18/DDA-3482/RA2/HNC/UN/9458,,,2018,1,United Nations Relief and Works Agency for Palestinian Refugees in Near East,3,Supporting vulenrable Palestine refugees' immediate health needs in Gaza,7/16/2018 12:00:00 AM,3/15/2019 12:00:00 AM,8 Months,390550,365000,0,6/13/2018 11:44:02 AM,1480##95##345##20,3- Not Specified,Project Closure,2795,PRJ_PRJ_CLS,11682742.5640,7/13/2018 8:39:13 PM
67,2nd  Reserve Allocation (2018),OPT-18/DDA-3482/RA2/HNC/UN/9468,,,2018,1,World Health Organization,3,Enhance the pre-hospital trauma care by upgrading the Trauma Stabilisation Points (TSPs) across the five governorates in the Gaza Strip,8/6/2018 12:00:00 AM,11/30/2019 12:00:00 AM,"15 Months, 25 Days",908224.3,848807.8,0,6/19/2018 6:16:00 PM,26100##620##1040##956,2a- The project is designed to contribute significantly to gender equality,Project Closure,2795,PRJ_PRJ_CLS,11062200.2890,8/3/2018 3:45:02 PM
67,2nd  Reserve Allocation (2018),OPT-18/DDA-3482/RA2/HNC/UN/9535,,,2018,1,United Nations Children's Fund,3,"Provision of urgently needed life-saving drugs and medical consumables for women and children in Gaza, especially those affected by events in early 2018",7/9/2018 12:00:00 AM,10/30/2019 12:00:00 AM,"15 Months, 22 Days",647123.2,604788,0,6/19/2018 1:33:48 PM,0##27604##34726##26712,2a- The project is designed to contribute significantly to gender equality,Project Closure,2795,PRJ_PRJ_CLS,10925680.9885,7/12/2018 2:41:56 PM
67,2nd  Reserve Allocation (2018),OPT-18/DDA-3482/RA2/PROT/INGO/9456,,,2018,1,The Israeli Information Center for Human Rights in the Occupied Territories,2,Monitoring and Documentation of Violations Against Vulnerable Palestinian Communities Living in a Coercive Environment,7/26/2018 12:00:00 AM,4/25/2019 12:00:00 AM,9 Months,257749.3,245475.5,0,6/19/2018 8:45:49 PM,600##200##0##0,1- The project is designed to contribute in some limited way to gender equality,Project Closure,2795,PRJ_PRJ_CLS,4922968.7150,7/31/2018 4:22:36 PM
67,2nd  Reserve Allocation (2018),OPT-18/DDA-3482/RA2/PROT/INGO/9521,,,2018,1,War Child Holland,2,Improved child protection and psychosocial support service provision for children affected by the conflict in Area C,8/6/2018 12:00:00 AM,5/5/2019 12:00:00 AM,9 Months,249989,210216.1,23418.54,6/19/2018 8:44:52 PM,181##240##635##380,2a- The project is designed to contribute significantly to gender equality,Project Closure,2795,PRJ_PRJ_CLS,11004283.0100,8/20/2018 2:10:16 PM
67,2nd  Reserve Allocation (2018),OPT-18/DDA-3482/RA2/PROT/INGO/9536,,,2018,1,DanChurchAid,2,Improved protection mechanism in communities of Area E1 through the work of EAPPI and Bimkom,7/25/2018 12:00:00 AM,4/24/2019 12:00:00 AM,9 Months,250000,194131.5,39513.32,6/19/2018 5:53:59 PM,366##424##617##582,2a- The project is designed to contribute significantly to gender equality,Project Closure,2795,PRJ_PRJ_CLS,11637236.1305,7/27/2018 12:00:50 PM
67,2nd  Reserve Allocation (2018),OPT-18/DDA-3482/RA2/PROT/NGO/9448,,,2018,1,Palestinian Center for Democracy and Conflict Resolution,1,"Emergency response for protection and psycho-social needs of injured individuals and families of injured or killed people in the demonstrations at the fence in Gaza, Khanyounis and North Governorates.",7/15/2018 12:00:00 AM,4/14/2019 12:00:00 AM,9 Months,239076.8,213534,9902.3,6/19/2018 10:17:15 AM,3260##990##6060##2185,2a- The project is designed to contribute significantly to gender equality,Project Closure,539,PRJ_UND_CLSR,4956064.3030,7/12/2018 2:45:22 PM
67,2nd  Reserve Allocation (2018),OPT-18/DDA-3482/RA2/PROT/NGO/9512,,,2018,1,Aisha Association for Women and Child Protection.,1,Comprehensive Protection Response through provision of psycho-social and mental health services for conflict affected population in the Gaza strip,7/12/2018 12:00:00 AM,4/11/2019 12:00:00 AM,9 Months,321535,300500,0,6/19/2018 5:16:19 PM,1025##3025##450##450,2b- The principal purpose of the project is to advance gender equality,Project Closure,2795,PRJ_PRJ_CLS,1861626.8250,7/25/2018 4:59:49 PM
67,3rd Reserve allocation (Gaza),OPT-18/DDA-3482/RA3/HNC-WASH/UN/10516,,,2018,1,United Nations Relief and Works Agency for Palestinian Refugees in Near East,3,Providing Fuel to Support the Health Primary and WASH Services in Gaza Strip,9/23/2018 12:00:00 AM,12/22/2018 12:00:00 AM,3 Months,1012980,946710,0,9/17/2018 7:51:14 AM,498682##481079##486574##495932,1- The project is designed to contribute in some limited way to gender equality,Project Closure,2795,PRJ_PRJ_CLS,11682742.5640,9/21/2018 5:05:26 PM
67,1st Standard allocation 2018,OPT-18/DDA-3482/SA1/PROT/INGO/9079,,,2018,2,Terre des Hommes Lausanne,2,Meeting the Protection Needs of Vulnerable Children  in the Gaza Strip through Child Protection Case Management System,6/3/2018 12:00:00 AM,5/31/2019 12:00:00 AM,"11 Months, 29 Days",250001.9,192325,41321.6,4/29/2018 6:34:51 PM,3420##3530##1515##1215,2b- The principal purpose of the project is to advance gender equality,Project Closure,2797,PRJ_PRJ_CLS,12013698.4440,6/11/2018 1:55:36 PM
67,1st Standard allocation 2018,OPT-18/DDA-3482/SA1/PROT/INGO/9156,,,2018,2,ALIANZA POR LA SOLIDARIDAD,2,Strengthening the protection mechanism and the community based response for GBV survivors in Gaza,6/10/2018 12:00:00 AM,6/10/2019 12:00:00 AM,"12 Months, 1 Days",199998,187968,0,4/29/2018 8:24:21 PM,770##8466##400##400,2b- The principal purpose of the project is to advance gender equality,Project Closure,2797,PRJ_PRJ_CLS,1952639.6920,6/14/2018 1:56:10 PM
67,1st Standard allocation 2018,OPT-18/DDA-3482/SA1/PROT/NGO/9094,,,2018,2,Women's Affairs Center,1,Promoting prevention and protection responses to acutely Vulnerable Women and Girls Victims and Survivors of SGBV in the Marginalized Localities of Gaza Strip.,6/1/2018 12:00:00 AM,12/31/2018 12:00:00 AM,7 Months,250009.8,235214.8,0,4/28/2018 9:29:11 AM,780##8454##312##4127,2b- The principal purpose of the project is to advance gender equality,Project Closure,2797,PRJ_PRJ_CLS,3259915.4180,6/4/2018 8:08:19 PM
67,1st Standard allocation 2018,OPT-18/DDA-3482/SA1/PROT/NGO/9159,,,2018,2,Gaza Community Mental Health programme (GCMHP),1,"Enhancing protection through provision of specialized mental health services and psycho-social support to the affected men, women, girls and boys living in vulnerable areas at Gaza Strip",6/1/2018 12:00:00 AM,5/31/2019 12:00:00 AM,12 Months,199714.4,177019,9630,4/29/2018 4:29:55 PM,449##581##171##199,2a- The project is designed to contribute significantly to gender equality,Project Closure,2797,PRJ_PRJ_CLS,1853352.9280,6/5/2018 3:13:29 PM
67,1st Standard allocation 2018,OPT-18/DDA-3482/SA1/SNFI/INGO/9031,,,2018,2,Première Urgence Internationale,2,Protect acutely vulnerable households from harsh summer conditions and upgrade of substandard housing units to meet minimum standards for shelter,6/1/2018 12:00:00 AM,12/1/2018 12:00:00 AM,"6 Months, 1 Days",300000,267752.4,12621.37,4/29/2018 10:16:54 AM,92##89##89##87,2a- The project is designed to contribute significantly to gender equality,Project Closure,2797,PRJ_PRJ_CLS,2072611.1985,6/7/2018 3:16:02 PM
67,1st Standard allocation 2018,OPT-18/DDA-3482/SA1/SNFI/INGO/9034,,,2018,2,Secours Islamique France,2,Summarization for Vulnerable Families Homes Headed by Women in Gaza Strip,5/28/2018 12:00:00 AM,11/28/2018 12:00:00 AM,"6 Months, 1 Days",322444.5,292340,9010,4/29/2018 1:38:14 PM,38##106##178##134,2a- The project is designed to contribute significantly to gender equality,Project Closure,2797,PRJ_PRJ_CLS,11380745.3235,5/30/2018 6:55:20 PM
67,1st Standard allocation 2018,OPT-18/DDA-3482/SA1/SNFI/INGO/9139,,,2018,2,Agency for Technical Cooperation and Development,2,Self-repair and upgrade of vulnerable households’ substandard shelters in the Gaza Strip to prepare them for harsh weather conditions,6/1/2018 12:00:00 AM,11/30/2018 12:00:00 AM,6 Months,307971.2,242361.5,45462.02,4/29/2018 8:46:22 AM,153##148##160##152,2a- The project is designed to contribute significantly to gender equality,Project Closure,2797,PRJ_PRJ_CLS,10123112.9795,6/13/2018 4:28:44 PM
67,1st Standard allocation 2018,OPT-18/DDA-3482/SA1/SNFI/INGO/9184,,,2018,2,Fondazione We World - GVC Onlus,2,"Reinforce the capacities of protection from natural, man-made hazards and conflict escalation of acutely-vulnerable Palestinian households",5/31/2018 12:00:00 AM,12/31/2018 12:00:00 AM,"7 Months, 1 Days",250705.6,212044.5,22259.82,4/29/2018 1:21:18 PM,219##188##159##195,2a- The project is designed to contribute significantly to gender equality,Project Closure,2797,PRJ_PRJ_CLS,11600003.5940,5/31/2018 5:18:48 PM
67,1st Standard allocation 2018,OPT-18/DDA-3482/SA1/SNFI/NGO/9030,,,2018,2,MA’AN Development Center,1,Protect the Health and Safety of IDPs and Hardship Cases through Emergency Shelter Responses,5/27/2018 12:00:00 AM,12/27/2018 12:00:00 AM,"7 Months, 1 Days",282532.9,252400,11649.4,4/28/2018 9:18:18 AM,202##213##245##248,2a- The project is designed to contribute significantly to gender equality,Project Closure,2797,PRJ_PRJ_CLS,1811983.4430,5/29/2018 6:57:52 PM
67,1st Standard allocation 2018,OPT-18/DDA-3482/SA1/WASH/INGO/8994,,,2018,2,Fondazione We World - GVC Onlus,2,Strengthening of resilience capacities through comprehensive emergency WASH interventions in the most vulnerable areas of the Gaza Strip,5/31/2018 12:00:00 AM,1/31/2019 12:00:00 AM,"8 Months, 1 Days",257500.2,207010,33644.4,4/29/2018 4:23:51 PM,21651##21234##25828##24727,2a- The project is designed to contribute significantly to gender equality,Project Closure,2797,PRJ_PRJ_CLS,11600003.5940,5/31/2018 5:12:55 PM
67,1st Standard allocation 2018,OPT-18/DDA-3482/SA1/WASH/INGO/9134,,,2018,2,Fundacion Accion Contra El Hambre (Action Against Hunger ),2,"Emergency response to improve access to safe, sufficient and affordable water and sanitation facilities for the vulnerable population in southern West Bank",5/28/2018 12:00:00 AM,12/31/2018 12:00:00 AM,"7 Months, 4 Days",385000,348737.3,11075.72,4/29/2018 8:50:37 AM,1582##1660##1656##1687,2a- The project is designed to contribute significantly to gender equality,Project Closure,2797,PRJ_PRJ_CLS,11575181.9030,6/1/2018 2:24:14 PM
67,1st Standard allocation 2018,OPT-18/DDA-3482/SA1/WASH/NGO/8999,,,2018,2,Arab Agronomists Association,1,Improving the access to domestic water for Za'tara vulnerable community in area C in Bethlehem Governorate,5/27/2018 12:00:00 AM,2/27/2019 12:00:00 AM,"9 Months, 1 Days",300823.1,286498.2,0,4/29/2018 4:46:52 PM,888##854##924##888,2a- The project is designed to contribute significantly to gender equality,Project Closure,2797,PRJ_PRJ_CLS,1927818.0010,5/29/2018 6:54:49 PM
67,1st Standard allocation 2018,OPT-18/DDA-3482/SA1/WASH/NGO/9067,,,2018,2,Palestinian Hydrology Society for Water and Environmental Resources Development,1,Improve Household WASH conditions for war affected families in the Gaza Strip,6/1/2018 12:00:00 AM,6/1/2019 12:00:00 AM,"12 Months, 1 Days",581138.4,543120,0,4/29/2018 12:59:08 PM,2132##2100##2447##2336,2a- The project is designed to contribute significantly to gender equality,Project Closure,2797,PRJ_PRJ_CLS,1816120.3915,6/4/2018 8:02:44 PM
67,2nd Standard allocation 2018,OPT-18/DDA-3482/SA2/EDU/INGO/10680,,,2018,2,World Vision,2,Providing Equitable and safe access to maintain resilience of vulnerable students in Area C in south Nablus and Hebron,11/13/2018 12:00:00 AM,10/12/2019 12:00:00 AM,11 Months,340635.8,324415,0,10/6/2018 9:10:48 AM,148##230##3746##4209,2a- The project is designed to contribute significantly to gender equality,Project Closure,2797,PRJ_PRJ_CLS,4985022.9425,11/12/2018 7:01:33 PM
67,2nd Standard allocation 2018,OPT-18/DDA-3482/SA2/EDU/UN/10778,,,2018,2,United Nations Children's Fund,3,Protected and safe access to education as an emergency response for vulnerable communities in the West Bank.,11/15/2018 12:00:00 AM,11/14/2019 12:00:00 AM,12 Months,244558.2,228559.1,0,10/6/2018 6:47:37 PM,100##100##4000##2700,2a- The project is designed to contribute significantly to gender equality,Project Closure,2797,PRJ_PRJ_CLS,10925680.9885,11/8/2018 8:08:33 PM
67,2nd Standard allocation 2018,OPT-18/DDA-3482/SA2/FSL/INGO/10653,,,2018,2,Catholic Relief Services,2,Gaza E-Voucher Response: Food Assistance for Families in Crisis,12/14/2018 12:00:00 AM,8/13/2019 12:00:00 AM,8 Months,872714.3,742820.6,72800.26,10/5/2018 1:27:35 PM,2139##2120##2116##2025,2a- The project is designed to contribute significantly to gender equality,Project Closure,2797,PRJ_PRJ_CLS,10197578.0525,12/11/2018 5:54:19 PM
67,2nd Standard allocation 2018,OPT-18/DDA-3482/SA2/FSL/INGO/10701,,,2018,2,Première Urgence Internationale,2,Protect fragile livelihoods of farmers affected by the Great March of Return in the access restricted area (ARA) through urgent livelihood support to restore their agricultural production capacity,12/10/2018 12:00:00 AM,8/9/2019 12:00:00 AM,8 Months,300000,260649.7,19724.12,10/6/2018 4:04:28 PM,254##323##275##307,2a- The project is designed to contribute significantly to gender equality,Project Closure,2797,PRJ_PRJ_CLS,2072611.1985,12/10/2018 1:00:42 PM
67,2nd Standard allocation 2018,OPT-18/DDA-3482/SA2/FSL/INGO/10721,,,2018,2,OXFAM Novib,2,Urgent support for the most vulnerable families in Gaza Strip,11/29/2018 12:00:00 AM,8/28/2019 12:00:00 AM,9 Months,400000.1,319830.7,54001.17,10/5/2018 2:36:35 PM,619##642##754##785,2a- The project is designed to contribute significantly to gender equality,Project Closure,2797,PRJ_PRJ_CLS,11794440.1735,11/29/2018 7:35:54 PM
67,2nd Standard allocation 2018,OPT-18/DDA-3482/SA2/FSL/NGO/10737,,,2018,2,Arab Agronomists Association,1,Mitigation the farmer struggles and suffering resulting from the Israel's occupation and settlers attacks in area C in West of Salfit.,11/28/2018 12:00:00 AM,10/27/2019 12:00:00 AM,11 Months,299907.5,284272.5,0,10/6/2018 7:45:53 PM,528##509##550##529,2b- The principal purpose of the project is to advance gender equality,Project Closure,2797,PRJ_PRJ_CLS,1927818.0010,11/29/2018 7:40:35 PM
67,2nd Standard allocation 2018,OPT-18/DDA-3482/SA2/FSL/NGO/10757,,,2018,2,Agricultural Development Association,1,Urgent support of in-kind food assistance to the affected poor households in the ARA - Gaza Strip,12/20/2018 12:00:00 AM,8/19/2019 12:00:00 AM,8 Months,264897.8,247568,0,10/6/2018 10:09:17 AM,491##625##531##593,2a- The project is designed to contribute significantly to gender equality,Project Closure,2797,PRJ_PRJ_CLS,1956776.6405,1/2/2019 8:01:30 PM
67,2nd Standard allocation 2018,OPT-18/DDA-3482/SA2/FSL/NGO/10764,,,2018,2,Economic & Social Development Center of Palestine,1,Supporting the vulnerable farmers affected in area C by and prone to settler violence for sustained and improved livelihood,11/21/2018 12:00:00 AM,7/20/2019 12:00:00 AM,8 Months,567463.6,530339.9,0,10/6/2018 2:34:38 PM,990##990##1461##1529,2a- The project is designed to contribute significantly to gender equality,Project Closure,2797,PRJ_PRJ_CLS,1878174.6190,11/27/2018 2:48:30 PM
67,2nd Standard allocation 2018,OPT-18/DDA-3482/SA2/HNC/INGO/10762,,,2018,2,DanChurchAid,2,Safe and secure trauma and non-trauma management for Gaza vulnerable people.,12/5/2018 12:00:00 AM,1/4/2020 12:00:00 AM,13 Months,721996.4,623186.3,51576.71,10/6/2018 5:12:51 PM,498##324##106##102,"4- Not applicable - Only used for very small number of projects, such as 'support services'",Project Closure,2797,PRJ_PRJ_CLS,11637236.1305,12/5/2018 4:54:08 PM
67,2nd Standard allocation 2018,OPT-18/DDA-3482/SA2/HNC/NGO/10652,,,2018,2,Central blood bank society,1,"Continuing, Increasing and Enhancing The Free Supply of Blood Units to The Hospitals of Gaza Strip as Response to Great Return of March Events.",11/11/2018 12:00:00 AM,11/10/2019 12:00:00 AM,12 Months,248677.1,234601,0,10/6/2018 5:41:18 PM,5610##2580##1420##1390,2a- The project is designed to contribute significantly to gender equality,Project Closure,2797,PRJ_PRJ_CLS,7144510.0595,11/15/2018 9:51:07 PM
67,2nd Standard allocation 2018,OPT-18/DDA-3482/SA2/HNC/NGO/10725,,,2018,2,Palestinian Medical Relief Society,1,Providing first aid and postoperative care to injured participating in March of return,11/22/2018 12:00:00 AM,9/21/2019 12:00:00 AM,10 Months,337692,309600,6000,10/6/2018 8:37:12 AM,4300##255##380##105,2a- The project is designed to contribute significantly to gender equality,Project Closure,2797,PRJ_PRJ_CLS,1902996.3100,12/3/2018 5:09:27 PM
67,2nd Standard allocation 2018,OPT-18/DDA-3482/SA2/HNC/NGO/10807,,,2018,2,The national center for community rehabilitation,1,Improving Access to Health Services and Community Rehabilitation for Vulnerable Injured and people with Disabilities in Gaza Strip,11/1/2018 12:00:00 AM,10/31/2019 12:00:00 AM,12 Months,240429.7,227034.7,0,10/6/2018 8:39:35 PM,900##120##150##30,2a- The project is designed to contribute significantly to gender equality,Project Closure,2797,PRJ_PRJ_CLS,7148647.0080,11/2/2018 1:32:46 PM
67,2nd Standard allocation 2018,OPT-18/DDA-3482/SA2/PROT/INGO/10777,,,2018,2,Médecins Du Monde,2,"MHPSS and reintegration interventions to mitigate the negative impacts of detention to survivors of political violence, especially Palestinian ex-detainee children and youth and their families in East Jerusalem.",11/12/2018 12:00:00 AM,11/11/2019 12:00:00 AM,12 Months,284923.5,159131.6,107152,10/6/2018 8:06:08 AM,56##122##795##691,2a- The project is designed to contribute significantly to gender equality,Project Closure,2797,PRJ_PRJ_CLS,11616551.3880,11/12/2018 6:52:21 PM
67,2nd Standard allocation 2018,OPT-18/DDA-3482/SA2/SNFI/INGO/10747,,,2018,2,Fundacion Accion Contra El Hambre (Action Against Hunger ),2,"Emergency response to upgrade the inadequate shelters of vulnerable families in Hebron’s H2 area to protect them from attacks by Israeli military and settlers, as well as from natural hazards.",12/10/2018 12:00:00 AM,8/9/2019 12:00:00 AM,8 Months,300000,267793.4,12580.47,10/5/2018 1:22:33 PM,66##74##79##87,2a- The project is designed to contribute significantly to gender equality,Project Closure,2797,PRJ_PRJ_CLS,11575181.9030,12/12/2018 5:01:15 PM
67,2nd Standard allocation 2018,OPT-18/DDA-3482/SA2/WASH/INGO/10722,,,2018,2,OXFAM Novib,2,Provision of solar energy sources to critical WASH facilities located in vulnerable and underserved communities in the Southern area of the Gaza Strip.,11/11/2018 12:00:00 AM,9/10/2019 12:00:00 AM,10 Months,383338.7,329306.8,28953.66,10/6/2018 5:58:14 AM,12525##12992##15287##15896,2a- The project is designed to contribute significantly to gender equality,Project Closure,2797,PRJ_PRJ_CLS,11794440.1735,11/12/2018 6:55:25 PM
67,2nd Standard allocation 2018,OPT-18/DDA-3482/SA2/WASH/INGO/10724,,,2018,2,Fondazione We World - GVC Onlus,2,"Provision of alternative energy sources (solar) to support desalinization plans  to guarantee access to sustainable, adequate and safe drinking water for vulnerable population in Gaza Strip",11/13/2018 12:00:00 AM,8/12/2019 12:00:00 AM,9 Months,398307.5,322000,50250,10/4/2018 11:14:13 AM,78593##77083##93760##89764,2a- The project is designed to contribute significantly to gender equality,Project Closure,2797,PRJ_PRJ_CLS,11600003.5940,11/12/2018 6:48:56 PM
67,2nd Standard allocation 2018,OPT-18/DDA-3482/SA2/WASH/INGO/10793,,,2018,2,Fundacion Accion Contra El Hambre (Action Against Hunger ),2,Support public water service provider with alternative energy sources (solar) to mitigate the impact of the electricity crisis on the access to water for vulnerable and underserved communities.,11/15/2018 12:00:00 AM,9/30/2019 12:00:00 AM,"10 Months, 16 Days",428780,364321.2,36407.8,10/6/2018 8:45:40 AM,12736##12800##19328##19136,2a- The project is designed to contribute significantly to gender equality,Project Closure,2797,PRJ_PRJ_CLS,11575181.9030,11/20/2018 12:26:13 PM
67,2nd Standard allocation 2018,OPT-18/DDA-3482/SA2/WASH/NGO/10714,,,2018,2,Palestinian Hydrology Society for Water and Environmental Resources Development,1,Reducing Public Health and Environmental Pollution Risks through Solar Pumping of Selected Wastewater Pumping Stations in Gaza,11/8/2018 12:00:00 AM,9/7/2019 12:00:00 AM,10 Months,411682.5,384750,0,10/6/2018 2:01:10 PM,8660##7710##9360##8270,2a- The project is designed to contribute significantly to gender equality,Project Closure,2797,PRJ_PRJ_CLS,1816120.3915,11/8/2018 8:06:42 PM
67,2nd Standard allocation 2018,OPT-18/DDA-3482/SA2/WASH/UN/10769,,,2018,2,United Nations Children's Fund,3,Response to the urgent WASH humanitarian needs in the Gaza Strip,11/19/2018 12:00:00 AM,2/29/2020 12:00:00 AM,"15 Months, 11 Days",793946.9,742006.4,0,10/6/2018 6:47:04 PM,11823##11497##8457##8223,2a- The project is designed to contribute significantly to gender equality,Project Closure,2797,PRJ_PRJ_CLS,10925680.9885,11/15/2018 9:54:02 PM
70,Northwest Emergency Allocation,TUR-18/3559/RA1/CCM/O/8330,,,2018,1,Others,4,Multi Sectoral Services for Idleb Dana Kelbit - Umut Camp&amp;Yalnız Değilsiniz 2 Camp,3/15/2018 12:00:00 AM,12/15/2018 12:00:00 AM,"9 Months, 1 Days",299493.1,290770,0,2/20/2018 12:34:56 PM,2939##3542##3556##3789,2a- The project is designed to contribute significantly to gender equality,Project Closure,2805,PRJ_PRJ_CLS,2921666.9580,3/19/2018 6:30:11 PM
70,Northwest Emergency Allocation,TUR-18/3559/RA1/FS/INGO/8293,,,2018,1,International NGO,2,Food needs for at least 2596 vulnerable Syrian families in crisis-affected Idleb are partially met through the provision of life-saving and life-sustaining in-kind food assistance.,3/15/2018 12:00:00 AM,7/15/2018 12:00:00 AM,"4 Months, 1 Days",499989.6,467280,0,2/22/2018 9:23:44 AM,2336##2856##3894##3894,2a- The project is designed to contribute significantly to gender equality,Project Closure,2805,PRJ_PRJ_CLS,4569902.5680,3/19/2018 6:36:05 PM
70,Northwest Emergency Allocation,TUR-18/3559/RA1/FS/INGO/8350,,,2018,1,International NGO,2,Emergency Food Assistance for Newly Displaced Households in Idlib,4/1/2018 12:00:00 AM,8/31/2018 12:00:00 AM,5 Months,588711.9,536594.4,40574.13,2/22/2018 8:24:28 PM,3050##3480##7400##7830,2a- The project is designed to contribute significantly to gender equality,Project Closure,2805,PRJ_PRJ_CLS,1025067.0780,5/21/2018 2:47:35 PM
