PFId,AllNm,PrjCode,OPSCodeAgg,EmgAgg,AllYr,AllSrc,OrgNm,OrgTypeId,PrjTitle,AStrDt,AEndDt,PrjDur,PrgBdg,BgdDC,BdgSC,PrjSubDt,BenAgg,PrjGM,PrjStsNm,PrjStsId,PrjStsCode,PartCode,ApprDt
67,Second Standard Allocation (Normal Track),OPT-20/DDA-3482/SA2NT/HNC/INGO/17422,,,2020,2,CARE International,2,Health under protection (HUP): Emergency health and nutrition assistance to people living in communities whose rights are inadequately protected in the West bank (WB),12/1/2020 12:00:00 AM,11/30/2021 12:00:00 AM,12 Months,668498.8,606329.7,18435.5,10/2/2020 5:32:17 PM,2603##8411##4005##5006,"4- Likely to contribute to gender equality, including across age groups",Project Closure,2797,PRJ_PRJ_CLS,11298006.3535,12/9/2020 9:06:59 PM
67,Second Standard Allocation (Normal Track),OPT-20/DDA-3482/SA2NT/HNC/INGO/17466,,,2020,2,Medical Aid for Palestinians,2,Sustaining Essential Eye Care Services During Health Crisis (COVID-19),12/9/2020 12:00:00 AM,10/8/2021 12:00:00 AM,10 Months,349551.4,326683.6,0,10/3/2020 8:56:03 AM,150##150##37##37,"4- Likely to contribute to gender equality, including across age groups",Project Closure,2797,PRJ_PRJ_CLS,11422114.8085,12/9/2020 8:59:23 PM
67,Second Standard Allocation (Normal Track),OPT-20/DDA-3482/SA2NT/HNC/NGO/17489,,,2020,2,Al Awda Health and Community Association,1,Providing elective surgeries to patients registered on the MoH waiting list – Gaza Strip - OPT,12/1/2020 12:00:00 AM,11/30/2021 12:00:00 AM,12 Months,439523.9,410770,0,10/3/2020 5:41:19 PM,224##207##206##191,"3- Likely to contribute to gender equality, but without attention to age groups",Project Closure,2797,PRJ_PRJ_CLS,1836805.1340,12/9/2020 9:12:05 PM
67,Second Standard Allocation (Normal Track),OPT-20/DDA-3482/SA2NT/HNC/O/17484,,,2020,2,Qatar Red Crescent Society,4,Ensure continuous provision of quality essential elective surgeries to Gazan patients,12/15/2020 12:00:00 AM,9/14/2021 12:00:00 AM,9 Months,312955.4,292481.7,0,10/4/2020 6:29:24 PM,260##240##220##200,"4- Likely to contribute to gender equality, including across age groups",Project Closure,2797,PRJ_PRJ_CLS,11331101.9415,12/14/2020 3:07:40 PM
67,Second Standard Allocation (Normal Track),OPT-20/DDA-3482/SA2NT/HNC/UN/17449,,,2020,2,United Nations Population Fund,3,"Supporting continuation of essential healthcare services in the West Bank, with a focus on women and girls",12/21/2020 12:00:00 AM,12/20/2021 12:00:00 AM,12 Months,623883.8,583069,0,10/2/2020 11:44:59 AM,4468##8093##2890##3854,"4- Likely to contribute to gender equality, including across age groups",Project Closure,2797,PRJ_PRJ_CLS,10842942.0185,12/22/2020 4:19:20 PM
67,Second Standard Allocation (Normal Track),OPT-20/DDA-3482/SA2NT/HNC/UN/17519,,,2020,2,United Nations Relief and Works Agency for Palestinian Refugees in Near East,3,Provision of essential primary health care to remote communities of Palestine refugees in the West Bank,12/2/2020 12:00:00 AM,6/1/2021 12:00:00 AM,6 Months,208324.8,194696.1,0,10/4/2020 4:59:19 PM,8955##8605##3606##3464,"4- Likely to contribute to gender equality, including across age groups",Project Closure,2797,PRJ_PRJ_CLS,11682742.5640,12/9/2020 9:02:03 PM
67,Second Standard Allocation (Normal Track),OPT-20/DDA-3482/SA2NT/PROT/INGO/17312,,,2020,2,Médecins du Monde France,2,Reinforce the Protection of Vulnerable Communities in the North West Bank impacted by occupation critical incidents through Emergency Mental Health and Psycho-social Support and Case Management.,12/21/2020 12:00:00 AM,6/20/2021 12:00:00 AM,6 Months,208952.8,170279,25004.03,10/4/2020 8:33:57 AM,1921##1879##1414##1286,"4- Likely to contribute to gender equality, including across age groups",Project Closure,2797,PRJ_PRJ_CLS,10458205.8080,12/21/2020 5:13:19 PM
67,Second Standard Allocation (Normal Track),OPT-20/DDA-3482/SA2NT/PROT/INGO/17316,,,2020,2,War Child Holland,2,"Improved Child Protection and MHPSS service provision for Women, Children and families affected by conflict-related violence and GBV in Area C of the West Bank",12/31/2020 12:00:00 AM,12/30/2021 12:00:00 AM,12 Months,635000,487493.8,105964.1,10/2/2020 6:59:20 PM,751##1738##635##895,"4- Likely to contribute to gender equality, including across age groups",Project Closure,2797,PRJ_PRJ_CLS,11004283.0100,1/14/2021 8:50:57 PM
67,Second Standard Allocation (Normal Track),OPT-20/DDA-3482/SA2NT/PROT/NGO/17366,,,2020,2,Women's Affairs Center,1,"Protection and support of the most vulnerable women and girls GBV survivors including with disabilities, with cancer, pregnant, chronically ill, internally displaced and female- headed households in quarantine and remote communities in the Gaza Strip",12/10/2020 12:00:00 AM,10/9/2021 12:00:00 AM,10 Months,340388.3,322643,0,10/4/2020 7:04:38 AM,495##5366##145##3109,"4- Likely to contribute to gender equality, including across age groups",Project Closure,2796,PRJ_UND_AUD,3259915.4180,12/9/2020 9:09:35 PM
67,Second Standard Allocation (Normal Track),OPT-20/DDA-3482/SA2NT/PROT/NGO/17474,,,2020,2,Aisha Association for Women and Child Protection.,1,Improving access to mental health care and psycho-social support services for the most vulnerable women and girls  and their families in quarantine and remote communities in the Gaza Strip,12/1/2020 12:00:00 AM,9/30/2021 12:00:00 AM,10 Months,345205.2,323225.8,0,10/4/2020 1:55:04 PM,2260##4606##1865##2035,"4- Likely to contribute to gender equality, including across age groups",Project Closure,2797,PRJ_PRJ_CLS,1861626.8250,1/21/2021 1:11:23 PM
67,Second Standard Allocation (Normal Track),OPT-20/DDA-3482/SA2NT/PROT-EDU/INGO/17311,,,2020,2,Terre des Hommes Lausanne,2,Improving access of vulnerable children in the Gaza Strip to protection and education services,12/13/2020 12:00:00 AM,12/12/2021 12:00:00 AM,12 Months,479656.9,396516,51761.47,10/4/2020 4:57:24 PM,2115##3852##2830##2831,"4- Likely to contribute to gender equality, including across age groups",Project Closure,2797,PRJ_PRJ_CLS,12013698.4440,12/22/2020 4:17:06 PM
67,Second Standard Allocation (Normal Track),OPT-20/DDA-3482/SA2NT/SNFI/INGO/17307,,,2020,2,OXFAM Novib,2,Create adequate living space for  Substandard shelters of  most vulnerable households and people with disabilities in the Gaza strip,12/8/2020 12:00:00 AM,11/7/2021 12:00:00 AM,11 Months,463000,357545.3,75164.95,10/4/2020 6:17:05 AM,400##375##419##411,"4- Likely to contribute to gender equality, including across age groups",Project Closure,2797,PRJ_PRJ_CLS,11794440.1735,12/3/2020 4:33:59 PM
67,Second Standard Allocation (Normal Track),OPT-20/DDA-3482/SA2NT/SNFI/INGO/17403,,,2020,2,Islamic Relief Worldwide,2,Protection of most vulnerable households in Southern Gaza Strip through winterization and rehabilitation of substandard houses.,12/15/2020 12:00:00 AM,8/14/2021 12:00:00 AM,8 Months,379755.2,330205.1,24706.29,10/3/2020 10:54:17 AM,668##665##470##486,"4- Likely to contribute to gender equality, including across age groups",Project Closure,2797,PRJ_PRJ_CLS,2548360.2760,12/14/2020 10:03:15 AM
67,Second Standard Allocation (Normal Track),OPT-20/DDA-3482/SA2NT/SNFI/INGO/17511,,,2020,2,Agency for Technical Cooperation and Development,2,"Strengthening community-based preparedness and emergency response in the Middle Area, Khan Younis and Rafah governorates",12/31/2020 12:00:00 AM,12/30/2022 12:00:00 AM,24 Months,565948.6,468575.8,60348.03,10/4/2020 6:26:06 PM,7427##5099##2506##4407,"4- Likely to contribute to gender equality, including across age groups",Project Closure,2797,PRJ_PRJ_CLS,10123112.9795,1/7/2021 6:38:23 PM
67,Second Standard Allocation (Normal Track),OPT-20/DDA-3482/SA2NT/SNFI/INGO/17512,,,2020,2,Agency for Technical Cooperation and Development,2,Supporting the shelter and NFI needs of vulnerable households in Middle Area and Khan Yunis governorates in the Gaza Strip to minimize exposure to harsh weather and protection concerns,12/1/2020 12:00:00 AM,8/31/2021 12:00:00 AM,9 Months,500000,424510.3,42779.41,10/4/2020 6:22:15 PM,526##522##515##491,"4- Likely to contribute to gender equality, including across age groups",Project Closure,2797,PRJ_PRJ_CLS,10123112.9795,12/3/2020 4:29:50 PM
67,Second Standard Allocation (Normal Track),OPT-20/DDA-3482/SA2NT/SNFI/NGO/17491,,,2020,2,MA’AN Development Center,1,Prepositioning of Emergency NFIs for Designated Emergency Shelters and for Host-community Emergency Responses,12/6/2020 12:00:00 AM,9/5/2021 12:00:00 AM,9 Months,288816.3,244455.8,25465.95,10/2/2020 9:22:00 PM,2580##2520##2152##2101,"4- Likely to contribute to gender equality, including across age groups",Project Closure,2797,PRJ_PRJ_CLS,1811983.4430,12/17/2020 7:19:36 PM
70,2020 1st Reserve Allocation,TUR-20/3559/RA1/CCM-NFI-WASH/NGO/14981,,,2020,1,National NGO,1,Pilot Shelter Solutions for the most vulnerable newly displaced groups.,3/23/2020 12:00:00 AM,3/22/2021 12:00:00 AM,12 Months,1091534,964983.1,55142.5,2/17/2020 6:57:45 AM,700##600##800##900,"4- Likely to contribute to gender equality, including across age groups",Project Closure,2805,PRJ_PRJ_CLS,1598562.7560,3/25/2020 7:55:49 PM
70,2020 1st Reserve Allocation,TUR-20/3559/RA1/CCM-NFI-WASH/NGO/15002,,,2020,1,National NGO,1,"Emergency Safe Shelter for Most Recent IDPs in Salqin, NW Syria",4/16/2020 12:00:00 AM,2/28/2021 12:00:00 AM,"10 Months, 13 Days",391551,344932.6,21003,2/17/2020 4:17:52 AM,159##180##273##238,"4- Likely to contribute to gender equality, including across age groups",Project Closure,2805,PRJ_PRJ_CLS,17986088.8620,4/13/2020 5:01:10 PM
70,2020 1st Reserve Allocation,TUR-20/3559/RA1/CCM-NFI-WASH/NGO/15006,,,2020,1,National NGO,1,Providing life-saving shelter and WASH services to the newly IDPs by establishing a planned camp in the Jarablus area,4/16/2020 12:00:00 AM,2/16/2021 12:00:00 AM,"10 Months, 1 Days",562409.4,504181,21435.25,2/17/2020 6:50:22 AM,144##163##231##177,"3- Likely to contribute to gender equality, but without attention to age groups",Project Closure,2805,PRJ_PRJ_CLS,2993918.3820,4/13/2020 5:02:22 PM
70,2020 1st Reserve Allocation,TUR-20/3559/RA1/CCM-NFI-WASH/NGO/15036,,,2020,1,National NGO,1,"Provision of Life-saving humanitarian SNFI , CCCM ,and WASH assistance for the most vulnerable new IDPs in North of Syria",4/1/2020 12:00:00 AM,12/31/2020 12:00:00 AM,9 Months,1179962,1082215,20553.19,2/17/2020 12:58:11 AM,1903##2076##2249##2422,"4- Likely to contribute to gender equality, including across age groups",Project Closure,2805,PRJ_PRJ_CLS,4583449.7100,3/27/2020 1:23:49 PM
70,2020 1st Reserve Allocation,TUR-20/3559/RA1/CCM-NFI-WASH-P/NGO/14975,,,2020,1,National NGO,1,"Provision of integrated emergency shelter, WASH, CCCM and protection services for the newly arrived IDPs in Maaret Tamsrin through the establishment, operation and management of 2 IDP settlements.",4/1/2020 12:00:00 AM,1/31/2021 12:00:00 AM,10 Months,1133654,1015377,44112.6,2/17/2020 1:17:29 AM,1724##1813##2209##2294,"4- Likely to contribute to gender equality, including across age groups",Project Closure,2805,PRJ_PRJ_CLS,1666298.4660,4/3/2020 5:23:38 PM
70,2020 1st Reserve Allocation,TUR-20/3559/RA1/CCM-P/UN/14987,,,2020,1,UN Agency,3,Establishment of Sheikh Bahr Reception Center and provision of emergency protection services to IDPs and host community members in northwest Syria,4/1/2020 12:00:00 AM,12/14/2020 12:00:00 AM,"8 Months, 14 Days",1433585,1295664,44135,2/16/2020 4:26:23 PM,3307##4876##4211##5344,"4- Likely to contribute to gender equality, including across age groups",Project Closure,1248,PRJ_UND_CLSR,298037.1240,4/1/2020 3:42:35 PM
70,2020 1st Reserve Allocation,TUR-20/3559/RA1/CCM-WASH-NFI/NGO/14964,,,2020,1,National NGO,1,Rapid emergency response to  the new recently IDPs in the north  of Syria,4/1/2020 12:00:00 AM,10/31/2020 12:00:00 AM,7 Months,724408.5,632082.8,44934.5,2/16/2020 11:30:09 AM,1779##1867##3472##3560,"4- Likely to contribute to gender equality, including across age groups",Project Closure,2808,PRJ_UND_AUD,2361718.4220,3/24/2020 6:44:29 PM
70,2020 1st Reserve Allocation,TUR-20/3559/RA1/CCM-WASH-NFI/NGO/15039,,,2020,1,National NGO,1,Establishing New IDPs Camp site in NW Syria,4/6/2020 12:00:00 AM,2/28/2021 12:00:00 AM,"10 Months, 23 Days",520357.8,441386,44929.71,2/17/2020 3:32:45 AM,342##532##456##570,"4- Likely to contribute to gender equality, including across age groups",Project Closure,2805,PRJ_PRJ_CLS,17832554.5860,4/6/2020 3:41:45 PM
70,2020 1st Reserve Allocation,TUR-20/3559/RA1/CCS/O/15011,,,2020,1,Others,4,Providing Logistical Support and Facilitation Services for Cross Border Humanitarian Relief Operations of Humanitarian Actors Operating from Turkey to Syria,4/15/2020 12:00:00 AM,12/31/2020 12:00:00 AM,"8 Months, 17 Days",774752.9,724068.1,0,2/16/2020 5:11:44 PM,37##37##38##38,1- Unlikely to contribute to gender equality (no gender equality measure and no age consideration),Project Closure,2805,PRJ_PRJ_CLS,2921666.9580,4/16/2020 12:23:15 PM
70,2020 1st Reserve Allocation,TUR-20/3559/RA1/FS/INGO/15028,,,2020,1,International NGO,2,Provision lifesaving food assistance for the most vulnerable IDPs in North West Syria,3/14/2020 12:00:00 AM,10/13/2020 12:00:00 AM,7 Months,1199498,1110876,10150,2/17/2020 5:15:34 AM,6298##6927##8502##9761,"4- Likely to contribute to gender equality, including across age groups",Project Closure,2805,PRJ_PRJ_CLS,4569902.5680,3/12/2020 1:32:35 PM
70,2020 1st Reserve Allocation,TUR-20/3559/RA1/FS/NGO/14969,,,2020,1,National NGO,1,"Improve the food security in Idleb,Aleppo for the new IDPs",4/1/2020 12:00:00 AM,9/30/2020 12:00:00 AM,6 Months,563173.6,523390.5,2940,2/16/2020 7:40:16 PM,1567##2223##2478##2829,"4- Likely to contribute to gender equality, including across age groups",Project Closure,2808,PRJ_UND_AUD,4592481.1380,3/18/2020 7:45:50 PM
70,2020 1st Reserve Allocation,TUR-20/3559/RA1/FS/NGO/14982,,,2020,1,National NGO,1,Emergency response life-saving food for the newly IDPs by providing ready to eat rations (RTERs) and food rations.,3/16/2020 12:00:00 AM,8/15/2020 12:00:00 AM,5 Months,560592.4,508648.9,15269.2,2/16/2020 10:01:28 PM,3344##3885##3675##3633,"4- Likely to contribute to gender equality, including across age groups",Project Closure,2808,PRJ_UND_AUD,2691365.5440,3/11/2020 4:27:13 PM
70,2020 1st Reserve Allocation,TUR-20/3559/RA1/FS/NGO/14988,,,2020,1,National NGO,1,Provision of life-saving emergency food assistance to the most vulnerable newly displaced HHs in Salqin sub-district.,4/1/2020 12:00:00 AM,8/31/2020 12:00:00 AM,5 Months,334456.3,293026,19550,2/16/2020 11:25:10 PM,1625##2032##2193##2274,"4- Likely to contribute to gender equality, including across age groups",Project Closure,2805,PRJ_PRJ_CLS,6340062.4560,3/18/2020 7:01:10 PM
70,2020 1st Reserve Allocation,TUR-20/3559/RA1/FS/NGO/14991,,,2020,1,National NGO,1,Enhancing food security for the newly IDPs from southern Idlib.,4/1/2020 12:00:00 AM,11/30/2020 12:00:00 AM,8 Months,1085812,1034107,0,2/16/2020 7:11:46 PM,3789##3983##4823##5070,"4- Likely to contribute to gender equality, including across age groups",Project Closure,2805,PRJ_PRJ_CLS,2993918.3820,3/24/2020 6:32:14 PM
70,2020 1st Reserve Allocation,TUR-20/3559/RA1/FS/NGO/14999,,,2020,1,National NGO,1,"Improving Food Security, Food Safety, and Living Standards of Vulnerable Populations in Northwest Syria through food voucher support",3/20/2020 12:00:00 AM,10/19/2020 12:00:00 AM,7 Months,799880.1,723384,24167.5,2/16/2020 5:41:05 PM,2976##3168##3670##3786,"4- Likely to contribute to gender equality, including across age groups",Project Closure,2810,PRJ_UND_REF,5500139.6520,3/23/2020 10:03:25 PM
70,2020 1st Reserve Allocation,TUR-20/3559/RA1/FS/NGO/15000,,,2020,1,National NGO,1,Food and Cash Emergency Response for IDPs in Northwest Syria,4/1/2020 12:00:00 AM,12/31/2020 12:00:00 AM,9 Months,789715.1,688973,49078.48,2/17/2020 6:47:29 AM,3218##3383##4095##4304,"4- Likely to contribute to gender equality, including across age groups",Project Closure,2808,PRJ_UND_AUD,5513686.7940,3/23/2020 10:06:22 PM
70,2020 1st Reserve Allocation,TUR-20/3559/RA1/FS/NGO/15008,,,2020,1,National NGO,1,Food securing and living conditions Improving for newly internally displaced people in northern Syria.,3/23/2020 12:00:00 AM,11/30/2020 12:00:00 AM,"8 Months, 8 Days",953912.9,852381.9,39125.5,2/16/2020 5:00:29 PM,11432##12636##17449##18653,"4- Likely to contribute to gender equality, including across age groups",Project Closure,2805,PRJ_PRJ_CLS,1598562.7560,3/18/2020 7:28:55 PM
70,2020 1st Reserve Allocation,TUR-20/3559/RA1/FS/NGO/15012,,,2020,1,National NGO,1,The emergency food response for the new IDPs in NW Syria,4/1/2020 12:00:00 AM,9/30/2020 12:00:00 AM,6 Months,662772.3,589296.1,30117.25,2/17/2020 6:30:53 AM,5543##6860##10766##9689,"4- Likely to contribute to gender equality, including across age groups",Project Closure,2805,PRJ_PRJ_CLS,4547323.9980,3/11/2020 4:30:45 PM
70,2020 1st Reserve Allocation,TUR-20/3559/RA1/FS/NGO/15024,,,2020,1,National NGO,1,Provide life-saving assistance to improve food security of IDPs,4/1/2020 12:00:00 AM,12/31/2020 12:00:00 AM,9 Months,1084414,858044.6,155426.4,2/17/2020 6:10:42 AM,7787##8590##9795##9895,"4- Likely to contribute to gender equality, including across age groups",Project Closure,2805,PRJ_PRJ_CLS,13456827.7200,3/24/2020 6:36:58 PM
70,2020 1st Reserve Allocation,TUR-20/3559/RA1/FS/NGO/15027,,,2020,1,National NGO,1,Emergency Life-saving response to crises affected groups through the distribution of RTEs and Food baskets in NWS (ASO3).,4/1/2020 12:00:00 AM,10/31/2020 12:00:00 AM,7 Months,520090,486065.4,0,2/16/2020 7:23:26 PM,6941##8525##9728##10603,"4- Likely to contribute to gender equality, including across age groups",Project Closure,2805,PRJ_PRJ_CLS,2686849.8300,3/25/2020 7:47:07 PM
70,2020 1st Reserve Allocation,TUR-20/3559/RA1/FS/NGO/15035,,,2020,1,National NGO,1,support the food security through emergency response to the newly IDPs,3/15/2020 12:00:00 AM,9/14/2020 12:00:00 AM,6 Months,347922.7,311790.6,13370.76,2/16/2020 9:05:34 PM,1239##1281##823##857,"4- Likely to contribute to gender equality, including across age groups",Project Closure,2808,PRJ_UND_AUD,1648235.6100,3/12/2020 3:58:53 PM
70,2020 1st Reserve Allocation,TUR-20/3559/RA1/FS/NGO/15041,,,2020,1,National NGO,1,Provide Emergency Food Security Assistance to the new IDPs in Northern Rural of Aleppo,4/1/2020 12:00:00 AM,9/30/2020 12:00:00 AM,6 Months,398425.2,363060,9300,2/16/2020 11:00:31 PM,1200##1500##1680##1620,"4- Likely to contribute to gender equality, including across age groups",Project Closure,2805,PRJ_PRJ_CLS,4091236.8840,3/18/2020 6:57:25 PM
70,2020 1st Reserve Allocation,TUR-20/3559/RA1/FS/NGO/15055,,,2020,1,National NGO,1,"Emergency Food Assistance to Conflict-Affected Households in Idleb, and Aleppo Syria",4/16/2020 12:00:00 AM,9/15/2020 12:00:00 AM,5 Months,543316.6,476260,31512.5,2/17/2020 6:26:26 AM,6050##7700##6600##7150,"4- Likely to contribute to gender equality, including across age groups",Project Closure,2805,PRJ_PRJ_CLS,17990604.5760,4/16/2020 12:25:00 PM
70,2020 1st Reserve Allocation,TUR-20/3559/RA1/FS/UN/14974,,,2020,1,UN Agency,3,PPR Vaccination Campaign NW-Syria,4/1/2020 12:00:00 AM,8/31/2020 12:00:00 AM,5 Months,244995.3,213869.5,15098.03,2/16/2020 3:32:51 PM,58717##61217##62466##67464,2- Unlikely to contribute to gender equality (no gender equality measure but includes age consideration),Project Closure,2805,PRJ_PRJ_CLS,189659.9880,3/24/2020 6:42:45 PM
70,2020 1st Reserve Allocation,TUR-20/3559/RA1/FS/UN/15048,,,2020,1,UN Agency,3,Emergency food assistance for those affected by the conflict in Northwest Syria,3/22/2020 12:00:00 AM,10/21/2020 12:00:00 AM,7 Months,1.201282E+07,1.127965E+07,0,2/16/2020 5:10:20 PM,40817##45113##62299##66596,1- Unlikely to contribute to gender equality (no gender equality measure and no age consideration),Project Closure,2805,PRJ_PRJ_CLS,677357.1000,3/31/2020 3:25:00 PM
70,2020 1st Reserve Allocation,TUR-20/3559/RA1/FS-NFI/NGO/15037,,,2020,1,National NGO,1,Provide basic life-saving  NFIs and Food  assistance for the most vulnerable and newly IDPs in North of Syria.,4/1/2020 12:00:00 AM,10/31/2020 12:00:00 AM,7 Months,1182438,1083598,21484.02,2/17/2020 12:29:26 AM,4510##5103##5512##5755,"4- Likely to contribute to gender equality, including across age groups",Project Closure,2805,PRJ_PRJ_CLS,4583449.7100,3/27/2020 1:25:30 PM
70,2020 1st Reserve Allocation,TUR-20/3559/RA1/FS-NFI-WASH/INGO/15017,,,2020,1,International NGO,2,Strengthening the resilience of the displaced people in A'zaz via multi-purpose voucher,4/15/2020 12:00:00 AM,11/14/2020 12:00:00 AM,7 Months,462345,424573.1,7525,2/15/2020 9:35:19 AM,800##1000##1200##2000,"4- Likely to contribute to gender equality, including across age groups",Project Closure,2805,PRJ_PRJ_CLS,171597.1320,3/18/2020 6:53:17 PM
70,2020 1st Reserve Allocation,TUR-20/3559/RA1/H/INGO/14989,,,2020,1,International NGO,2,Emergency Control of Leishmaniasis Amongst Recently Displaced People in North West Syria.,4/1/2020 12:00:00 AM,11/30/2020 12:00:00 AM,8 Months,247844.9,226446.8,5184,2/17/2020 6:28:34 AM,3080##3630##2420##1870,"4- Likely to contribute to gender equality, including across age groups",Project Closure,2805,PRJ_PRJ_CLS,6344578.1700,3/31/2020 3:20:00 PM
70,2020 1st Reserve Allocation,TUR-20/3559/RA1/H/INGO/15052,,,2020,1,International NGO,2,Critical support to dialysis centers.,3/15/2020 12:00:00 AM,9/14/2020 12:00:00 AM,6 Months,302648.4,277453,5396,2/17/2020 6:39:33 AM,357##278##2##3,"4- Likely to contribute to gender equality, including across age groups",Project Closure,2805,PRJ_PRJ_CLS,12946552.0380,3/25/2020 8:06:28 PM
70,2020 1st Reserve Allocation,TUR-20/3559/RA1/H/NGO/14965,,,2020,1,National NGO,1,"Increase accessibility to life-saving primary and secondary health services for the most vulnerable groups in Salqin, Idleb ,NW Syria.",4/10/2020 12:00:00 AM,11/10/2020 12:00:00 AM,7 Months 1 Days,626339.3,557363.9,28000,2/16/2020 9:25:36 PM,1800##8280##6020##6225,"4- Likely to contribute to gender equality, including across age groups",Project Closure,2810,PRJ_UND_REF,17986088.8620,4/13/2020 4:59:21 PM
70,2020 1st Reserve Allocation,TUR-20/3559/RA1/H/NGO/14968,,,2020,1,National NGO,1,Provide and enhancing access to primary healthcare and mental health services in Aleppo and Idleb through the PHCs centers and mobile clinics,4/1/2020 12:00:00 AM,10/31/2020 12:00:00 AM,7 Months,354794.3,324443.5,7140,2/16/2020 10:59:29 AM,8174##12262##12773##17884,"4- Likely to contribute to gender equality, including across age groups",Project Closure,2808,PRJ_UND_AUD,4592481.1380,3/18/2020 7:02:31 PM
70,2020 1st Reserve Allocation,TUR-20/3559/RA1/H/NGO/14971,,,2020,1,National NGO,1,Improved access for patients with kidney diseases to lifesaving and sustainable health services in the northwest Syria.,4/1/2020 12:00:00 AM,10/31/2020 12:00:00 AM,7 Months,440729,363012.3,48884.01,2/16/2020 4:27:25 PM,224##219##7##8,"4- Likely to contribute to gender equality, including across age groups",Project Closure,2805,PRJ_PRJ_CLS,1612109.8980,3/25/2020 7:53:36 PM
70,2020 1st Reserve Allocation,TUR-20/3559/RA1/H/NGO/14997,,,2020,1,National NGO,1,Supporting the IDPs and overwhelmed communities in Idleb with fixed and mobile  health   services interventions,4/1/2020 12:00:00 AM,10/31/2020 12:00:00 AM,7 Months,313129.7,272169,20475.55,2/16/2020 7:42:56 PM,5273##5065##7097##6882,"4- Likely to contribute to gender equality, including across age groups",Project Closure,2808,PRJ_UND_AUD,1603078.4700,3/18/2020 6:54:59 PM
70,2020 1st Reserve Allocation,TUR-20/3559/RA1/H/NGO/15029,,,2020,1,National NGO,1,"Improving Access to Emergency Trauma, Secondary &amp; primary Healthcare Assistance for Conflict-affected Syrians in Northern west Syria.",3/23/2020 12:00:00 AM,11/22/2020 12:00:00 AM,8 Months,600349.4,510926.5,50147.75,2/17/2020 6:30:04 AM,16569##18977##10325##9002,"4- Likely to contribute to gender equality, including across age groups",Project Closure,2805,PRJ_PRJ_CLS,1652751.3240,3/24/2020 6:35:47 PM
70,2020 1st Reserve Allocation,TUR-20/3559/RA1/H/NGO/15032,,,2020,1,National NGO,1,Provision of essential health care services and psychosocial support to conflict-affected population in northern Syria,4/1/2020 12:00:00 AM,10/31/2020 12:00:00 AM,7 Months,517159.8,422331.6,60995.31,2/16/2020 3:27:57 PM,4952##5942##4458##4458,"4- Likely to contribute to gender equality, including across age groups",Project Closure,2805,PRJ_PRJ_CLS,13601330.5680,3/18/2020 6:49:06 PM
70,2020 1st Reserve Allocation,TUR-20/3559/RA1/H/NGO/15034,,,2020,1,National NGO,1,Ensure continuity of care and increase access to life-saving health services through implementation of standardized referral system and provision of primary health care services in response to the most vulnerable people both IDPs and Host communities affected by the ongoing conflict in Idleb and Aleppo governorates.,4/1/2020 12:00:00 AM,12/31/2020 12:00:00 AM,9 Months,633377.8,557811.2,34130.6,2/16/2020 10:48:02 PM,15778##37261##20755##19817,"4- Likely to contribute to gender equality, including across age groups",Project Closure,2805,PRJ_PRJ_CLS,2461064.1300,3/18/2020 7:04:45 PM
70,2020 1st Reserve Allocation,TUR-20/3559/RA1/H-N/NGO/15009,,,2020,1,National NGO,1,responding to urgent health and nutrition needs in Idleb governorate,4/1/2020 12:00:00 AM,11/30/2020 12:00:00 AM,8 Months,186549.2,161283.8,13061.21,2/16/2020 7:47:36 PM,12813##13885##4604##3719,"4- Likely to contribute to gender equality, including across age groups",Project Closure,2808,PRJ_UND_AUD,5161461.1020,3/18/2020 6:45:42 PM
70,2020 1st Reserve Allocation,TUR-20/3559/RA1/H-N/NGO/15013,,,2020,1,National NGO,1,Provision of life-saving integrated Health &amp; Nutrition services for the PIN in NWS,3/21/2020 12:00:00 AM,10/20/2020 12:00:00 AM,7 Months,718409.8,627407,44004,2/17/2020 1:03:17 AM,3570##17497##13860##16099,"3- Likely to contribute to gender equality, but without attention to age groups",Project Closure,2805,PRJ_PRJ_CLS,3865451.1840,3/18/2020 6:51:29 PM
