PFId,AllNm,PrjCode,OPSCodeAgg,EmgAgg,AllYr,AllSrc,OrgNm,OrgTypeId,PrjTitle,AStrDt,AEndDt,PrjDur,PrgBdg,BgdDC,BdgSC,PrjSubDt,BenAgg,PrjGM,PrjStsNm,PrjStsId,PrjStsCode,PartCode,ApprDt
62,Third Reserve Allocation,CBPF-SYR-25-R-INGO-35766,,,2025,1,Norwegian People's Aid,2,Restoring dignity and rebuilding lives for integrated protection in North East Syria,7/1/2025 12:00:00 AM,12/31/2025 12:00:00 AM,6 Months,300000.1,280373.9,0,5/27/2025 12:36:47 PM,1280##2205##1180##1935,"4- Likely to contribute to gender equality, including across age groups",Implementation,570,PRJ_IMPL_RPT,15562339.5616,7/8/2025 12:50:36 PM
62,Third Reserve Allocation,CBPF-SYR-25-R-INGO-35770,,,2025,1,Agency for Technical Cooperation and Development,2,"Provision of essential Primary Health Care Services to the conflict-affected population Al Hasakeh, Northeast Syria ",8/1/2025 12:00:00 AM,1/31/2026 12:00:00 AM,6 Months,400000,373831.8,0,5/20/2025 3:39:38 PM,4314##12127##6559##6151,"4- Likely to contribute to gender equality, including across age groups",Implementation,570,PRJ_IMPL_RPT,40696598.4256,6/26/2025 12:00:31 PM
62,First Reserve Allocation 2025,CBPF-SYR-25-R-NGO-34783,,,2025,1,St. Ephrem Patriarchal Development Committee,1,Enhancing Access to Essential WASH Items and Hygiene Promotion for Cholera Outbreak-Affected Population in Al-Hol camp in North East Syria,4/15/2025 12:00:00 AM,11/30/2025 12:00:00 AM,"7 Months, 16 Days",350000,327102.8,0,2/4/2025 9:55:41 AM,1150##3105##2898##4347,"4- Likely to contribute to gender equality, including across age groups",Implementation,570,PRJ_IMPL_RPT,6181716.9440,5/14/2025 6:17:46 PM
62,Third Reserve Allocation,CBPF-SYR-25-R-NGO-35660,,,2025,1,BAHAR,1,"Community-Based GBV, CP and MA Services in Washokani, Serekaniye, and Tal Samen",7/20/2025 12:00:00 AM,2/19/2026 12:00:00 AM,7 Months,292444.3,273312.4,0,5/27/2025 12:41:08 PM,4028##6793##7046##7297,"4- Likely to contribute to gender equality, including across age groups",Implementation,570,PRJ_IMPL_RPT,40678885.7696,7/24/2025 12:58:34 PM
62,Third Reserve Allocation,CBPF-SYR-25-R-NGO-35765,,,2025,1,BAHAR,1,Enhance access to WASH services for affected people in Deir-ez-Zor through the rehabilitation and expansion of water  infrastructure,7/20/2025 12:00:00 AM,2/19/2026 12:00:00 AM,7 Months,297000,277570.1,0,5/20/2025 1:11:34 PM,4703##4929##4273##5266,"4- Likely to contribute to gender equality, including across age groups",Implementation,570,PRJ_IMPL_RPT,40678885.7696,7/30/2025 1:52:33 PM
62,First Reserve Allocation 2025,CBPF-SYR-25-R-UN-34791,,,2025,1,United Nations Children's Fund,3,"Awareness-raising activities to lower the risk of cholera transmission, and prepositioning supplies to respond to Cholera outbreak.",3/31/2025 12:00:00 AM,9/29/2025 12:00:00 AM,6 Months,100000,93457.95,0,2/16/2025 11:10:08 AM,5050##10050##5100##5100,"4- Likely to contribute to gender equality, including across age groups",Implementation,3511,PRJ_UND_FINAL_RPT,9359367.4304,4/16/2025 7:11:25 PM
62,First Reserve Allocation 2025,CBPF-SYR-25-R-UN-34813,,,2025,1,World Health Organization,3,Public Health Emergency Preparedness - Continuation and Upscaling of Health Assistance to the Syrian Population ,3/2/2025 12:00:00 AM,12/1/2025 12:00:00 AM,9 Months,550000.1,514018.8,0,2/4/2025 3:37:31 PM,215100##215500##214000##214000,"4- Likely to contribute to gender equality, including across age groups",Implementation,570,PRJ_IMPL_RPT,9476270.9600,4/4/2025 2:11:42 PM
62,Second Reserve Allocation 2025,CBPF-SYR-25-R-UN-35569,,,2025,1,United Nations Development Programme,3,Restoring Connectivity and Recovery through Al-Rastan Bridge Rehabilitation,6/17/2025 12:00:00 AM,3/16/2026 12:00:00 AM,9 Months,2500000,2336449,0,5/1/2025 9:03:19 AM,17950##15100##7350##9600,1- Unlikely to contribute to gender equality (no gender equality measure and no age consideration),Implementation,570,PRJ_IMPL_RPT,9231836.3072,7/8/2025 12:49:52 PM
62,First Standard Allocation 2025,CBPF-SYR-25-S-INGO-36121,,,2025,2,Action Against Hunger- Spain,2,"Integrated Humanitarian Support for Safe and Dignified Return: Enhancing Health, Nutrition, WASH, and Livelihoods for Returnees and Host Communities in Aleppo and Hama  ",10/1/2025 12:00:00 AM,9/30/2026 12:00:00 AM,12 Months,1472294,1375976,0,6/30/2025 2:18:18 PM,19593##23899##17107##13551,"4- Likely to contribute to gender equality, including across age groups",Implementation,340,PRJ_IMPL_RPT,2295560.2176,10/20/2025 8:20:09 PM
62,First Standard Allocation 2025,CBPF-SYR-25-S-INGO-36147,,,2025,2,Première Urgence Internationale,2,"Supporting Safe Returns: Multi-Sectoral Integrated Intervention for Safe and Dignified Return and Community Resilience in Lattakia, Deir-ez-Zor, and Dar’a, Syria.",9/15/2025 12:00:00 AM,9/14/2026 12:00:00 AM,12 Months,1500000,1401869,0,6/30/2025 2:18:32 PM,2765##3310##1805##1965,"4- Likely to contribute to gender equality, including across age groups",Implementation,340,PRJ_IMPL_RPT,10188319.7312,9/24/2025 7:55:02 PM
62,First Standard Allocation 2025,CBPF-SYR-25-S-INGO-36160,,,2025,2,Danish Refugee Council,2,"Supporting safe, dignified, and voluntary return in Dar’a and Homs through multi-sectoral, integrated programming",9/16/2025 12:00:00 AM,9/15/2026 12:00:00 AM,12 Months,1500000,1401869,0,6/30/2025 10:22:14 AM,12338##13286##9401##8568,"4- Likely to contribute to gender equality, including across age groups",Implementation,340,PRJ_IMPL_RPT,9525866.3968,9/29/2025 1:41:04 PM
62,First Standard Allocation 2025,CBPF-SYR-25-S-INGO-36175,,,2025,2,Norwegian Church Aid,2,"Life-Saving Multi-Sectoral FSA, GBV and WASH Response for Vulnerable IDPs and Host Communities in As-Sweida and Aleppo Governorate (Priority 1)",10/1/2025 12:00:00 AM,9/30/2026 12:00:00 AM,12 Months,1166529,1090214,0,6/30/2025 10:45:56 AM,4990##5063##4072##4145,"4- Likely to contribute to gender equality, including across age groups",Implementation,340,PRJ_IMPL_RPT,15123065.6928,9/30/2025 8:05:49 PM
62,First Standard Allocation 2025,CBPF-SYR-25-S-INGO-36222,,,2025,2,ONG Rescate International,2,"This multi sector proposal is Contributes to 2025 Shelter, WASH &amp; FSS objectives by restoring safe shelter, ensuring dignified WASH access, and improving food security for returnees, hosts &amp; IDPs.'",9/15/2025 12:00:00 AM,9/14/2026 12:00:00 AM,12 Months,1485038,1387886,0,6/30/2025 1:09:43 PM,6415##8275##3956##4619,"4- Likely to contribute to gender equality, including across age groups",Implementation,340,PRJ_IMPL_RPT,10248542.7616,9/18/2025 11:48:21 PM
62,First Standard Allocation 2025,CBPF-SYR-25-S-INGO-36224,,,2025,2,Secours Islamique France,2,"Supporting Safe and Dignified Return in Dar'a, Hrak subdistrict through Integrated WASH, Shelter, and Education Interventions  ",9/15/2025 12:00:00 AM,9/14/2026 12:00:00 AM,12 Months,962683.9,899704.6,0,6/30/2025 4:44:25 PM,1395##2575##2870##3585,"4- Likely to contribute to gender equality, including across age groups",Implementation,340,PRJ_IMPL_RPT,9752588.3936,9/18/2025 11:43:24 PM
62,First Standard Allocation 2025,CBPF-SYR-25-S-INGO-36225,,,2025,2,CARE International,2,"Restoring Dignity and Enabling Resilience: WASH, Shelter and ERL Humanitarian Support for IDPs, Returnees, and Host Communities in Ar-Raqqa, Deir-ez-Zor, Al Hassakeh and Aleppo ",10/1/2025 12:00:00 AM,9/30/2026 12:00:00 AM,12 Months,1500000,1401869,0,6/30/2025 7:36:39 PM,8324##10811##12549##12604,"3- Likely to contribute to gender equality, but without attention to age groups",Implementation,340,PRJ_IMPL_RPT,40707226.0192,10/8/2025 8:13:04 PM
62,First Standard Allocation 2025,CBPF-SYR-25-S-INGO-36251,,,2025,2,Finn Church Aid,2,Pathways to Learning and Recovery: Strengthening Education and Resilience in Homs and Hama- Envelopes 1 and 2 ,10/1/2025 12:00:00 AM,9/30/2026 12:00:00 AM,12 Months,1490000,1392523,0,8/12/2025 4:11:48 PM,595##701##1866##2208,"4- Likely to contribute to gender equality, including across age groups",Implementation,340,PRJ_IMPL_RPT,14081561.5200,9/29/2025 1:37:31 PM
62,First Standard Allocation 2025,CBPF-SYR-25-S-INGO-36270,,,2025,2,Adventist Development and Relief Agency,2,"Restoring Education, Needed Environment and WASH (RENEW)",11/1/2025 12:00:00 AM,10/31/2026 12:00:00 AM,12 Months,1498876,1400819,0,6/30/2025 2:08:17 PM,23240##23240##18260##18260,"4- Likely to contribute to gender equality, including across age groups",Implementation,340,PRJ_IMPL_RPT,8700456.6272,10/27/2025 5:48:47 PM
62,First Standard Allocation 2025,CBPF-SYR-25-S-INGO-36274,,,2025,2,OXFAM,2,Lifesaving and resilience -building WASH and FSL intervention in Dar'a and Deir ez Zor governorates.,9/1/2025 12:00:00 AM,8/31/2026 12:00:00 AM,12 Months,1500000,1401869,0,6/30/2025 7:38:14 PM,16846##14658##13783##11993,"4- Likely to contribute to gender equality, including across age groups",Implementation,340,PRJ_IMPL_RPT,9837609.1424,9/18/2025 11:57:21 PM
62,First Standard Allocation 2025,CBPF-SYR-25-S-INGO-36282,,,2025,2,Terre des Hommes Foundation Switzerland,2,"Life-saving and safe return: Integrating Protection and WASH for the most vulnerable displaced, returnees  and host communities in Rural Damascus, (Babila, bahdaliyah), Aleppo (Jabal Samaan, Salheen).",10/1/2025 12:00:00 AM,9/30/2026 12:00:00 AM,12 Months,685177.2,640352.5,0,6/30/2025 2:06:16 PM,21737##26563##40368##49332,"4- Likely to contribute to gender equality, including across age groups",Implementation,340,PRJ_IMPL_RPT,15069927.7248,9/29/2025 7:52:50 PM
62,First Standard Allocation 2025,CBPF-SYR-25-S-INGO-36326,,,2025,2,Norwegian Refugee Council,2,Multisectoral Returnees Reintegration Support in Homs and Rural Damascus ,9/16/2025 12:00:00 AM,9/15/2026 12:00:00 AM,12 Months,1500000,1401869,0,8/12/2025 2:32:32 PM,2300##2550##2380##2460,"4- Likely to contribute to gender equality, including across age groups",Implementation,340,PRJ_IMPL_RPT,9036997.0912,10/7/2025 1:20:43 PM
62,First Standard Allocation 2025,CBPF-SYR-25-S-INGO-36348,,,2025,2,Fondazione We World - GVC Onlus,2,Integrated Education and WASH interventions for returnees and communities in areas of origin enabling safe and dignified returns in Aleppo and Deir-ez-Zor (Priority – Envelope 2)  ,10/1/2025 12:00:00 AM,9/30/2026 12:00:00 AM,12 Months,1499937,1401811,0,6/30/2025 5:36:24 PM,8646##9931##5068##5884,"4- Likely to contribute to gender equality, including across age groups",Implementation,340,PRJ_IMPL_RPT,9997023.0464,9/29/2025 1:40:17 PM
62,First Standard Allocation 2025,CBPF-SYR-25-S-INGO-36396,,,2025,2,Norwegian Refugee Council,2,Syria Emergency Rapid Response,8/16/2025 12:00:00 AM,8/15/2026 12:00:00 AM,12 Months,1000000,934579.4,0,6/30/2025 6:23:51 PM,3560##3561##3765##3765,"4- Likely to contribute to gender equality, including across age groups",Implementation,340,PRJ_IMPL_RPT,9036997.0912,8/21/2025 1:22:06 PM
62,First Standard Allocation 2025,CBPF-SYR-25-S-INGO-36506,,,2025,2,HEKS-EPER (Hilfswerk der Evangelischen Kirchen Schweiz),2,"Enhanced Access Food Security and WASH Services for IDPs, Vulnerable Host Communities and Returnees in Aleppo and Hama Governorates",9/1/2025 12:00:00 AM,8/31/2026 12:00:00 AM,12 Months,1000000,952380.9,0,6/30/2025 1:22:02 PM,38191##44301##38191##32080,"4- Likely to contribute to gender equality, including across age groups",Implementation,340,PRJ_IMPL_RPT,14733387.2608,9/18/2025 11:51:18 PM
62,First Standard Allocation 2025,CBPF-SYR-25-S-INGO-36577,,,2025,2,Stichting ZOA,2,"Lifesaving humanitarian FSA (Envelope 1) and WASH (Envelope 2) assistance for vulnerable IDPs, returnees and host communities in Qatana subdistrict in Rural Damascus",9/1/2025 12:00:00 AM,8/31/2026 12:00:00 AM,12 Months,1000000,934579.4,0,6/30/2025 12:04:42 PM,5625##6751##5400##4724,"4- Likely to contribute to gender equality, including across age groups",Implementation,340,PRJ_IMPL_RPT,10663018.9120,9/18/2025 11:40:48 PM
62,First Standard Allocation 2025,CBPF-SYR-25-S-INGO-36638,,,2025,2,Norwegian People's Aid,2,Mine Action support to humanitarian activities for the most vulnerable populations in Syria,9/15/2025 12:00:00 AM,9/14/2026 12:00:00 AM,12 Months,600000,560747.7,0,6/30/2025 11:53:08 AM,785##785##695##695,"4- Likely to contribute to gender equality, including across age groups",Implementation,340,PRJ_IMPL_RPT,15562339.5616,9/18/2025 11:44:53 PM
62,First Standard Allocation 2025,CBPF-SYR-25-S-NGO-36139,,,2025,2,Al-Bir Wa Al-Ehsan Association in Ras AlAin,1,"Enhancing the Sustainable Return of Returnees in Deir-ez-Zor through Shelter Rehabilitation, Multi-Purpose Cash Assistance, and Protection Services.",10/1/2025 12:00:00 AM,9/30/2026 12:00:00 AM,12 Months,1500000,1401869,0,6/29/2025 7:58:58 PM,2052##2640##2720##2078,"4- Likely to contribute to gender equality, including across age groups",Implementation,340,PRJ_IMPL_RPT,3719657.7600,9/18/2025 11:45:53 PM
62,First Standard Allocation 2025,CBPF-SYR-25-S-NGO-36173,,,2025,2,Al-Ihsan Charity and Development Association,1,Safe Return: Integrated Assistance for the Most Vulnerable Communities,10/26/2025 12:00:00 AM,10/25/2026 12:00:00 AM,12 Months,719004.5,671966.9,0,6/30/2025 5:50:19 PM,27011##27009##13005##13003,"4- Likely to contribute to gender equality, including across age groups",Disbursement,339,PRJ_DISBURSEMENT,3942837.2256,9/29/2025 7:51:55 PM
62,First Standard Allocation 2025,CBPF-SYR-25-S-NGO-36280,,,2025,2,BAHAR,1,Integrated Area-Based Support for Resilience in Tell Rifaat,9/1/2025 12:00:00 AM,8/31/2026 12:00:00 AM,12 Months,1000000,934579.4,0,6/30/2025 9:50:32 AM,4298##5470##3468##4453,"4- Likely to contribute to gender equality, including across age groups",Implementation,340,PRJ_IMPL_RPT,40678885.7696,9/19/2025 12:22:51 AM
62,First Standard Allocation 2025,CBPF-SYR-25-S-NGO-36328,,,2025,2,Social Care Society,1,Provision Protection Community Services activities for  Rural of Hama,10/15/2025 12:00:00 AM,10/14/2026 12:00:00 AM,12 Months,345183.1,322601,0,6/25/2025 5:57:34 AM,2961##7140##5002##4952,"4- Likely to contribute to gender equality, including across age groups",Implementation,340,PRJ_IMPL_RPT,5869974.1984,9/18/2025 11:49:02 PM
62,First Standard Allocation 2025,CBPF-SYR-25-S-NGO-36334,,,2025,2,Greek Orthodox Patriarchate of Antioch and all the East,1,"Responding to provide urgent support and enhance the resilience of displaced and host communities in rural areas of Deir ez-Zor, Homs, and Damascus. Envelop1.",10/1/2025 12:00:00 AM,9/30/2026 12:00:00 AM,12 Months,1445477,1350913,0,6/28/2025 2:30:04 PM,9105##9105##15520##15520,"4- Likely to contribute to gender equality, including across age groups",Disbursement,339,PRJ_DISBURSEMENT,1693329.9136,9/23/2025 9:47:54 PM
62,First Standard Allocation 2025,CBPF-SYR-25-S-NGO-36399,,,2025,2,Greek Orthodox Patriarchate of Antioch and all the East,1,Envelope 3 : GOPA-DERD's response to emergency situation expected across Syria.,9/1/2025 12:00:00 AM,8/31/2026 12:00:00 AM,12 Months,999778.1,934372,0,6/29/2025 10:39:00 AM,6016##6016##9024##9024,"4- Likely to contribute to gender equality, including across age groups",Disbursement,339,PRJ_DISBURSEMENT,1693329.9136,9/18/2025 11:47:31 PM
62,First Standard Allocation 2025,CBPF-SYR-25-S-NGO-36407,,,2025,2,St. Ephrem Patriarchal Development Committee,1,Multisectoral Action for Returnees and Vulnerable Communities (MARC) in South Syria (Rural Damascus and Dara').  under Envelope 1 and Envelope 2,11/1/2025 12:00:00 AM,10/31/2026 12:00:00 AM,12 Months,1499957,1401829,0,6/29/2025 5:19:11 PM,11280##18028##17549##25548,"4- Likely to contribute to gender equality, including across age groups",Implementation,340,PRJ_IMPL_RPT,6181716.9440,10/16/2025 4:00:19 PM
62,First Standard Allocation 2025,CBPF-SYR-25-S-NGO-36408,,,2025,2,Syrian Development Organization,1,Integrated Humanitarian Support for IDPs and Vulnerable Populations through Housing Assistance in Aleppo and Lattakia Governorate,9/15/2025 12:00:00 AM,9/14/2026 12:00:00 AM,12 Months,538069,502868.2,0,6/30/2025 4:13:01 PM,222##270##164##164,"4- Likely to contribute to gender equality, including across age groups",Implementation,340,PRJ_IMPL_RPT,3546073.7312,9/18/2025 11:42:32 PM
62,First Standard Allocation 2025,CBPF-SYR-25-S-NGO-36427,,,2025,2,Sanad Youth for Development Foundation,1,Reviving Roots: Economic and Community Recovery for Sustainable Return,11/1/2025 12:00:00 AM,10/31/2026 12:00:00 AM,12 Months,399948.9,373784,0,6/30/2025 6:02:02 PM,150##70##0##0,"4- Likely to contribute to gender equality, including across age groups",Implementation,340,PRJ_IMPL_RPT,14581058.4192,10/15/2025 9:54:48 PM
62,First Standard Allocation 2025,CBPF-SYR-25-S-NGO-36541,,,2025,2,Sham Alkhair Foundation,1,"Provision of Winter NFIs for IDP, returnees and host community In Al-Hasakeh Governorate",9/1/2025 12:00:00 AM,5/31/2026 12:00:00 AM,9 Months,500000,467289.7,0,6/29/2025 12:13:29 PM,3300##3300##4950##4950,"4- Likely to contribute to gender equality, including across age groups",Implementation,340,PRJ_IMPL_RPT,14694419.4176,9/19/2025 12:10:08 AM
62,First Standard Allocation 2025,CBPF-SYR-25-S-NGO-36574,,,2025,2,Baraem Association for Children Care,1,Providing protection and Education,11/1/2025 12:00:00 AM,10/31/2026 12:00:00 AM,12 Months,313354.3,292854.5,0,6/28/2025 11:34:10 AM,1970##7478##5914##7839,"4- Likely to contribute to gender equality, including across age groups",Implementation,340,PRJ_IMPL_RPT,15119523.1616,10/27/2025 5:51:39 PM
62,First Standard Allocation 2025,CBPF-SYR-25-S-NGO-36639,,,2025,2,Lamset Shifaa Association,1,Strengthening Primary and Emergency  health Care  services in Rural Homs,10/1/2025 12:00:00 AM,6/30/2026 12:00:00 AM,9 Months,445510.6,416365,0,6/30/2025 12:00:53 PM,12200##25775##30480##20700,"4- Likely to contribute to gender equality, including across age groups",Implementation,340,PRJ_IMPL_RPT,1764180.5376,9/18/2025 11:46:47 PM
62,First Standard Allocation 2025,CBPF-SYR-25-S-NGO-36748,,,2025,2,The Foundation for Advancing Development Integration,1,'Rebuilding Safe and Inclusive Education in Conflict-Affected Rural Aleppo - Learning First',9/15/2025 12:00:00 AM,9/14/2026 12:00:00 AM,12 Months,697341.1,651720.7,0,6/30/2025 8:33:04 PM,47##51##1300##1420,"4- Likely to contribute to gender equality, including across age groups",Implementation,340,PRJ_IMPL_RPT,4917033.3056,9/18/2025 11:49:48 PM
62,First Standard Allocation 2025,CBPF-SYR-25-S-NGO-36769,,,2025,2,Altamayoz Establishment for Development,1,Strengthening Syrians lives through Integrated Humanitarian support,10/1/2025 12:00:00 AM,9/30/2026 12:00:00 AM,12 Months,1093809,1022252,0,6/30/2025 7:44:27 PM,2090##5060##6115##7820,"4- Likely to contribute to gender equality, including across age groups",Implementation,340,PRJ_IMPL_RPT,3762168.1344,9/30/2025 8:06:40 PM
62,First Standard Allocation 2025,CBPF-SYR-25-S-O-36397,,,2025,2,Syrian Arab Red Crescent,4,"48hrs 3rd Envelope Emergency Response Plan for Syria: Rapid Health Services, Hygiene, and Essential Aid Deployment",8/15/2025 12:00:00 AM,8/14/2026 12:00:00 AM,12 Months,999845.2,934434.8,0,6/30/2025 6:41:04 PM,658##763##338##338,"4- Likely to contribute to gender equality, including across age groups",Disbursement,339,PRJ_DISBURSEMENT,9975767.8592,9/18/2025 11:41:36 PM
62,First Standard Allocation 2025,CBPF-SYR-25-S-O-36683,,,2025,2,Syrian Arab Red Crescent,4,"Empowering Vulnerable Communities in Syria: Mobile Teams Delivering  comprehensive Psychosocial, Educational, and Protection Services in R. Damascus, Aleppo and Latakia ",12/1/2025 12:00:00 AM,11/30/2026 12:00:00 AM,12 Months,123982.4,116964.6,0,6/30/2025 7:07:52 PM,731##874##378##378,"4- Likely to contribute to gender equality, including across age groups",Disbursement,339,PRJ_DISBURSEMENT,9975767.8592,12/11/2025 2:04:07 PM
62,First Standard Allocation 2025,CBPF-SYR-25-S-UN-36641,,,2025,2,United Nations Children's Fund,3,"Integrated Humanitarian Response to Enhance Access to Basic Services for Vulnerable Returnees and Host Communities in Al Hasakeh, Aleppo, Daraa and Latakia",11/1/2025 12:00:00 AM,10/31/2026 12:00:00 AM,12 Months,3430543,3206115,0,6/30/2025 5:45:47 PM,124753##166147##115328##112872,"3- Likely to contribute to gender equality, but without attention to age groups",Implementation,340,PRJ_IMPL_RPT,9359367.4304,11/4/2025 2:52:48 PM
62,First Standard Allocation 2025,CBPF-SYR-25-S-UN-36833,,,2025,2,World Food Programme,3,Reyhanli Transshipment Support to Partners on Cross Border Activity through the provision of necessary logistics services and oversight coordination,8/17/2025 12:00:00 AM,2/16/2026 12:00:00 AM,6 Months,700003.2,657280,0,7/16/2025 1:07:00 PM,0##0##1##0,0- Does not systematically link programming actions,Implementation,340,PRJ_IMPL_RPT,9440845.6480,9/18/2025 11:58:14 PM
64,1st  Reserve Allocation 2025,CBPF-YEM-25-R-UN-35811,,,2025,1,United Nations Children's Fund,3,Delivery of lifesaving WASH assistance in Taiz,7/1/2025 12:00:00 AM,6/30/2026 12:00:00 AM,12 Months,2000000,1869159,0,5/21/2025 2:13:36 PM,32391##30924##40016##38016,"4- Likely to contribute to gender equality, including across age groups",Implementation,839,PRJ_IMPL_RPT,9954071.6544,7/9/2025 2:31:46 PM
64,1st Standard Allocation 2025,CBPF-YEM-25-S-INGO-35161,,,2025,2,International Medical Corps UK,2,"Integrated Multisectoral Life-saving Response to Compounded Needs of Women, Girls, and Marginalized and Vulnerable Groups in Yarim District, Ibb Governorate ",6/1/2025 12:00:00 AM,4/17/2026 12:00:00 AM,10 Months 17 Days,960000,897196.3,0,4/1/2025 1:35:13 PM,30754##50595##36168##35099,"4- Likely to contribute to gender equality, including across age groups",Implementation,1674,PRJ_IMPL_RPT,10214530.8672,7/10/2025 2:12:14 PM
64,1st Standard Allocation 2025,CBPF-YEM-25-S-INGO-35186,,,2025,2,War Child UK,2,"Provision of emergency, life-saving protection and psychosocial support (PSS) services to the most vulnerable populations in two districts in Taiz governorate.",6/1/2025 12:00:00 AM,5/31/2026 12:00:00 AM,12 Months,242497.2,226632.8,0,3/29/2025 4:51:24 PM,619##968##1059##1354,"4- Likely to contribute to gender equality, including across age groups",Implementation,1674,PRJ_IMPL_RPT,10973259.8784,5/30/2025 2:29:23 PM
64,1st Standard Allocation 2025,CBPF-YEM-25-S-INGO-35212,,,2025,2,CARE International Yemen,2,Lifesaving Emergency Livelihood Assistance to the vulnerable and conflict-affected population in Ash Shamaytan district in Taiz Governorate ,5/15/2025 12:00:00 AM,2/14/2026 12:00:00 AM,9 Months,373920,349457.9,0,3/29/2025 12:48:56 PM,577##616##641##603,"4- Likely to contribute to gender equality, including across age groups",Implementation,1674,PRJ_IMPL_RPT,10327774.0032,5/20/2025 7:36:41 PM
64,1st Standard Allocation 2025,CBPF-YEM-25-S-INGO-35214,,,2025,2,Vision Hope International,2,"Integrated Lifesaving support to Acutely Vulnerable People in Milhan district, Al Mahwit  Governorate - Yemen.",6/1/2025 12:00:00 AM,5/31/2026 12:00:00 AM,12 Months,750484.4,701387.3,0,4/2/2025 10:45:32 AM,5609##8713##8014##8286,"4- Likely to contribute to gender equality, including across age groups",Implementation,1674,PRJ_IMPL_RPT,2283736.5760,5/30/2025 2:37:06 PM
64,1st Standard Allocation 2025,CBPF-YEM-25-S-INGO-35325,,,2025,2,Solidarités International,2,"Provision of Life-saving WASH response to IDPs, marginalized groups, and other vulnerable groups in cholera/AWD hot spots in Al Qahirah and Al Ma'afer districts of Ta'iz governorate.",6/1/2025 12:00:00 AM,5/31/2026 12:00:00 AM,12 Months,526625,492172.9,0,4/2/2025 4:34:00 PM,15862##15862##16496##15228,"4- Likely to contribute to gender equality, including across age groups",Implementation,1674,PRJ_IMPL_RPT,9765333.0944,6/2/2025 9:45:39 PM
64,1st Standard Allocation 2025,CBPF-YEM-25-S-NGO-35158,,,2025,2,All Girls Foundation for Development,1,"Lifesaving Multi-Sectoral Project with FSAC and Protection-GBV Support for Vulnerable IDPs and Host Communities in Ash-Shihr, Hadramout",6/1/2025 12:00:00 AM,5/31/2026 12:00:00 AM,12 Months,225000,210280.4,0,4/2/2025 8:17:31 PM,209##6240##246##255,"4- Likely to contribute to gender equality, including across age groups",Implementation,1674,PRJ_IMPL_RPT,4322113.0240,5/28/2025 11:23:43 AM
64,1st Standard Allocation 2025,CBPF-YEM-25-S-NGO-35164,,,2025,2,Nahda Makers Organization,1,"Life-saving assistance to acutely vulnerable populations and IDPs, addressing the  CCCM, and Protection needs in  Al Ma'afer, and Jabal Habashi districts in Taiz governorate",6/1/2025 12:00:00 AM,5/31/2026 12:00:00 AM,12 Months,263320.7,246094.1,0,3/27/2025 7:51:32 PM,3009##2372##1431##1355,"4- Likely to contribute to gender equality, including across age groups",Implementation,1674,PRJ_IMPL_RPT,1932682.8544,5/30/2025 2:24:30 PM
64,1st Standard Allocation 2025,CBPF-YEM-25-S-NGO-35165,,,2025,2,Mayar Foundation for Development,1,Emergency Life-Saving &amp;amp; Education Assistance for Crisis-Affected households in Osaylan district of Shabwah governroate,5/15/2025 12:00:00 AM,5/14/2026 12:00:00 AM,12 Months,330421.8,308805.4,0,4/2/2025 6:40:33 PM,293##319##1095##964,"3- Likely to contribute to gender equality, but without attention to age groups",Implementation,1674,PRJ_IMPL_RPT,6322741.7600,5/20/2025 7:33:55 PM
64,1st Standard Allocation 2025,CBPF-YEM-25-S-NGO-35166,,,2025,2,Mayar Foundation for Development,1,Integrated Life-Saving  Emergency livelihood Assistance for Crisis-Affected host community in Lawder and Zingibar districts of Abyan governorate,5/15/2025 12:00:00 AM,5/14/2026 12:00:00 AM,12 Months,353760.7,330617.5,0,4/2/2025 6:39:17 PM,513##559##606##653,"3- Likely to contribute to gender equality, but without attention to age groups",Implementation,1674,PRJ_IMPL_RPT,6322741.7600,5/20/2025 7:23:19 PM
