PFId,AllNm,PrjCode,OPSCodeAgg,EmgAgg,AllYr,AllSrc,OrgNm,OrgTypeId,PrjTitle,AStrDt,AEndDt,PrjDur,PrgBdg,BgdDC,BdgSC,PrjSubDt,BenAgg,PrjGM,PrjStsNm,PrjStsId,PrjStsCode,PartCode,ApprDt
70,2025 First Standard Allocation,CBPF-TUR-25-S-O-36192,,,2025,2,Others,4,Life-Saving Nutrition Support for Crisis-Affected Populations in Syria,9/1/2025 12:00:00 AM,8/31/2026 12:00:00 AM,12 Months,926675.9,866052.3,0,6/30/2025 12:32:13 PM,22979##58841##31065##34753,"4- Likely to contribute to gender equality, including across age groups",Implementation,157,PRJ_IMPL_RPT,1706939.8920,9/10/2025 9:17:35 PM
71,2025 1st Reserve Allocation,CBPF-LEB-25-R-UN-34788,,,2025,1,United Nations Population Fund,3,Coordination/PSEA/AAP netowrk support,2/4/2025 12:00:00 AM,8/3/2025 12:00:00 AM,6 Months,150000,140186.9,0,1/30/2025 3:16:04 PM,70000##70000##30000##30000,"4- Likely to contribute to gender equality, including across age groups",Implementation,234,PRJ_IMPL_RPT,12153040.8048,3/24/2025 9:24:09 AM
71,2025 1st Standard Allocation,CBPF-LEB-25-S-INGO-35729,,,2025,2,Action Contre la Faim Liban,2,Pillar 1: Provision of life-saving WASH assistance in the most conflict-affected areas of Nabatiyeh governorate ,8/1/2025 12:00:00 AM,7/31/2026 12:00:00 AM,12 Months,1000000,934579.4,0,5/27/2025 11:50:29 AM,1762##1762##5338##5338,"4- Likely to contribute to gender equality, including across age groups",Implementation,204,PRJ_IMPL_RPT,13936.9734,8/1/2025 6:48:56 PM
71,2025 1st Standard Allocation,CBPF-LEB-25-S-INGO-35735,,,2025,2,Première Urgence Internationale,2,"Pillar 1: Integrated life-saving services to conflict affected populations in South Lebanon, Nabatiyeh and Mount Lebanon ",8/1/2025 12:00:00 AM,7/31/2026 12:00:00 AM,12 Months,750000,700934.6,0,5/28/2025 3:23:34 PM,2838##6128##561##861,"4- Likely to contribute to gender equality, including across age groups",Implementation,204,PRJ_IMPL_RPT,13356266.1750,8/6/2025 3:57:26 PM
71,2025 1st Standard Allocation,CBPF-LEB-25-S-INGO-35738,,,2025,2,INTERSOS,2,"Pillar II -  Provision of comprehensive and life-saving Protection, GBV, and CP services to new arrivals in Baalbek-Hermel",8/1/2025 12:00:00 AM,7/31/2026 12:00:00 AM,12 Months,629999.9,588785,0,5/28/2025 8:15:40 AM,1202##2495##541##877,"4- Likely to contribute to gender equality, including across age groups",Implementation,204,PRJ_IMPL_RPT,301967.7570,8/6/2025 3:47:16 PM
71,2025 1st Standard Allocation,CBPF-LEB-25-S-INGO-35741,,,2025,2,Mercy Corps,2,Pillar I: Emergency cash assistance as key modality to sustain critical life-saving humanitarian intervention and address urgent basic and food needs for 1150 conflict-affected households ,8/1/2025 12:00:00 AM,2/28/2026 12:00:00 AM,7 Months,645000,602803.8,0,5/28/2025 4:32:48 PM,1391##1419##1469##1471,"4- Likely to contribute to gender equality, including across age groups",Implementation,204,PRJ_IMPL_RPT,975588.1380,8/28/2025 1:13:16 PM
71,2025 1st Standard Allocation,CBPF-LEB-25-S-INGO-35751,,,2025,2,MEDAIR,2,Pillar 1 - Sustaining critical life-saving humanitarian interventions to address urgent survival needs resulting from conflict in Baalbek El Hermel,8/1/2025 12:00:00 AM,7/31/2026 12:00:00 AM,12 Months,400000,373831.8,0,5/28/2025 3:03:27 PM,3902##5099##2033##2602,"4- Likely to contribute to gender equality, including across age groups",Implementation,204,PRJ_IMPL_RPT,376298.2818,8/6/2025 3:54:56 PM
71,2025 1st Standard Allocation,CBPF-LEB-25-S-INGO-35758,,,2025,2,INTERSOS,2,"Pillar I -  Provision of life-saving protection and shelter assistance to internally IDPs and individuals at heightened protection risk, including GBV survivors and children, in conflict-affected area",8/1/2025 12:00:00 AM,7/31/2026 12:00:00 AM,12 Months,900000,841121.5,0,5/28/2025 12:48:56 PM,1358##2408##580##508,"4- Likely to contribute to gender equality, including across age groups",Implementation,204,PRJ_IMPL_RPT,301967.7570,8/6/2025 3:48:10 PM
71,2025 1st Standard Allocation,CBPF-LEB-25-S-INGO-35759,,,2025,2,ANERA,2,"Pillar 1:  Humanitarian Lifeline: Acute Life-Saving Basic &amp; Food Security Support to 1,245 Lebanese &amp; Palestinian HH (4980 persons) who are conflict-affected in IPC3-rated regions (Tyre &amp; Bent Jbeil).",8/1/2025 12:00:00 AM,1/31/2026 12:00:00 AM,6 Months,699301.8,653553.1,0,5/28/2025 12:46:39 PM,1594##1792##846##748,"4- Likely to contribute to gender equality, including across age groups",Implementation,204,PRJ_IMPL_RPT,1793223.9108,8/12/2025 6:17:38 PM
71,2025 1st Standard Allocation,CBPF-LEB-25-S-INGO-35771,,,2025,2,International Medical Corps Croatia,2,Pillar I - Provision of integrated health and nutrition services to vulnerable populations in conflict-affected areas in South (Touline) and West Bekaa (Sohmor).,8/1/2025 12:00:00 AM,7/31/2026 12:00:00 AM,12 Months,396366,370435.5,0,5/28/2025 11:46:26 AM,1434##3093##1196##1293,"4- Likely to contribute to gender equality, including across age groups",Implementation,204,PRJ_IMPL_RPT,20840420.8908,8/12/2025 6:20:20 PM
71,2025 1st Standard Allocation,CBPF-LEB-25-S-INGO-35772,,,2025,2,Médecins du Monde France,2,"Pillar I - Maintaining critical access to primary health care services for all, in conflict-affected areas of Southern Beirut and Hermel",8/1/2025 12:00:00 AM,3/31/2026 12:00:00 AM,8 Months,400000,373831.8,0,5/28/2025 5:55:25 PM,3000##8350##3079##3394,"4- Likely to contribute to gender equality, including across age groups",Implementation,204,PRJ_IMPL_RPT,371652.6240,8/7/2025 7:13:23 PM
71,2025 1st Standard Allocation,CBPF-LEB-25-S-INGO-35779,,,2025,2,Associazione Volontari per il Servizio Internazionale,2,Pillar I - WASH lifesaving response for conflict affected populations in Marjayoun district.,8/1/2025 12:00:00 AM,6/30/2026 12:00:00 AM,11 Months,842000,786915.9,0,5/28/2025 2:13:15 PM,2061##3476##2387##2819,"4- Likely to contribute to gender equality, including across age groups",Implementation,204,PRJ_IMPL_RPT,12859180.7904,8/12/2025 6:16:39 PM
71,2025 1st Standard Allocation,CBPF-LEB-25-S-INGO-35807,,,2025,2,CARE International in Lebanon,2,Pillar 2: Provision of life-saving Food assistance to Syrian newcomers living inside collective shelters in Tripoli and Akkar Districts while ensuring protection mainstreaming. ,8/1/2025 12:00:00 AM,1/31/2026 12:00:00 AM,6 Months,350000,327102.8,0,5/28/2025 1:38:13 PM,310##280##200##210,"4- Likely to contribute to gender equality, including across age groups",Implementation,204,PRJ_IMPL_RPT,12678000.1362,8/1/2025 6:47:34 PM
71,2025 1st Standard Allocation,CBPF-LEB-25-S-INGO-35813,,,2025,2,CARE International in Lebanon,2,"Pillar 1: Provision of life-saving emergency cash assistance, integrating food security and basic needs support with protection mainstreaming to conflict-affected households in Mount Lebanon.",8/1/2025 12:00:00 AM,2/28/2026 12:00:00 AM,7 Months,500000,467289.7,0,5/28/2025 1:13:34 PM,1536##1662##584##718,"4- Likely to contribute to gender equality, including across age groups",Implementation,204,PRJ_IMPL_RPT,12678000.1362,8/1/2025 6:46:29 PM
71,2025 1st Standard Allocation,CBPF-LEB-25-S-INGO-35816,,,2025,2,Terre des hommes foundation,2,"Pillar 1 Child Protection, Gender-Based Violence, and Protection integrated with Shelter for conflict-affected populations in Bekaa and  Baalbek-Hermel",8/1/2025 12:00:00 AM,7/31/2026 12:00:00 AM,12 Months,533987.8,499054.1,0,5/28/2025 1:26:10 PM,216##302##232##380,"4- Likely to contribute to gender equality, including across age groups",Implementation,204,PRJ_IMPL_RPT,7484154.7158,8/1/2025 6:49:19 PM
71,2025 1st Standard Allocation,CBPF-LEB-25-S-INGO-35819,,,2025,2,Save the Children Fund,2,"Pillar I; Child Protection, Shelter, and WASH Response in South Lebanon, Nabatieh and South Beirut Suburbs  ",8/1/2025 12:00:00 AM,7/31/2026 12:00:00 AM,12 Months,948380.1,886336.5,0,5/28/2025 3:35:40 PM,3985##3343##4325##3593,"4- Likely to contribute to gender equality, including across age groups",Implementation,204,PRJ_IMPL_RPT,11999734.0974,8/7/2025 7:17:35 PM
71,2025 1st Standard Allocation,CBPF-LEB-25-S-INGO-35827,,,2025,2,Relief International,2,"Pillar I: Essential Health and Nutrition services for affected populations in Bekaa, Baalbek and Beirut – Mount Lebanon",8/1/2025 12:00:00 AM,6/30/2026 12:00:00 AM,11 Months,1131334,1057322,0,5/28/2025 3:42:30 PM,4398##7362##7084##7271,"4- Likely to contribute to gender equality, including across age groups",Implementation,204,PRJ_IMPL_RPT,11962568.8350,8/7/2025 7:14:17 PM
71,2025 1st Standard Allocation,CBPF-LEB-25-S-INGO-35839,,,2025,2,Action Contre la Faim Liban,2,"Pillar 1: Integrated food security and basic assistance, health and nutrition emergency response in the most affected areas of South and Nabatiyeh governorates",8/1/2025 12:00:00 AM,2/28/2026 12:00:00 AM,7 Months,700000,654205.6,0,5/27/2025 8:13:40 AM,1688##1688##1687##1687,"4- Likely to contribute to gender equality, including across age groups",Implementation,204,PRJ_IMPL_RPT,13936.9734,8/1/2025 6:53:33 PM
71,2025 1st Standard Allocation,CBPF-LEB-25-S-INGO-35861,,,2025,2,World Vision International,2,Pillar 1 - Life Saving Basic Assistance and Food Security Response in Nabatieh &amp; South Governorate,8/1/2025 12:00:00 AM,2/28/2026 12:00:00 AM,7 Months,999000,933644.9,0,5/28/2025 2:42:52 PM,2940##3186##1584##1715,"4- Likely to contribute to gender equality, including across age groups",Implementation,204,PRJ_IMPL_RPT,715431.3012,8/7/2025 7:16:10 PM
71,2025 1st Standard Allocation,CBPF-LEB-25-S-INGO-35897,,,2025,2,Polish Center for International Aid,2,Pillar II: Integrated Assistance for New Arrivals and Shock-Affected Populations in Akkar and Hermel,8/1/2025 12:00:00 AM,2/28/2026 12:00:00 AM,7 Months,543765,512985.8,0,5/28/2025 4:22:34 PM,1232##1540##1133##1022,"4- Likely to contribute to gender equality, including across age groups",Implementation,204,PRJ_IMPL_RPT,1862908.7778,8/7/2025 7:14:56 PM
71,2025 1st Standard Allocation,CBPF-LEB-25-S-INGO-35899,,,2025,2,Norwegian Refugee Council,2,Pillar 2 - WASH Assistance to New Arriving Refugees in Baalbek-Hermel and Bekaa,8/1/2025 12:00:00 AM,7/31/2026 12:00:00 AM,12 Months,500000,467289.7,0,5/28/2025 11:15:35 AM,1812##1921##2242##2525,"4- Likely to contribute to gender equality, including across age groups",Implementation,204,PRJ_IMPL_RPT,427400.5176,8/6/2025 3:51:02 PM
71,2025 1st Standard Allocation,CBPF-LEB-25-S-INGO-35906,,,2025,2,Première Urgence Internationale,2,Pillar 2: Multisectoral response to new arrivals in Akkar governorate,8/1/2025 12:00:00 AM,4/30/2026 12:00:00 AM,9 Months,400000,373831.8,0,5/28/2025 2:52:32 PM,1743##3522##2822##2624,"4- Likely to contribute to gender equality, including across age groups",Implementation,204,PRJ_IMPL_RPT,13356266.1750,8/6/2025 3:55:47 PM
71,2025 1st Standard Allocation,CBPF-LEB-25-S-INGO-35936,,,2025,2,World Vision International,2,Pillar 1 - Life Saving WASH Response in Beirut &amp; South Governorate,8/1/2025 12:00:00 AM,3/31/2026 12:00:00 AM,8 Months,560000,523364.5,0,5/28/2025 3:53:08 PM,5273##5713##2838##3076,"4- Likely to contribute to gender equality, including across age groups",Implementation,204,PRJ_IMPL_RPT,715431.3012,8/7/2025 7:19:34 PM
71,2025 1st Standard Allocation,CBPF-LEB-25-S-INGO-35937,,,2025,2,World Vision International,2,Pillar 2 - Life Saving WASH Response in Baalbeck &amp; Hermel Governorate,8/1/2025 12:00:00 AM,3/31/2026 12:00:00 AM,8 Months,500000,467289.7,0,5/28/2025 4:34:54 PM,13728##14872##7392##8008,"4- Likely to contribute to gender equality, including across age groups",Implementation,204,PRJ_IMPL_RPT,715431.3012,8/7/2025 7:19:19 PM
71,2025 1st Standard Allocation,CBPF-LEB-25-S-INGO-35974,,,2025,2,OXFAM GB,2,"Pillar I: Responding to Urgent WASH Needs and Rehabilitating Critical Water Infrastructure for Displaced and Host Communities in Nabatieh, and Tyre",8/1/2025 12:00:00 AM,7/31/2026 12:00:00 AM,12 Months,697378.6,651755.8,0,5/28/2025 3:27:02 PM,7559##8030##3780##4251,"4- Likely to contribute to gender equality, including across age groups",Implementation,204,PRJ_IMPL_RPT,450628.8066,8/12/2025 6:18:28 PM
71,2025 2nd Standard Allocation,CBPF-LEB-25-S-INGO-37783,,,2025,2,INTERSOS,2,"Integrated WASH response to enhance safe water access, sanitation and reduce health risks of vulnerable individuals in drought, displacement, and conflict-affected areas of Baalbek, Zahle, Saida, Sour",1/1/2026 12:00:00 AM,12/31/2026 12:00:00 AM,12 Months,700000,654205.6,0,10/20/2025 1:06:23 PM,97306##93477##67611##64961,"4- Likely to contribute to gender equality, including across age groups",Implementation,204,PRJ_IMPL_RPT,301967.7570,12/29/2025 11:42:03 PM
71,2025 2nd Standard Allocation,CBPF-LEB-25-S-INGO-37795,,,2025,2,Associazione Volontari per il Servizio Internazionale,2,WASH life-saving response for most vulnerable host communities and new refugee arrivals in Akkar district,1/1/2026 12:00:00 AM,12/31/2026 12:00:00 AM,12 Months,716000,669158.9,0,10/20/2025 12:59:02 PM,16963##16963##8739##8739,"4- Likely to contribute to gender equality, including across age groups",Implementation,204,PRJ_IMPL_RPT,12859180.7904,12/29/2025 11:40:54 PM
71,2025 2nd Standard Allocation,CBPF-LEB-25-S-INGO-37816,,,2025,2,Action Contre la Faim Liban,2,"Delivery of Inclusive Life-saving Health and Nutrition Services to the Most Vulnerable Populations in the Districts of Baalbek, Zahle and Tyre",1/1/2026 12:00:00 AM,8/31/2026 12:00:00 AM,8 Months,635000,593457.9,0,10/20/2025 10:43:10 AM,0##2084##350##439,"4- Likely to contribute to gender equality, including across age groups",Implementation,204,PRJ_IMPL_RPT,13936.9734,12/31/2025 5:00:29 PM
71,2025 2nd Standard Allocation,CBPF-LEB-25-S-INGO-37820,,,2025,2,Première Urgence Internationale,2,Health and MHPSS  response to people affected by conflict and displacement in Baalbeck district,1/1/2026 12:00:00 AM,12/31/2026 12:00:00 AM,12 Months,320000,299065.4,0,10/20/2025 2:25:51 PM,443##1643##251##393,"4- Likely to contribute to gender equality, including across age groups",Implementation,204,PRJ_IMPL_RPT,13356266.1750,12/31/2025 4:56:25 PM
71,2025 2nd Standard Allocation,CBPF-LEB-25-S-INGO-37826,,,2025,2,Action Contre la Faim Liban,2,Provision of essential WASH and sanitation services to conflict and draught affected populations in the districts of Tyre and Saida. ,1/1/2026 12:00:00 AM,10/31/2026 12:00:00 AM,10 Months,675000,630841.1,0,10/20/2025 1:11:50 PM,44496##44495##44497##44495,"4- Likely to contribute to gender equality, including across age groups",Implementation,204,PRJ_IMPL_RPT,13936.9734,12/31/2025 5:01:27 PM
71,2025 2nd Standard Allocation,CBPF-LEB-25-S-INGO-37897,,,2025,2,DAN CHURCH AID,2,Strengthening food Security for Drought and Crisis-Affected Farmers,1/15/2026 12:00:00 AM,9/14/2026 12:00:00 AM,8 Months,472000.4,441121.9,0,10/20/2025 4:54:29 PM,150##25##0##0,"4- Likely to contribute to gender equality, including across age groups",Implementation,204,PRJ_IMPL_RPT,19725463.0188,12/31/2025 4:58:02 PM
71,2025 2nd Standard Allocation,CBPF-LEB-25-S-INGO-37902,,,2025,2,World Vision International,2,Delivering lifesaving food security interventions to farmers affected by overlapping crises in Saida and Baalbek ,1/5/2026 12:00:00 AM,10/4/2026 12:00:00 AM,9 Months,400000,373831.8,0,10/20/2025 2:50:35 PM,328##82##0##0,"4- Likely to contribute to gender equality, including across age groups",Implementation,204,PRJ_IMPL_RPT,715431.3012,1/2/2026 11:51:02 AM
71,2025 2nd Standard Allocation,CBPF-LEB-25-S-INGO-37999,,,2025,2,OXFAM GB,2,"Responding to Critical WASH Needs of Conflict- and Climate-Affected Communities in Baalbek Through Rehabilitation, Critical Service Delivery, and Sustainable Infrastructure Solutions",1/1/2026 12:00:00 AM,12/31/2026 12:00:00 AM,12 Months,457844.1,427891.7,0,10/20/2025 12:54:20 PM,7383##7900##4157##4677,"4- Likely to contribute to gender equality, including across age groups",Implementation,204,PRJ_IMPL_RPT,450628.8066,12/31/2025 4:59:38 PM
71,2025 2nd Standard Allocation,CBPF-LEB-25-S-INGO-38019,,,2025,2,Polish Center for International Aid,2,Life-saving food assistance for newcomers in Akkar,1/15/2026 12:00:00 AM,8/14/2026 12:00:00 AM,7 Months,249999,238094.3,0,10/20/2025 10:03:04 AM,810##1054##782##714,"4- Likely to contribute to gender equality, including across age groups",Implementation,204,PRJ_IMPL_RPT,1862908.7778,12/31/2025 4:57:18 PM
71,2025 1st Standard Allocation,CBPF-LEB-25-S-NGO-35732,,,2025,2,Association Mada,1,Pillar 3 Feeding into Pillar I - Food Security: Localized Food Security Response for Conflict-Affected Households in Beirut Southern Suburbs    ,8/1/2025 12:00:00 AM,2/28/2026 12:00:00 AM,7 Months,185000,172897.2,0,5/27/2025 5:48:31 PM,626##790##742##564,"4- Likely to contribute to gender equality, including across age groups",Implementation,204,PRJ_IMPL_RPT,20854357.8642,8/6/2025 3:54:07 PM
71,2025 1st Standard Allocation,CBPF-LEB-25-S-NGO-35748,,,2025,2,Embrace,1,Pillar 1 - Integration of Mental Health Services into underserved Primary Health Care Centres in South Lebanon and Bekaa,8/1/2025 12:00:00 AM,7/31/2026 12:00:00 AM,12 Months,199993.1,186909.5,0,5/28/2025 5:56:06 PM,6952##8802##3650##3650,"4- Likely to contribute to gender equality, including across age groups",Implementation,204,PRJ_IMPL_RPT,8390057.9868,8/6/2025 3:56:38 PM
71,2025 1st Standard Allocation,CBPF-LEB-25-S-NGO-35767,,,2025,2,Restart Center,1,Pillar II: Specialized Mental Health and Protection Services for High-Risk Newly Arrived Individuals in North Lebanon and Akkar.,8/1/2025 12:00:00 AM,7/31/2026 12:00:00 AM,12 Months,388740.8,363309.1,0,5/28/2025 1:55:59 PM,550##850##100##100,"4- Likely to contribute to gender equality, including across age groups",Implementation,204,PRJ_IMPL_RPT,1914011.0136,8/6/2025 3:46:41 PM
71,2025 1st Standard Allocation,CBPF-LEB-25-S-NGO-35773,,,2025,2,Beit El Baraka,1,Pillar I- Unconditional cash assistance for the most vulnerable in Baalbek Hermel ,8/1/2025 12:00:00 AM,2/28/2026 12:00:00 AM,7 Months,399903.7,373741.8,0,5/28/2025 6:16:27 AM,963##1280##576##768,"4- Likely to contribute to gender equality, including across age groups",Implementation,204,PRJ_IMPL_RPT,20705696.8146,8/1/2025 6:44:05 PM
71,2025 1st Standard Allocation,CBPF-LEB-25-S-NGO-35784,,,2025,2,SPHERE Building Tomorrow,1,Pillar III: Food Security - Feeding Pillar I,8/1/2025 12:00:00 AM,1/31/2026 12:00:00 AM,6 Months,319999.6,299065,0,5/28/2025 7:55:31 PM,470##410##66##96,"4- Likely to contribute to gender equality, including across age groups",Implementation,204,PRJ_IMPL_RPT,20900814.4422,8/7/2025 7:12:40 PM
71,2025 1st Standard Allocation,CBPF-LEB-25-S-NGO-35801,,,2025,2,The Forum for the Rights of Persons with Disabilities,1,"Pillar II- Provision of rapid, life saving assistance to new arrivals  and displacement affected PwDs and elderlies in north Lebanon and Akkar.",9/1/2025 12:00:00 AM,8/31/2026 12:00:00 AM,12 Months,242638.3,226764.7,0,5/27/2025 5:08:11 AM,300##472##100##150,"4- Likely to contribute to gender equality, including across age groups",Implementation,204,PRJ_IMPL_RPT,6127622.6382,8/12/2025 6:19:11 PM
71,2025 1st Standard Allocation,CBPF-LEB-25-S-NGO-35810,,,2025,2,Rene Mouawad Foundation,1,Pillar II – Child Protection and Education Response in Akkar,8/1/2025 12:00:00 AM,7/31/2026 12:00:00 AM,12 Months,425909.4,398046.2,0,5/28/2025 7:53:28 AM,87##203##400##600,2- Unlikely to contribute to gender equality (no gender equality measure but includes age consideration),Implementation,204,PRJ_IMPL_RPT,1802515.2264,8/7/2025 7:16:34 PM
71,2025 1st Standard Allocation,CBPF-LEB-25-S-NGO-35817,,,2025,2,ASSOCIATION DES JEUNES ISLAMIQUES,1,"Pillar 2: Health and Nutrition Sectors, Comprehensive Primary, Reproductive, Mental Health, and Nutrition Services for 7,000 Vulnerable People (60% Host Community, 40% Refugee) in North Lebanon ",8/1/2025 12:00:00 AM,7/31/2026 12:00:00 AM,12 Months,299794.8,280182,0,5/26/2025 3:15:17 PM,1200##2800##1500##1500,"4- Likely to contribute to gender equality, including across age groups",Implementation,204,PRJ_IMPL_RPT,7070691.1716,8/1/2025 6:44:56 PM
71,2025 1st Standard Allocation,CBPF-LEB-25-S-NGO-35831,,,2025,2,Association Libanaise des Chevaliers de Malte,1,Pillar I–Life-Saving Health interventions targeting vulnerable populations in Conflict-Affected and Hard-to-Reach Areas of South Lebanon-Nabatieh Governorate.,8/1/2025 12:00:00 AM,5/31/2026 12:00:00 AM,10 Months,300000,280373.8,0,5/28/2025 3:03:36 PM,991##1424##497##399,"4- Likely to contribute to gender equality, including across age groups",Implementation,204,PRJ_IMPL_RPT,18861370.6680,8/6/2025 3:48:51 PM
71,2025 1st Standard Allocation,CBPF-LEB-25-S-NGO-35842,,,2025,2,Imam Sadr Foundation,1,Pillar I - Lifesaving Intervention in Gender-Based Violence and Child Protection Sectors in Bint-Jbeil and Sour Districts,10/1/2025 12:00:00 AM,9/30/2026 12:00:00 AM,12 Months,349450.2,326589,0,5/28/2025 2:09:16 PM,225##1855##280##840,"4- Likely to contribute to gender equality, including across age groups",Implementation,204,PRJ_IMPL_RPT,1853617.4622,8/6/2025 3:49:34 PM
71,2025 1st Standard Allocation,CBPF-LEB-25-S-NGO-35844,,,2025,2,Caritas Lebanon,1,Pillar III : Support access to life-saving hospital and referral care for high-risk pregnancies in Lebanon.,8/1/2025 12:00:00 AM,7/31/2026 12:00:00 AM,12 Months,354000,330841.1,0,5/28/2025 7:02:37 PM,0##214##0##209,2- Unlikely to contribute to gender equality (no gender equality measure but includes age consideration),Implementation,204,PRJ_IMPL_RPT,1811806.5420,8/6/2025 3:53:26 PM
71,2025 1st Standard Allocation,CBPF-LEB-25-S-NGO-35852,,,2025,2,Association Nabad for Development,1,"Pillar I - Emergency Cash Assistance to Conflict-Affected Vulnerable Households in Baalbek, Hermel and Central Bekaa Districts",8/1/2025 12:00:00 AM,2/28/2026 12:00:00 AM,7 Months,700000,654205.6,0,5/28/2025 1:14:39 PM,1300##1950##1560##1690,"4- Likely to contribute to gender equality, including across age groups",Implementation,204,PRJ_IMPL_RPT,3902352.5520,8/7/2025 7:10:56 PM
71,2025 1st Standard Allocation,CBPF-LEB-25-S-NGO-35857,,,2025,2,Caritas Lebanon,1,"Pillar I : Integrated Life-Saving Response for Vulnerable Population in Conflict-Affected Areas (South, Bekaa, Baalbek/Hermel, Southern Suburbs of Beirut) through Protection, GBV, CP &amp; Shelter Support",8/1/2025 12:00:00 AM,7/31/2026 12:00:00 AM,12 Months,700000,654205.6,0,5/28/2025 7:01:48 PM,514##1118##310##558,"4- Likely to contribute to gender equality, including across age groups",Implementation,204,PRJ_IMPL_RPT,1811806.5420,8/7/2025 7:11:37 PM
71,2025 1st Standard Allocation,CBPF-LEB-25-S-NGO-35867,,,2025,2,Nusaned,1,Pillar 3 feeding into Pillar 1 - Agriculture and WASH response interventions in conflict-affected areas in the South of Lebanon,7/15/2025 12:00:00 AM,4/14/2026 12:00:00 AM,9 Months,399630.5,373486.5,0,5/28/2025 4:05:16 PM,290##291##0##0,"4- Likely to contribute to gender equality, including across age groups",Implementation,204,PRJ_IMPL_RPT,19093653.5580,8/1/2025 6:42:14 PM
71,2025 1st Standard Allocation,CBPF-LEB-25-S-NGO-35868,,,2025,2,Nusaned,1,"Pillar 2 - Food Security In-Kind Assistance in Akkar, Baalbek El-Hermel, and Bekaa in response to the cross border emergency for new arrivals",8/1/2025 12:00:00 AM,4/30/2026 12:00:00 AM,9 Months,759999.8,710280.2,0,5/28/2025 5:38:16 PM,3212##3211##0##0,"4- Likely to contribute to gender equality, including across age groups",Implementation,204,PRJ_IMPL_RPT,19093653.5580,8/1/2025 6:41:13 PM
71,2025 1st Standard Allocation,CBPF-LEB-25-S-NGO-35879,,,2025,2,Human Aid and Development Hand,1,Pillar III - Shelter response for conflict affected people in Bekaa/ Baalbek- Hermel governorates,8/1/2025 12:00:00 AM,5/31/2026 12:00:00 AM,10 Months,400000,373831.8,0,5/28/2025 1:36:27 PM,345##428##248##359,"4- Likely to contribute to gender equality, including across age groups",Implementation,204,PRJ_IMPL_RPT,51255542.5074,8/1/2025 6:50:15 PM
71,2025 1st Standard Allocation,CBPF-LEB-25-S-NGO-35883,,,2025,2,Rene Mouawad Foundation,1,Pillar II - Responding to WASH Needs in Akkar,8/1/2025 12:00:00 AM,7/31/2026 12:00:00 AM,12 Months,499943.5,467236.9,0,5/28/2025 9:55:02 AM,5692##8538##5692##8538,0- Does not systematically link programming actions,Implementation,204,PRJ_IMPL_RPT,1802515.2264,8/7/2025 7:18:25 PM
71,2025 1st Standard Allocation,CBPF-LEB-25-S-NGO-35895,,,2025,2,Farah Social Foundation,1,Pillar III: Urgent Food Saving Activity  Provision of Hot Meals for Collective Shelters in Beirut,8/1/2025 12:00:00 AM,2/28/2026 12:00:00 AM,7 Months,149976.8,140165.2,0,5/28/2025 1:26:53 PM,823##1125##290##324,"4- Likely to contribute to gender equality, including across age groups",Implementation,204,PRJ_IMPL_RPT,18856725.0102,8/1/2025 6:43:12 PM
71,2025 1st Standard Allocation,CBPF-LEB-25-S-NGO-35896,,,2025,2,Welfare Association - Lebanon Branch,1,Pillar 3 : Provision of Basic Assistance and Food Security to 600 Persons in the Palestinian Refugee Camps of Tyre ,8/1/2025 12:00:00 AM,1/31/2026 12:00:00 AM,6 Months,349327.2,326474,0,5/28/2025 6:05:39 AM,292##308##0##0,"3- Likely to contribute to gender equality, but without attention to age groups",Implementation,204,PRJ_IMPL_RPT,6243764.0832,8/6/2025 3:52:00 PM
71,2025 1st Standard Allocation,CBPF-LEB-25-S-NGO-35902,,,2025,2,Human Aid and Development Hand,1,Pillar I – Emergency Cash Assistance for Conflict-Affected Populations in Bekaa and Baalbek-Hermel Governorates,8/1/2025 12:00:00 AM,2/28/2026 12:00:00 AM,7 Months,325000,303738.3,0,5/28/2025 1:34:18 PM,550##681##397##572,"4- Likely to contribute to gender equality, including across age groups",Implementation,204,PRJ_IMPL_RPT,51255542.5074,8/1/2025 6:52:20 PM
