PFId,AllNm,PrjCode,OPSCodeAgg,EmgAgg,AllYr,AllSrc,OrgNm,OrgTypeId,PrjTitle,AStrDt,AEndDt,PrjDur,PrgBdg,BgdDC,BdgSC,PrjSubDt,BenAgg,PrjGM,PrjStsNm,PrjStsId,PrjStsCode,PartCode,ApprDt
23,2025 1st Reserve Allocation,CBPF-AFG-25-R-NGO-35099,,,2025,1,Afghan Youth Services Organization,1,"Integrated Emergency Food &amp; Nutrition Assistance, and Agricultural Support for Vulnerable Communities in Kunar and Kabul provinces ",5/1/2025 12:00:00 AM,12/31/2025 12:00:00 AM,8 Months,677449.2,633130.1,0,3/20/2025 11:48:52 AM,34293##25873##32940##26920,"3- Likely to contribute to gender equality, but without attention to age groups",Implementation,308,PRJ_UND_FINAL_RPT,182175.1731,5/6/2025 7:35:14 PM
23,2025 1st Reserve Allocation,CBPF-AFG-25-R-NGO-35101,,,2025,1,Justice and Civil Society Support Organization,1,Emergency Agriculture and Food Assistance to the most vulnerable people in ?Baghlan Province,5/1/2025 12:00:00 AM,2/28/2026 12:00:00 AM,10 Months,448459.2,419120.7,0,3/13/2025 8:04:39 AM,5547##3000##165##89,"4- Likely to contribute to gender equality, including across age groups",Implementation,119,PRJ_IMPL_RPT,175993.5804,5/6/2025 7:45:33 PM
23,2025 1st Reserve Allocation,CBPF-AFG-25-R-NGO-35102,,,2025,1,Human Rights Research and Advocacy Consortium,1,"Enhancing Protection and Housing, Land, and Property (HLP) Rights for Vulnerable Communities in Kabul and Khost.",5/4/2025 12:00:00 AM,12/3/2025 12:00:00 AM,7 Months,298215,278705.6,0,3/20/2025 11:40:17 AM,800##1130##300##200,"4- Likely to contribute to gender equality, including across age groups",Implementation,308,PRJ_UND_FINAL_RPT,174175.4649,5/8/2025 6:15:50 PM
23,2025 1st Reserve Allocation,CBPF-AFG-25-R-NGO-35105,,,2025,1,Organization for Coordination of Humanitarian Relief,1,"Humanitarian Water, Sanitation and Hygiene (WASH) Response for Under-served Communities in Kunar Province.",5/15/2025 12:00:00 AM,5/14/2026 12:00:00 AM,12 Months,770557.7,720147.4,0,3/19/2025 1:14:29 PM,12671##13249##14976##16704,"3- Likely to contribute to gender equality, but without attention to age groups",Implementation,119,PRJ_IMPL_RPT,170539.2339,5/6/2025 7:34:08 PM
23,2025 1st Reserve Allocation,CBPF-AFG-25-R-NGO-35116,,,2025,1,Agency for Rehabilitation and Energy conservation in Afghanistan,1,Provision of emergency agriculture support for IPC 3 and above small holder farmers in rural districts of Kabul province,4/27/2025 12:00:00 AM,12/26/2025 12:00:00 AM,8 Months,447804.5,418508.9,0,3/20/2025 12:38:13 PM,16417##18411##4083##2039,"4- Likely to contribute to gender equality, including across age groups",Implementation,308,PRJ_UND_FINAL_RPT,145449.2400,5/6/2025 7:29:11 PM
23,2025 1st Reserve Allocation,CBPF-AFG-25-R-NGO-35127,,,2025,1,Afghan Health and Development Services,1,Integrated primary healthcare services in Kandahar and Hilmand,5/22/2025 12:00:00 AM,5/21/2026 12:00:00 AM,12 Months,471806,440940.2,0,3/20/2025 6:08:24 AM,11081##11608##15302##14774,"3- Likely to contribute to gender equality, but without attention to age groups",Implementation,119,PRJ_IMPL_RPT,138540.4011,5/6/2025 7:36:17 PM
23,2025 1st Reserve Allocation,CBPF-AFG-25-R-NGO-35133,,,2025,1,Agency for Assistance  for Development of Afghanistan,1,Provision of Emergency Agriculture and Food Assistance in Paktika Province,5/1/2025 12:00:00 AM,10/31/2025 12:00:00 AM,6 Months,489734.1,457695.5,0,3/20/2025 12:43:11 PM,4350##4350##7830##7830,"3- Likely to contribute to gender equality, but without attention to age groups",Reporting,308,PRJ_UND_FINAL_RPT,123995.4771,5/1/2025 7:13:17 PM
23,2025 1st Reserve Allocation,CBPF-AFG-25-R-NGO-35136,,,2025,1,Organization for Mine clearance & Afghan Rehabilitation,1,Supporting Affected and Vulnerable HHs in Kabul province through Cash-based Emergency Food Assistance,5/1/2025 12:00:00 AM,11/30/2025 12:00:00 AM,7 Months,499624.3,466938.6,0,3/20/2025 11:27:55 AM,3016##3483##5156##5496,"4- Likely to contribute to gender equality, including across age groups",Implementation,308,PRJ_UND_FINAL_RPT,135631.4163,5/6/2025 7:27:55 PM
23,2025 1st Reserve Allocation,CBPF-AFG-25-R-NGO-35183,,,2025,1,Coordination of Humanitarian Assistance,1,Provision of life-saving integrated health and food security assistance for highly vulnerable people in Sar-e-Pul province,5/15/2025 12:00:00 AM,5/14/2026 12:00:00 AM,12 Months,736094.6,687938.8,0,3/20/2025 7:29:44 AM,15865##15994##7877##8069,"4- Likely to contribute to gender equality, including across age groups",Implementation,119,PRJ_IMPL_RPT,145085.6169,5/6/2025 7:41:52 PM
23,2025 1st Reserve Allocation,CBPF-AFG-25-R-NGO-35199,,,2025,1,Afghanistan National Urban and Rural Development Organization,1,Provision of life-saving comprehensive WASH assistance for vulnerable and in-need communities in Chak district of Maidan Wardak province,5/1/2025 12:00:00 AM,1/31/2026 12:00:00 AM,9 Months,691389.2,646158.1,0,3/20/2025 7:28:52 AM,13669##9900##2417##1748,"4- Likely to contribute to gender equality, including across age groups",Implementation,119,PRJ_IMPL_RPT,183629.6655,5/8/2025 6:13:50 PM
23,2025 2nd Reserve Allocation: pilot consortium approach,CBPF-AFG-25-R-NGO-35391,,,2025,1,Human Rights Research and Advocacy Consortium,1,"Enhancing Protection, Economic Resilience, and Emergency Assistance for Vulnerable Populations in Helmand, Nimroz, and Zabul provinces",7/15/2025 12:00:00 AM,5/14/2026 12:00:00 AM,10 Months,603466.8,563987.6,0,5/4/2025 11:03:11 AM,800##800##3600##4200,"4- Likely to contribute to gender equality, including across age groups",Implementation,119,PRJ_IMPL_RPT,174175.4649,7/16/2025 4:20:31 PM
23,2025 3rd Reserve Allocation: Anticipatory Action: Drought,CBPF-AFG-25-R-NGO-35500,,,2025,1,Afghanistan National Urban and Rural Development Organization,1,Anticipatory WASH Response to Mitigate Drought Risks in Takhar Province,6/1/2025 12:00:00 AM,11/30/2025 12:00:00 AM,6 Months,461359.3,431176.9,0,4/29/2025 1:29:12 PM,3388##4330##3279##3864,"4- Likely to contribute to gender equality, including across age groups",Implementation,308,PRJ_UND_FINAL_RPT,183629.6655,6/4/2025 6:20:24 PM
23,2025 3rd Reserve Allocation: Anticipatory Action: Drought,CBPF-AFG-25-R-NGO-35506,,,2025,1,ORGANIZATION OF HUMAN WELFARE,1,Anticipatory Action for Drought: Strengthening Health and Nutrition Resilience in Sari Pul Province,6/4/2025 12:00:00 AM,1/31/2026 12:00:00 AM,"7 Months, 28 Days",254601.4,237945.2,0,4/29/2025 1:14:18 PM,9013##15997##4386##4716,"4- Likely to contribute to gender equality, including across age groups",Implementation,119,PRJ_IMPL_RPT,148721.8479,6/17/2025 8:09:22 PM
23,2025 3rd Reserve Allocation: Anticipatory Action: Drought,CBPF-AFG-25-R-NGO-35512,,,2025,1,Afghani Community and Health Rehabilitation Organization,1,"Provision of Health and  Nutrition Services to children of under 5 years, PLW in Pashtun Kit,  Khwaja Sabz Posh, Bilcheragh, Garzewan, Dawlat Abad, and Almar districts of Faryab Province.",7/1/2025 12:00:00 AM,12/31/2025 12:00:00 AM,6 Months,686095.1,641210.4,0,4/29/2025 11:54:47 AM,5074##5193##6961##6372,"4- Likely to contribute to gender equality, including across age groups",Implementation,308,PRJ_UND_FINAL_RPT,182902.4193,6/27/2025 1:54:14 PM
23,2025 3rd Reserve Allocation: Anticipatory Action: Drought,CBPF-AFG-25-R-NGO-35514,,,2025,1,Organization for Coordination of Humanitarian Relief,1,"Emergency Water, Sanitation, and Hygiene (WASH) Response for Communities at Risk of Drought in Sar-e-Pul Province.",6/10/2025 12:00:00 AM,12/9/2025 12:00:00 AM,6 Months,642107,600100,0,4/28/2025 7:15:24 AM,9460##9890##11180##12470,"3- Likely to contribute to gender equality, but without attention to age groups",Project Closure,250,PRJ_UND_AUD,170539.2339,6/11/2025 3:21:46 PM
23,2025 3rd Reserve Allocation: Anticipatory Action: Drought,CBPF-AFG-25-R-NGO-35538,,,2025,1,Afghan Women Rights Organization,1,Emergency Nutrition and Health Services to Drought Affected People in Badakhshan Province,6/15/2025 12:00:00 AM,12/14/2025 12:00:00 AM,6 Months,481880.8,450355.9,0,4/29/2025 2:16:59 PM,4000##20000##15360##16640,"4- Likely to contribute to gender equality, including across age groups",Implementation,308,PRJ_UND_FINAL_RPT,164721.2643,6/19/2025 6:08:15 PM
23,2025 3rd Reserve Allocation: Anticipatory Action: Drought,CBPF-AFG-25-R-NGO-35564,,,2025,1,Afghani Community and Health Rehabilitation Organization,1,"Provision of Health and Nutrition Services to children of under 5 years, Pregnant and Lactating Women in Suncharak, Suzmanqala, and Gosfandi of Sar-e pul and 5 target districts of Badakhshan province.",7/1/2025 12:00:00 AM,12/31/2025 12:00:00 AM,6 Months,647314.7,604967,0,4/29/2025 11:57:05 AM,3611##3695##4958##4536,"4- Likely to contribute to gender equality, including across age groups",Implementation,308,PRJ_UND_FINAL_RPT,182902.4193,6/27/2025 1:55:18 PM
23,5th Reserve Allocation Return,CBPF-AFG-25-R-NGO-37468,,,2025,1,Afghan Women's Educational Center,1,Provision of WASH Support for Returnees in Nangarhar,10/9/2025 12:00:00 AM,10/8/2026 12:00:00 AM,12 Months,699989.2,654195.5,0,9/21/2025 8:02:49 AM,2426##2330##1931##1931,"4- Likely to contribute to gender equality, including across age groups",Implementation,119,PRJ_IMPL_RPT,152721.7020,10/17/2025 5:26:02 PM
23,5th Reserve Allocation Return,CBPF-AFG-25-R-NGO-37472,,,2025,1,Women Activities and Social Service Association,1,Strengthening Health and Nutrition Services for Returnees and Vulnerable Communities in West Region (SHAN),11/15/2025 12:00:00 AM,11/14/2026 12:00:00 AM,12 Months,442496.3,413548,0,9/21/2025 1:02:44 PM,11313##63674##21689##23366,"4- Likely to contribute to gender equality, including across age groups",Implementation,119,PRJ_IMPL_RPT,177811.6959,11/13/2025 11:24:19 PM
23,5th Reserve Allocation Return,CBPF-AFG-25-R-NGO-37478,,,2025,1,Organization for Afghan Women Capacity & Knowledge,1,Sustainable Water and Sanitation Intervention in Balkh and Jawzjan Provinces,10/1/2025 12:00:00 AM,5/31/2026 12:00:00 AM,8 Months,697601.5,651964,0,9/21/2025 9:59:41 AM,8114##8114##5411##5411,"4- Likely to contribute to gender equality, including across age groups",Implementation,119,PRJ_IMPL_RPT,157448.8023,10/17/2025 5:26:45 PM
23,5th Reserve Allocation Return,CBPF-AFG-25-R-NGO-37502,,,2025,1,Relief Humanitarian Development Organization,1,Improve access to Integrated Primary Health Care and Nutrition Services for returnees and host communities in areas of returns at Paktia and Helmand provinces. ,11/15/2025 12:00:00 AM,9/14/2026 12:00:00 AM,10 Months,360035.6,336481.9,0,9/21/2025 11:53:27 AM,32712##30407##16466##11892,"4- Likely to contribute to gender equality, including across age groups",Implementation,119,PRJ_IMPL_RPT,155630.6868,11/7/2025 4:40:32 PM
23,6th Reserve allocation: EQ,CBPF-AFG-25-R-NGO-37533,,,2025,1,Health Disability and Development Organization,1,"Provision of Primary Healthcare, Physical rehabilitation, Assistive devices, Psychosocial counseling to the earthquake impacted communities of Kunar and Nangarhar (Chawki, Nurgal, Chapa Dara, darinoor",10/15/2025 12:00:00 AM,7/14/2026 12:00:00 AM,9 Months,248981.3,232692.8,0,9/21/2025 11:35:36 AM,5900##4100##3150##2700,"3- Likely to contribute to gender equality, but without attention to age groups",Implementation,119,PRJ_IMPL_RPT,181447.9269,10/21/2025 3:10:20 PM
23,5th Reserve Allocation Return,CBPF-AFG-25-R-NGO-37576,,,2025,1,Organization for People's Health in Action,1,Integrated primary health and nutrition services in the areas of return for returnees and host communities in Nangarhar and Laghman provinces,11/25/2025 12:00:00 AM,11/24/2026 12:00:00 AM,12 Months,641808.9,599821.4,0,9/21/2025 1:36:58 PM,31808##59072##11588##11132,"4- Likely to contribute to gender equality, including across age groups",Implementation,119,PRJ_IMPL_RPT,171630.1032,11/19/2025 7:42:05 PM
23,7th Reserve allocation - drought,CBPF-AFG-25-R-NGO-37702,,,2025,1,Organization for Coordination of Humanitarian Relief,1,"Emergency Water, Sanitation, and Hygiene (WASH) Response for Drought-Affected Communities in Sar-e-Pul Province",12/15/2025 12:00:00 AM,10/14/2026 12:00:00 AM,10 Months,691424.8,646191.4,0,10/19/2025 6:10:30 AM,11704##12236##13832##15428,"4- Likely to contribute to gender equality, including across age groups",Implementation,119,PRJ_IMPL_RPT,170539.2339,12/9/2025 8:25:38 PM
23,7th Reserve allocation - drought,CBPF-AFG-25-R-NGO-37723,,,2025,1,Organization for Coordination of Humanitarian Relief,1,Emergency Food and Agriculture Response for Drought-Affected Communities in Faryab Province,12/15/2025 12:00:00 AM,6/14/2026 12:00:00 AM,6 Months,491174.5,459041.6,0,10/19/2025 10:03:55 AM,2729##2903##3310##3658,"3- Likely to contribute to gender equality, but without attention to age groups",Implementation,119,PRJ_IMPL_RPT,170539.2339,12/9/2025 8:26:26 PM
23,7th Reserve allocation - drought,CBPF-AFG-25-R-NGO-37727,,,2025,1,Demining Agency For AFghanistan,1,Response to Urgent Mine Action Requests and Provision of EORE to Impacted Communities in Northern Region of Afghanistan,12/21/2025 12:00:00 AM,12/20/2026 12:00:00 AM,12 Months,200000,186915.9,0,10/19/2025 5:04:25 AM,9323##7925##15850##13519,"4- Likely to contribute to gender equality, including across age groups",Implementation,119,PRJ_IMPL_RPT,143631.1245,12/16/2025 6:47:01 PM
23,7th Reserve allocation - drought,CBPF-AFG-25-R-NGO-37735,,,2025,1,Women for Afghan Women Organization,1,Women Protection against GBV in Drought-Affected Areas of the North Region,1/1/2026 12:00:00 AM,12/31/2026 12:00:00 AM,12 Months,324013.1,302816,0,10/19/2025 10:30:23 AM,964##2525##643##1312,"4- Likely to contribute to gender equality, including across age groups",Disbursement,118,PRJ_DISBURSEMENT,201083.5743,12/17/2025 6:50:42 PM
23,7th Reserve allocation - drought,CBPF-AFG-25-R-NGO-37748,,,2025,1,Asia Community Development Organization,1,Life-Saving WASH Support to Mitigate the Impact of the Worsening Drought in Samangan,12/1/2025 12:00:00 AM,9/30/2026 12:00:00 AM,10 Months,693056.5,647716.4,0,10/19/2025 11:26:46 AM,7553##6970##19420##17927,"4- Likely to contribute to gender equality, including across age groups",Implementation,119,PRJ_IMPL_RPT,185811.4041,12/4/2025 6:26:40 PM
23,7th Reserve allocation - drought,CBPF-AFG-25-R-NGO-37749,,,2025,1,Afghanistan Blinds Management,1,Enhancing Household Food Security through Emergency Agriculture and Food Support in Sar-e Pul Province,12/1/2025 12:00:00 AM,5/31/2026 12:00:00 AM,6 Months,499815,467116.8,0,10/19/2025 10:33:45 AM,5085##6216##9644##10450,"4- Likely to contribute to gender equality, including across age groups",Implementation,119,PRJ_IMPL_RPT,205083.4284,12/4/2025 6:28:48 PM
23,7th Reserve allocation - drought,CBPF-AFG-25-R-NGO-37751,,,2025,1,Hand in Hand Afghanistan Organization,1,Provision of immediate humanitarian assistance in response to the worsening drought in Badakhshan,12/7/2025 12:00:00 AM,8/6/2026 12:00:00 AM,8 Months,537959.8,502766.2,0,10/19/2025 9:30:39 AM,3400##3400##8500##8500,"3- Likely to contribute to gender equality, but without attention to age groups",Implementation,119,PRJ_IMPL_RPT,172357.3494,12/4/2025 6:25:12 PM
23,7th Reserve allocation - drought,CBPF-AFG-25-R-NGO-37854,,,2025,1,Vision Development Organization,1,"In-Kind Food and Vegetable Kits Support in Ali Abad, Chahar Darah, and Khan Abad Districts of Kunduz Province",1/1/2026 12:00:00 AM,6/30/2026 12:00:00 AM,6 Months,485780.4,454000.4,0,10/19/2025 12:56:09 PM,5170##5604##8436##9140,"4- Likely to contribute to gender equality, including across age groups",Disbursement,118,PRJ_DISBURSEMENT,193083.8661,1/3/2026 2:12:40 AM
23,7th Reserve allocation - drought,CBPF-AFG-25-R-NGO-37868,,,2025,1,Bakhtar Development Network,1,Provision of Emergency Food and Vegetable Kits in three Districts of Samangan Province and Nutrition treatment services in two districts of Balkh and two districts of Kunduz province,12/3/2025 12:00:00 AM,8/2/2026 12:00:00 AM,8 Months,562092.8,525320.4,0,10/19/2025 11:39:45 AM,5109##5535##7667##8303,"4- Likely to contribute to gender equality, including across age groups",Implementation,119,PRJ_IMPL_RPT,159266.9178,12/9/2025 8:24:14 PM
23,7th Reserve allocation - drought,CBPF-AFG-25-R-NGO-38015,,,2025,1,Faradata Social Chang and Women Empowerment Organization,1,"Supporting Drought-Affected and Vulnerable Households in Herat Province through Emergency Food, and Agriculture Assistance",12/15/2025 12:00:00 AM,6/14/2026 12:00:00 AM,6 Months,491626.6,459464.1,0,10/19/2025 8:07:52 AM,6097##6097##8847##8849,"4- Likely to contribute to gender equality, including across age groups",Disbursement,118,PRJ_DISBURSEMENT,199265.4588,12/17/2025 8:33:30 PM
23,2025 1st Reserve Allocation,CBPF-AFG-25-R-UN-35077,,,2025,1,United Nations Population Fund,3,"Enhancing  access to lifesaving health, including reproductive health care services for women, girls, boys, and men in the four under-served districts",5/18/2025 12:00:00 AM,5/17/2026 12:00:00 AM,12 Months,448006.6,418697.7,0,3/20/2025 12:24:01 PM,8400##50400##8400##16800,"3- Likely to contribute to gender equality, but without attention to age groups",Implementation,119,PRJ_IMPL_RPT,50179.9878,5/28/2025 9:20:19 AM
23,2025 1st Reserve Allocation,CBPF-AFG-25-R-UN-35078,,,2025,1,World Health Organization,3,"Provision of Lifesaving Primary Healthcare, IPD-SAM Services and Communicable Surveillance and Disease Case Management in Underserved Communities",6/15/2025 12:00:00 AM,6/14/2026 12:00:00 AM,12 Months,1389734,1298817,0,3/20/2025 9:00:06 AM,28144##35965##13240##13340,"3- Likely to contribute to gender equality, but without attention to age groups",Implementation,119,PRJ_IMPL_RPT,54907.0881,6/17/2025 8:05:06 PM
23,2025 1st Reserve Allocation,CBPF-AFG-25-R-UN-35088,,,2025,1,International Organization for Migration,3,Saving lives of vulnerable populations through the provision of critical shelter and WASH assistance in underserved areas of Afghanistan,5/4/2025 12:00:00 AM,5/3/2026 12:00:00 AM,12 Months,1721024,1608433,0,3/20/2025 1:18:48 PM,25885##26934##31615##30802,"4- Likely to contribute to gender equality, including across age groups",Implementation,119,PRJ_IMPL_RPT,23999.1246,5/22/2025 1:49:25 PM
23,2025 1st Reserve Allocation,CBPF-AFG-25-R-UN-35122,,,2025,1,United Nations High Commissioner for Refugees,3,Provision of critical protection and shelter assistance to vulnerable populations,4/29/2025 12:00:00 AM,4/28/2026 12:00:00 AM,12 Months,1158712,1087992,0,3/20/2025 12:19:52 PM,6545##7207##2501##2153,"4- Likely to contribute to gender equality, including across age groups",Implementation,119,PRJ_IMPL_RPT,51634.4802,5/6/2025 7:49:18 PM
23,2025 1st Reserve Allocation,CBPF-AFG-25-R-UN-35143,,,2025,1,United Nations Children's Fund,3,"Provision of humanitarian WASH assistance in underserved communities in Kandahar and Hilmand Provinces of Afghanistan (Daman, Kandahar, Lashkargah, Nahr-e-saraj and Spin Boldak)",6/15/2025 12:00:00 AM,6/14/2026 12:00:00 AM,12 Months,694046.4,648641.4,0,3/20/2025 9:31:33 AM,4474##4356##5782##5388,"4- Likely to contribute to gender equality, including across age groups",Implementation,119,PRJ_IMPL_RPT,51998.1033,6/24/2025 1:40:09 PM
23,2025 1st Reserve Allocation,CBPF-AFG-25-R-UN-35220,,,2025,1,United Nations Human Settlements Programme (UN-HABITAT),3,Improving access to information through HLP rights documentation project,5/11/2025 12:00:00 AM,5/10/2026 12:00:00 AM,12 Months,297331.5,277879.9,0,3/20/2025 12:37:17 PM,15119##14281##6720##5880,"4- Likely to contribute to gender equality, including across age groups",Implementation,119,PRJ_IMPL_RPT,170175.6108,5/8/2025 6:14:58 PM
23,2025 2nd Reserve Allocation: pilot consortium approach,CBPF-AFG-25-R-UN-35625,,,2025,1,UN Women,3,Leadership in Action: A Consortium for Women-Led Humanitarian Action in Afghanistan,8/18/2025 12:00:00 AM,8/17/2026 12:00:00 AM,12 Months,799807.1,747483.3,0,5/4/2025 2:04:50 PM,441##4530##1764##2205,"4- Likely to contribute to gender equality, including across age groups",Implementation,119,PRJ_IMPL_RPT,125449.9695,9/29/2025 7:15:02 PM
23,2025 4th Reserve Allocation: Border Response,CBPF-AFG-25-R-UN-35631,,,2025,1,International Organization for Migration,3,"Responding to the Humanitarian, Protection, and Health Needs of Undocumented Afghan Returnees at Border Points in Afghanistan ",8/1/2025 12:00:00 AM,7/31/2026 12:00:00 AM,12 Months,3200000,2990654,0,5/18/2025 12:49:46 PM,68282##21140##52189##24334,"4- Likely to contribute to gender equality, including across age groups",Implementation,119,PRJ_IMPL_RPT,23999.1246,8/19/2025 5:44:29 PM
23,2025 4th Reserve Allocation: Border Response,CBPF-AFG-25-R-UN-35678,,,2025,1,United Nations High Commissioner for Refugees,3,Emergency Assistance for Return and Transportation for Refugees and Persons Living in Refugee-like Situations Retuning from Iran and Pakistan,6/15/2025 12:00:00 AM,6/14/2026 12:00:00 AM,12 Months,2300158,2159773,0,5/18/2025 1:05:20 PM,12852##12852##16943##15773,"4- Likely to contribute to gender equality, including across age groups",Implementation,119,PRJ_IMPL_RPT,51634.4802,7/7/2025 7:28:38 PM
23,2025 1st Standard allocation: Localization support,CBPF-AFG-25-S-NGO-35643,,,2025,2,Organization for Afghan Women Capacity & Knowledge,1,Sustainable Water and Sanitation Intervention in Balkh Province ,8/1/2025 12:00:00 AM,3/31/2026 12:00:00 AM,8 Months,498533.2,465918.9,0,5/26/2025 7:33:29 AM,6300##6300##4200##4200,"4- Likely to contribute to gender equality, including across age groups",Reporting,31,PRJ_IMPL_RPT,157448.8023,7/25/2025 3:13:29 PM
23,2025 1st Standard allocation: Localization support,CBPF-AFG-25-S-NGO-35644,,,2025,2,Bakhtar Development Network,1,Support delivery of primary health care and Nutrition service in highly affected underserved areas (white areas) and areas with acute emergencies of Kunduz province,8/1/2025 12:00:00 AM,5/31/2026 12:00:00 AM,10 Months,215719.5,201607.1,0,5/27/2025 7:25:49 AM,8631##8292##10132##9735,"4- Likely to contribute to gender equality, including across age groups",Reporting,31,PRJ_IMPL_RPT,159266.9178,8/6/2025 2:58:46 PM
23,2025 1st Standard allocation: Localization support,CBPF-AFG-25-S-NGO-35646,,,2025,2,Society Educational Awareness Research Consultancy and Health Organization,1,Water Supply and Hygiene Promotion Project in Kunar Province,8/1/2025 12:00:00 AM,3/31/2026 12:00:00 AM,8 Months,484967.1,453240.3,0,5/26/2025 5:21:50 PM,6203##6204##4139##4139,"4- Likely to contribute to gender equality, including across age groups",Reporting,31,PRJ_IMPL_RPT,168721.1184,8/1/2025 1:47:01 PM
23,2025 1st Standard allocation: Localization support,CBPF-AFG-25-S-NGO-35679,,,2025,2,Afghan Women's Educational Center,1,Integrated Protection and WASH Response for Returnees and Vulnerable Populations in Behsud and Surkh Rod districts of Nangarhar Province. ,8/1/2025 12:00:00 AM,7/31/2026 12:00:00 AM,12 Months,268015.8,250482,0,5/22/2025 9:40:52 AM,2196##3714##1520##2120,"4- Likely to contribute to gender equality, including across age groups",Reporting,31,PRJ_IMPL_RPT,152721.7020,7/30/2025 1:35:28 PM
23,2025 1st Standard allocation: Localization support,CBPF-AFG-25-S-NGO-35761,,,2025,2,Afghani Community and Health Rehabilitation Organization,1,Integrated Nutrition and Health Response for Vulnerable Women and Children in Kandahar Province,8/1/2025 12:00:00 AM,7/31/2026 12:00:00 AM,12 Months,685547.8,640698.9,0,5/27/2025 10:49:47 AM,3956##5036##16187##10790,"4- Likely to contribute to gender equality, including across age groups",Reporting,31,PRJ_IMPL_RPT,182902.4193,8/28/2025 3:53:15 PM
23,2025 1st Standard allocation: Localization support,CBPF-AFG-25-S-NGO-35763,,,2025,2,ORGANIZATION OF HUMAN WELFARE,1,Multi-sectoral Lifesaving Primary Healthcare and Nutrition Services in Underserved communities in Kandahar and Daikundi,8/1/2025 12:00:00 AM,6/30/2026 12:00:00 AM,11 Months,714614.6,667864.1,0,5/27/2025 1:03:55 PM,8598##18272##15909##28640,"4- Likely to contribute to gender equality, including across age groups",Reporting,31,PRJ_IMPL_RPT,148721.8479,8/29/2025 1:39:54 PM
23,2025 1st Standard allocation: Localization support,CBPF-AFG-25-S-NGO-35764,,,2025,2,Afghan Youth Services Organization,1,"provision of in-kind Food assistance to IPC Phase 3 and 4 the most vulnerable communities of Jawand, Qades, and Qala-e- Naw distracts of Badghis province ",7/15/2025 12:00:00 AM,1/14/2026 12:00:00 AM,6 Months,484707.1,452997.3,0,5/27/2025 9:05:53 AM,3572##3232##5273##4933,"4- Likely to contribute to gender equality, including across age groups",Reporting,307,PRJ_UND_FINAL_RPT,182175.1731,7/16/2025 4:18:31 PM
23,2025 1st Standard allocation: Localization support,CBPF-AFG-25-S-NGO-35778,,,2025,2,Health Disability and Development Organization,1,"In-kind Food assistance for the shocked-affected people in Nuristan  Province Wama, Mandol and Bargimatal Districts ",7/20/2025 12:00:00 AM,2/19/2026 12:00:00 AM,7 Months,496653.9,464162.5,0,5/27/2025 11:09:16 AM,2532##3096##3799##4643,"4- Likely to contribute to gender equality, including across age groups",Reporting,31,PRJ_IMPL_RPT,181447.9269,7/16/2025 4:19:56 PM
23,2025 1st Standard allocation: Localization support,CBPF-AFG-25-S-NGO-35787,,,2025,2,Asia Community Development Organization,1,Enhancing Community Resilience through Integrated WASH Interventions in Nangarhar Province,8/1/2025 12:00:00 AM,4/30/2026 12:00:00 AM,9 Months,776249.8,725467,0,5/27/2025 12:53:28 PM,5612##5181##14435##13328,"4- Likely to contribute to gender equality, including across age groups",Reporting,31,PRJ_IMPL_RPT,185811.4041,7/29/2025 2:17:14 PM
